PostID,CommentID,Text,Toxicity,Rationality,Mutual Respect,Emotion,Moderator,Diversity
post_7,post_7_0,"""Anthropology Conference Drops a Panel Defending Sex as Binary""",0.1640979864706541,0.3334187865257263,0.4995843768119812,0.0006653666496276,0,1
post_7,post_7_0,"[Anthropology Conference Drops a Panel Defending Sex as Binary](https://www.nytimes.com/2023/09/30/us/anthropology-panel-sex-binary-gender-kathleen-lowery.html)


Ironically just the archaeologic and forensic anthropology gives a sh*t about genders - its results are strictly and unequivocally bound to biological definition of binary sex from apparent reason: there are no LGBT or transgender teeth or skeletons - only men / women ones, as no one can ask them how sexually confused they can feel.. See also:

[No Place For Transphobia in Anthropology: Session pulled from Annual Meeting program](https://www.reddit.com/r/ScienceUncensored/comments/16xij4b/no_place_for_transphobia_in_anthropology_session/)",0.11987394033437,0.0090546607971191,0.4991758465766907,4.4286251068115234e-05,1,1
post_7,post_7_0_1,"To say that there are no lgbt skeletons is disingenuous; even if we can’t tell which ones were heterosexual or homosexual, there have been lgbt people throughout human history. Also, it would be best to drop the phraseology “sexually confused” from your vernacular.",0.1403589380812296,0.0397810935974121,0.4997588396072387,0.0003696382045745,0,1
post_7,post_7_1,"Actual title of the panel:  “Let’s Talk About Sex Baby: Why Biological Sex Remains a Necessary Analytic Category in Anthropology.”

This is political correctness run amok.",0.1183340804136338,0.3170456886291504,0.4959279298782348,0.0013994574546813,0,1
post_7,post_7_1_1,"its actually postmodernism run amok

in the 70's when a mummy was found to have died from tuberculosis they very earnestly argued that that was impossible because TB is a 'modern western medical construct'

you can't make this up, postmodernism has no reference to reality, they really believe that literally everything is a social construct, even matter

this is what happens when art critics think they are scientists and philosophers

what is astounding is how many young liberals believe the nonsense that these old white and very very creepy men were spouting",0.2305757548962705,0.0067707300186157,0.3250964879989624,0.0005130767822265,0,1
post_7,post_7_1_1_1,">tuberculosis they very earnestly argued that that was impossible because TB is a 'modern western medical construct'

Where'd you see this?",0.0271122200724141,0.0077985525131225,0.4997589588165283,5.5909156799316406e-05,0,1
post_7,post_7_1_1_1_1,"Peter Bogosian has mentioned it on the Sitch and Adam Show.

Also check out Fashionable Nonsense: Postmodern Intellectuals' Abuse of Science by Alan Sokal and Jean Bricmont.",0.0651983220015478,0.0628021359443664,0.4995829463005066,0.7600699663162231,0,1
post_7,post_7_1_1_1_1_1,">Peter Bogosian has mentioned it on the Sitch and Adam Show.

So a guy with a history of stretching the truth said so on a internet show. 

Coolio.",0.0316442324942469,0.0357263684272766,0.4995496869087219,0.1996821165084839,0,0
post_7,post_7_1_1_1_1_1_1,Don’t know why you’re being downvoted when all you’ve asked for is evidence in a science sub and all you got was hearsay.,0.0310177339132924,0.3318079113960266,0.4965956509113312,0.0001425445079803,0,1
post_7,post_7_1_1_1_1_1_1_1,"We both know why. 

This sub isn't based on evidence, just another sub that started small and smart; with a purpose. Then got infiltrated by partisans.",0.0379001628777478,0.3882619142532348,0.4994968473911285,0.0007846057415008,0,0
post_7,post_7_1_1_1_1_1_1_1_1,"This sub was never smart, it was always a tool to spread misinformation and distrust in science and academia. That's why multiple mods of this sub have been banned sitewide for spreading misinformation and hate.

Banned for this statement of fact, so ""uncensored""",0.0757621388326604,0.1508741378784179,0.4996612071990967,5.155801773071289e-05,0,1
post_7,post_7_1_1_1_1_1_1_1_2,I suppose I was being cute and totally agree.,0.0232737715782147,0.4283455014228821,0.4987275302410126,0.0675128102302551,0,0
post_7,post_7_1_1_1_1_1_1_1_2_1,"I totally agree too. 

You were being cute.",0.0242744219319136,0.7824376821517944,0.2670287489891052,0.9655783772468568,0,0
post_7,post_7_1_1_1_1_1_1_2,this is not a science sub lol,0.0504158957457089,0.7012683153152466,0.4991597235202789,0.0029139816761016,0,1
post_7,post_7_1_1_1_1_1_2,"Aw come now, don't blue ball me. Give me an example of Bogosian ""stretching the truth"".

What's the point of this reply? Someone asked a question and I answered.

>on a internet show. 

Oh I totally forgot only telegrams are trustworthy. As if this is some sort of criticism...

A+ contribution all around.",0.1641638930676636,0.5188857913017273,0.4992438554763794,0.0444474816322326,0,0
post_7,post_7_1_1_1_2,"It was Latour 

I think I saw it referenced by Chomsky in one of his tirades against postmodernism, but it could have been Hicks, or Dawkins, or Paglia, or Peterson, Finkleman or Hitchens, or Maher.

Imagine something so shite that it brings that gang together.

It is also referenced here, in an article that everyone concerned with this subject should read. Its an old link but it checks out...

[https://physics.nyu.edu/sokal/nagel.html](https://physics.nyu.edu/sokal/nagel.html)

Note that this was from the 90's, and also note how mocking the tone is because no one EVER thought that they would gain traction ever again after they declared *consent* to be a repressive social construct and started appearing in court to defend paedophiles.

[https://en.wikipedia.org/wiki/French\_petitions\_against\_age\_of\_consent\_laws](https://en.wikipedia.org/wiki/French_petitions_against_age_of_consent_laws)

Again, very, very creepy men... 

I will leave it at that, I think these people speak for themselves.",0.1209433259657309,0.010914146900177,0.4981091320514679,3.8564205169677734e-05,0,0
post_7,post_7_1_1_1_2_1,"I'll have to read through this. I appreciate the indepth answer. 

I do think it's strange/a bit funny that the 3 people that gave answers, all gave different ones. 0 overlap.",0.0241922253959405,0.2214949131011963,0.4996622800827026,0.0029712915420532,0,0
post_7,post_7_1_1_1_3,"I don't have a link right now, only to a bunch of tertiary articles about it, but the guy who claimed it couldn't have been TB was Bruno Latour",0.0257487747721322,0.7489202618598938,0.4996802508831024,0.0015525221824645,0,1
post_7,post_7_1_1_2,"Nailed it. Social sciences love crying foul when the natural sciences apply the same objective lens from our work to theirs. When they do it, we get this.",0.0263001718383235,0.3854563236236572,0.1069299578666687,0.9997079372406006,0,1
post_7,post_7_1_2,"I don't really see the controversy. 

Biological sex is binary, gender is a social construct.

Women have two x chromosomes, men have one x, and one Y.

Being upset about this statement, is like being upset the moon is not made of cheese.

Nothing about this is threatening trans people. If anything, anthropologists would be their ally, in researching alternative gender roles.",0.0722344692187527,0.3205659389495849,0.4997490048408508,4.035234451293945e-05,0,1
post_7,post_7_1_2_1,Sex and gender used to be the same thing until recent times. There are no masculine women or feminine men anymore. They must have their own special label.,0.081005546886538,0.3895608782768249,0.4997330605983734,0.9965513944625854,0,1
post_7,post_7_1_2_2,"Biological sex isn't binary. Inter-sex people exist. People can have three Xs, XXY, XXYY, and many others. 

I'm not saying sex and sexual dimorphism isn't important to anthropology, but there is more complexity that should be taken into account.",0.0807570023641354,0.6343398690223694,0.4997442364692688,0.9900285601615906,0,1
post_7,post_7_2,"“No scientific merit”

XX = female 
XY = male 

Anything else (genetic disorders like XXY, YYX etc) represent less than 1% of 1% of the general public. 

There are only two human genders, & people with mental disabilities",0.1668879088577292,0.0527526140213012,0.4994631111621856,1.1861324310302734e-05,0,1
post_7,post_7_2_1,"I agree with you but  don't use chromosomes, because some activist is gonna point to exceptions.

That's why I use ""active SRY""

Active SRY gene = male

No active SRY gene = female",0.0275909772344655,0.2887231111526489,0.4995945394039154,0.0004810094833374,0,1
post_7,post_7_2_1_1,"Don’t stoop to their level. There is no room for opinions in science, only facts",0.0606638946580008,0.005630075931549,0.4997256696224212,0.1304638385772705,0,0
post_7,post_7_2_1_2,"Chimeras, intersex and single chomosome people?",0.3307272155083399,0.0297600626945495,0.4870949387550354,0.0302556455135345,0,1
post_7,post_7_2_1_2_1,"So the thing with intersex  is that a lot of people with the condition still predominantly lean one way or another. It's normally a male with a small penis, or a female with an abnormally large clitoris, and other fairly minute differences from the normal anatomy. Very rarely does it ever manifest the way people think intersex manifests.",0.3035474870961983,0.0461771488189697,0.4997367560863495,0.0024442970752716,0,1
post_7,post_7_2_1_2_1_1,"Yep, more than half of intersex people are still categorized as male or female.

The second thing is that while intersex exists, hermaphroditism does not.",0.2773379875981406,0.1488251686096191,0.4997590780258178,0.0182456076145172,0,0
post_7,post_7_2_1_2_1_2,"https://thefocusfoundation.org/x-y-chromosomal-variations/  
  
https://www.britannica.com/science/chimera-genetics  
  
[https://www.britannica.com/science/intersex](https://www.britannica.com/science/intersex)  


Again, doesn't mean they are not real and undeserving of a name.",0.0263287730218589,0.008682370185852,0.4996948838233948,9.894371032714844e-06,0,0
post_7,post_7_2_1_2_2,"Rare outliers dont make sex functionally non-binary. We know how sex is determined and that is a binary (yes or no) signal of a particular gene. 

In biology we tend to describe things as part of the norm. Humans have one head, two arms, two legs and are either male or female. Just because it's possible to be born with more or less arms than two, we dont describe humans as having anywhere from 0 to 4 arms.

When sex falls outside that binary it's because some normal part of development did not function as it should have.",0.0397175976696187,0.0123295783996582,0.4997390806674957,4.0590763092041016e-05,0,1
post_7,post_7_2_1_2_2_1,[deleted],0.0260687223098937,0.8900734782218933,0.4747309684753418,0.0003655850887298,0,0
post_7,post_7_2_1_2_2_1_1,"[https://thefocusfoundation.org/x-y-chromosomal-variations/](https://thefocusfoundation.org/x-y-chromosomal-variations/)  


[https://www.britannica.com/science/chimera-genetics](https://www.britannica.com/science/chimera-genetics)  


https://www.britannica.com/science/intersex",0.0258456051891716,0.0066755414009094,0.4993878304958343,0.8390755653381348,0,0
post_7,post_7_2_1_2_2_2,"""as it should"" sounds very subjective imo.  


https://thefocusfoundation.org/x-y-chromosomal-variations/  
  
https://www.britannica.com/science/chimera-genetics  
  
[https://www.britannica.com/science/intersex](https://www.britannica.com/science/intersex)  


Yeah and its less than 0.01% of people. We need words to describe them. Why people are so offended by natural variance and use of language is stunning to me. Should we just not use words to describe variance and play pretend? Or can we give them a name and let them be that? Or better yet, let them name themselves.",0.0283497162385556,0.006611943244934,0.4996097087860107,1.8596649169921875e-05,0,0
post_7,post_7_2_1_2_2_2_1,"As it should isn't subjective, it's based on whether or not parts development happened in accordance with their proper function. I'm sure even you can admit that when someone is born with one arm, something went wrong.

We already have words to describe them, intersex is about as accurate as it gets. The issue isn't with these people existing or us acknowledging the existence of their conditions. It's the attempt to use these very rare outliers to push a weird agenda of labeling something like sex as being non-binary. I'm concerned with people warping reality to suit their political agendas and how the scientific community is allowing it.",0.030171174520244,0.0111125111579895,0.4997559189796448,0.0004654824733734,0,0
post_7,post_7_2_1_2_2_2_1_1,"So you are pro laws that prevent people with one arm from participating in sports or defining where they go to the bathroom? Should we not teach about one armed people in schools? Should we ban books and television shows with disabled characters? There is a historical precedence for that and it frightens people...

Its not a weird agenda at all my dude. Its the APA that changed it from a disorder to not a disorder in 2019 and our society is trying to adapt and normalize. Much like when they removed homosexual as a disorder in 1969 and folks made the same kinds of arguments against their integration too.

If it doesn't impact how you describe yourself or feel about yourself then it doesn't matter.",0.345590627006137,0.0148941278457641,0.4940881133079529,1.1801719665527344e-05,0,0
post_7,post_7_2_1_2_2_2_1_1_1,"Where did I say I supported any of those things? The ONLY thing I'm concerned with is twisting science to fit a political agenda. The APA and the DSM-V is an entirely separate discussion, but notably relevant to the politicization of science.",0.0238696944431038,0.0786369442939758,0.4997787773609161,0.8316974639892578,0,0
post_7,post_7_2_1_2_2_2_1_1_1_1,"certain people also like to point to homosexuality being taken off of the DSM as a sign of the politicization of science, because their politics demand that gay people be recognized as disordered.",0.316326237204419,0.3195586800575256,0.4997701048851013,0.0039174556732177,0,1
post_7,post_7_2_1_2_2_2_1_1_1_1_1,"The most widely accepted definition of mental illness/disorder is any persistent or recurring mental state that causes distress to the individual or urges to harm oneself or others. By this definition, unless you have a warped view of homosexuality being somehow harmful to others, it makes sense for it not to be included among disorders or illnesses.

However if you take something like gender dysphoria which causes ample distress to the sufferer, then it's clear that it should be included, but isn't. This is an example of politicization, trying to escape the label of mental illness. At the end of the day, psychology is very far from a unified and empirically sound field of study so not everyone even agrees on that basic definition. The sad part is we should be trying to eliminate that stigma rather than escape the label.",0.0558623454831325,0.1710302233695984,0.4997487664222717,9.384751319885254e-05,0,0
post_7,post_7_2_1_2_2_2_1_1_1_1_1_1,"If you do an honest evaluation of someone suffering from gender dysphoria, and the processs of transition alleviates that dysphoria, how can you say that the trans individual is mentally disordered if the cause of their disorder is alleviated?  Gender dysphoria has criterion to follow in the DSM-V, being trans does not.",0.1022875380297928,0.0952130556106567,0.4997664093971252,0.7844793200492859,0,0
post_7,post_7_2_1_2_2_2_1_1_1_1_1_1_1,"Well transitioning is the therapy, so let me answer that with a question. 

If someone with depression is treated with antidepressants and they aren't depressed while on them, are they still mentally ill? It kinda depends on how you define the pathology. If we stopped treatment in either one of those cases would that person revert back to suffering? Probably. Or is a diabetic still diabetic if its controlled with insulin? I would say yes.",0.0800757640397538,0.4859559535980224,0.4997347295284271,0.9957472681999208,0,0
post_7,post_7_2_1_2_2_2_1_1_1_1_1_1_1_1,"A therapy can result in a disorder being cured, or it can result in treating symptoms but not cure the underlying cause.  Anti-depressants treat the symptoms and cannot cure the underlying cause, whether that cause be a genetically based neuroendocrine imbalance or a more life situational basis where introduction of other treatment modalities like CBT can produce longer term results.  Transition ostensibly looks to be the former, where by itself alleviation of dysphoria is achieved.  Is a cancer patient given a therapy that clears the tumor still a cancer patient after treatment?  By your logic, yes, even though its patently absurd given the tumor burden is gone.",0.0339282563151653,0.0202311873435974,0.4997673034667969,0.1039920449256897,0,0
post_7,post_7_2_1_2_2_2_1_1_1_1_1_1_1_1_1,"Cancer is a different case, dont you think? Yes, if you can cut out the source of an ailment, then of course you would be cured. But that isn't what happens in the treatment of gender dysphoria. 

Transitioning doesn't cure the cause, it just temporarily alleviates symptoms of dysphoria. If a person stops transitioning, they will continue to experience gender dysphoria, I'm sure you would agree. Transitioning as a treatment for gender dysphoria is more akin to taking antidepressants for depression than it is cutting out a tumor. Much like how the treatment for bipolar disorder that didnt respond well to medication is to just try and live a healthy lifestyle. That doesn't cure their condition, but can help alleviate the extremes of manic and depressive states.",0.0805252605911741,0.0963767766952514,0.4997450709342956,0.0127612650394439,0,0
post_7,post_7_2_1_2_2_2_1_1_1_1_1_2,"Dysphoria was removed? Strange, I still learned about it in psychology class.",0.0291904393604123,0.0525315403938293,0.4996969103813171,0.0006913542747497,0,1
post_7,post_7_2_1_2_2_2_1_1_1_2,"That's what the discussion is my dude. Its being politicized and weaponized to ban and inhumane people. In some US states they passed laws allowing gym teachers and sports coaches to check out girls coochies to make sure they are ""actually girls""

We have to fight back. Our rights are being eroded for hate. Its already politicized, what can we do? The science says the best thing to do is accept people and leave them be, Which is my political philosophy. Sadly the party supposed to represent that is creating a cultural war as they swing towards extremism.

The last time a western nation passed similar laws was 1938 Germany... Now several US states. Banning and burning books, limiting educational content, controlling who does what where and genital inspections. Its fucking disgusting and I'm sure you agree. What choice do we have but to politicize it right back? For evil to win all we have to do is sit back and say nothing.

All over a simple change to the literature. I'm sure politicizing gay rights in 69 and civil rights in 76 made a lot of people uncomfortable too. What choice do we have in the face of segregation and religious rule?

So every time someone says ""they aren't real"" or ""don't deserve equal treatment"" we get riled up! The discussion is more than the one liners and buzz words and marketing. There is a claim right now that Ukranian's are not real and therefore deserve their freedoms and political decisions taken from them. Same shit, different place.  


I don't know much about social studies or gender studies but I know more than enough biology to account for a small number of people bein several deviations from the norm. Its a statistical reality smaller than a rounding error. As populations grow into the billions there are enough to form communities.  


Most rural towns and schools have none in their regions or cities. Huckabee Sanders, a loud proponent has exactly 0 openly tans people in the school district in her state. 1 had graduated in the last 10 years... Its such a nothing burger issue.",0.6341857139176533,0.0085722208023071,0.0016328692436218,2.014636993408203e-05,0,0
post_7,post_7_2_1_2_2_2_1_1_1_2_1,"This is the wrong hill to die on in the name of Liberty.  In fact there is a case to be made that the rise in Conservative authoritarian policies are in part in retaliation to progressives twisting reality to fit their own goals.  Neither side is right, but this is what happens when people throw out the truth and vilify anyone who denies them.",0.063629728538759,0.2339691519737243,0.4997754395008087,0.0013200938701629,0,0
post_7,post_7_2_1_2_2_2_1_1_1_2_1_1,"Villify anyone who denies them is the MO of the right... They use that projection technique a lot. They deny literally everything they don't like and then accuse the opposition of what they do.

Taking away our children's rights, privacy, bodily autonomy and free speech isn't the hill to die on? Should we not have the right to read and study what we like? Why do religious folks get a free pass to dictate their nonsense on others? 

Where is the line then? Destroying rights and free speech is kind of not negotiable to me. Sounds like doublethink and doublespeak to me.",0.1565320211617331,0.0125349760055542,0.4980011284351349,6.133317947387695e-05,0,0
post_7,post_7_2_1_2_2_2_1_1_1_2_1_1_1,">Villify anyone who denies them is the MO of the right... They use that projection technique a lot. They deny literally everything they don't like and then accuse the opposition of what they do. 

Absolutely wrong. This is the primary tactic used by BOTH SIDES in the modern political climate.

I meant the designation of sex as binary or non-binary is not the hill to die on. Book bans and abortion rights are and if it was happening in my country I'd be raising the pitchforks. But this is how the conservatives get empowered to enact authoritarian policies, by misrepresenting the facts to further your agenda you're giving them the ammunition they need to discredit you.",0.0714227520219746,0.0105913877487182,0.4995765089988708,0.0116856396198272,0,0
post_7,post_7_2_1_2_2_2_1_1_1_2_1_1_1_1,"I'm not misinterpreting facts. This is a regular occurrence in the news.

[https://kansasreflector.com/2023/04/09/kansas-anti-trans-sports-law-opens-door-for-genital-inspections-of-kids-thats-the-simple-truth/](https://kansasreflector.com/2023/04/09/kansas-anti-trans-sports-law-opens-door-for-genital-inspections-of-kids-thats-the-simple-truth/)

[https://ohiocapitaljournal.com/2022/06/17/after-backlash-gop-leader-says-genital-inspections-wont-be-part-of-anti-trans-athlete-bill/](https://ohiocapitaljournal.com/2022/06/17/after-backlash-gop-leader-says-genital-inspections-wont-be-part-of-anti-trans-athlete-bill/)

[https://www.nbcnews.com/nbc-out/out-news/florida-school-districts-removed-roughly-300-books-last-school-year-rcna104367](https://www.nbcnews.com/nbc-out/out-news/florida-school-districts-removed-roughly-300-books-last-school-year-rcna104367)

[https://bookshop.org/lists/books-banned-in-florida-and-texas-in-2022](https://bookshop.org/lists/books-banned-in-florida-and-texas-in-2022)

&#x200B;

[https://www.nytimes.com/2023/04/22/books/book-ban-florida.html](https://www.nytimes.com/2023/04/22/books/book-ban-florida.html)

Remember when they shot unionists in the 30's and burned down black financial cities in the 50's then rioted against gays in the 60's and lynched Civil Rights activists in the 70's then protested gay marriage in the 90's and now trans people today? Banning abortion, banning sex ed, banning  gender studies, banns on teaching about slavery and on and on and on...Almost like canceling people and denying them rights is their political platform.  


[https://www.lgbtmap.org/equality-maps/youth/sports\_participation\_bans](https://www.lgbtmap.org/equality-maps/youth/sports_participation_bans)

[https://www.pbs.org/newshour/politics/here-are-the-restrictions-on-transgender-people-that-are-moving-through-u-s-statehouses](https://www.pbs.org/newshour/politics/here-are-the-restrictions-on-transgender-people-that-are-moving-through-u-s-statehouses)

[https://www.npr.org/2022/02/03/1077878538/legislation-restricts-what-teachers-can-discuss](https://www.npr.org/2022/02/03/1077878538/legislation-restricts-what-teachers-can-discuss)

My country even has travel warnings to several of these states...",0.0905304508025815,0.0591936111450195,0.4985054731369018,0.0211341083049774,0,0
post_7,post_7_2_1_2_2_2_1_1_1_2_1_1_1_1_1,"I'm not sure what I'm meant to engage with here. Those things you mention from the early 1900s are recognized today as abhorrent. Modern day anti-abortion/book bans are a retaliatory response to the progressive agenda in the last decade. 

It's like a pendulum that swings back and forth. The harder it swings in one direction the harder it will swing back the other direction. I think the progressives took it too far with their methods in the last decade and now the Conservatives are taking it too far by hitting abortion rights and banning books. If more of us were moderates, the extremists wouldn't be running the headlines.",0.0330536190156444,0.0220623016357421,0.4997603297233581,0.0715220868587493,0,0
