PostID,CommentID,Text,Toxicity,Rationality,Mutual Respect,Emotion,Moderator,Diversity
post_12,post_12_59,"Late stage capitalism. Also this happened during the industrial push at the beginning of the century. There is nothing new under the sun. Read some papers from the 20’s to the 50’s and it’s all the same.  “Younger people refuse to work and only want to listen to jazz” 

Companies are allowed too any breaks on how they must behave and they start doing what they need to make money no matter who is in the way. Everyone is replaceable. 
This recent push (last 40 years) is what’s killing people. 

Experience- I work in a management at a Fortune 500 company that is near the top of the list and has a major hand in GDP. 

Conclusion- This push is not new. It is the same as in the early 1900’s.",0.0288364288051291,0.102661907672882,0.4997556805610657,2.378225326538086e-05,0,1
post_12,post_12_60,[deleted],0.0260687223098937,0.8900734782218933,0.4747309684753418,0.0003655850887298,0,0
post_12,post_12_60_1,well if it began a year before it was available and did not spike after introduction... then we can safely rule that conspiracy out,0.0252541855946349,0.8457038998603821,0.4997350871562958,0.0015656650066375,0,0
post_12,post_12_61,"What If there was this ...we'll call it ...perhaps a medical treatment....maybe something  untried ...experimental...
That all of them were mandated to take",0.0316047316224679,0.6538645029067993,0.4995554387569427,0.0003432035446166,0,1
post_12,post_12_61_1,well if it began a year before it was available and did not spike after introduction...,0.0251926974299733,0.888028621673584,0.4997202455997467,0.0014826655387878,0,0
post_12,post_12_61_1_1,">well if it began a year before it was available and did not spike after introduction...

So you didn't  read the autopsy?

https://link.springer.com/article/10.1007/s00392-022-02129-5

The histological and immunohistochemical characterization revealed that the inflammatory infiltrate was predominantly composed of lymphocytes. The number of CD3-positive T-cells by far outnumbered the few CD20-positive B-cells detected. In addition, most T-cells belonged to the CD4-positive subset, while only scattered CD8-positive T-cells were seen (Fig. 1, 2, Supplementary Fig. 1/2). The T cells were negative for Tbet as a marker for Th1 cells, GATA3 as a marker for Th2 cells, D2-40, as a marker for Th17 cells (Supplementary Fig. 2). In addition, FOXP3 positive regulatory T cells and CD21 positive follicular dendritic cells were not detected within the cardiac infiltrates, while control cases, including cases of sarcoidosis were positive",0.0271301956090069,0.0190467238426208,0.49973264336586,1.4066696166992188e-05,0,0
post_12,post_12_61_1_1_1,"I have.

All medications have side effects.

Pointing to ""it has side effects"" doesn't mean anything.

I worked on some of the the vaccine studies on animals. We gave rats and dogs many times the dosage and daily and had zero mortality on hundreds of test subjects. That's thousands of times the human dosage over the trial period just so we are clear.

No offense but 1/5 mortality from this claim should have killed someone I know or worked with since the medical lab I worked at had a voluntary 99% vaccination rate. I know hundreds of vaccinated people and none have had any issues.  


Again excess mortality began before vaccination and there was no major spike upon vaccination. Ergo its not that.",0.0470121037602557,0.0411303043365478,0.4997099637985229,0.0001448690891265,0,0
post_12,post_12_61_1_1_1_1,">I have.

>All medications have side effects.


Permanent heart damage was not one listed, and gaslighting  wins you no pointts

Nothing  else you said was worthy  of  or eraned a response",0.0900253088866758,0.0393370389938354,0.3346365988254547,0.8769184350967407,0,0
post_12,post_12_61_1_1_1_1_1,"lol ""I ignore things that I don't like"" niiiice. I see how you got here.",0.3002581816582101,0.6630063056945801,0.0004017949104309,0.9803115725517272,0,0
post_12,post_12_61_1_1_1_1_1_1,">lol ""I ignore things that I don't like"" niiiice. I see how you got here.

Just your bullshit and gaslighting 

It's not worth  my data",0.9704047498603268,0.4068880677223205,0.0002012848854064,2.8789043426513672e-05,0,0
post_12,post_12_61_1_1_1_1_1_1_1,"lol ""data""",0.0313039124624703,0.902243196964264,0.4969325363636017,0.7970964312553406,0,0
post_12,post_12_61_1_1_1_1_1_1_1_1,">lol ""data""

Yes as in my internet  data: you know megabytes..or in your case kilobytes 

Being moronic isn't  helping  your case you know.",0.3035587653255713,0.4286267757415771,0.3637884259223938,0.097157746553421,0,0
post_12,post_12_61_1_1_1_1_1_1_1_1_1,"okay, then explain this to me then.

If excess mortality rose in April in the US but the vaccines only became available in December of the same year (and were not widely distributed for months) and there is no significant spike in December how can you relate the two? Why do low compliance and high compliance states show very similar data? Surely by your hypothesis states like NY should have much higher Mortality than Texas, whereas the data shows them to be almost identical.

In Canada Excess Mortality rose in April 2020 but the vaccine did not become available until spring 2021 as the government insisted on having the studies redone in Canada?

Cause cannot predate effect.

Do you think the virus that caused internal organs to rupture/leak and form scar tissue might have adverse impacts in some individuals? Its not conclusive but damn is it highly suggestive. Certainly fits the timeline better too.

I remember when the outbreak hit France and young people began dying of heart failure.

The conspiracy in the US prior to vaccination was that doctors signed heart attack and lung failure deaths as COVID mortalities. They then switched to blaming vaccines a year later and I still think it would be funny if it wasn't so sad. If logic and science don't work what do we have left but mockery?

It seems to have begun in April 2020 in Canada[https://www150.statcan.gc.ca/n1/pub/71-607-x/71-607-x2021028-eng.html](https://www150.statcan.gc.ca/n1/pub/71-607-x/71-607-x2021028-eng.html)

Looking at more detailed US trend Lines[https://www.usmortality.com/excess-mortality/cumulative](https://www.usmortality.com/excess-mortality/cumulative)

And globally week by week[https://stats.oecd.org/index.aspx?queryid=104676](https://stats.oecd.org/index.aspx?queryid=104676)  


Its clear that vaccines had little to no impact on excess mortality.",0.0970167392132832,0.0152854323387146,0.4997352063655853,1.9073486328125e-06,0,0
post_12,post_12_61_1_1_1_1_1_1_1_1_1_1,">If excess mortality rose in April in the US but the vaccines only became available in December of the same year (and were not widely distributed for months) and there is no significant spike in December how can you relate the two? Why do low compliance and high compliance states show very similar data? Surely by your hypothesis states like NY should have much higher Mortality than Texas, whereas the data shows them to be almost identical.

Both covid vaccine and the covid  itself cause myocarditis 

Per the autopsy 

>In Canada Excess Mortality rose in April 2020 but the vaccine did not become available until spring 2021 as the government insisted on having the studies redone in Canada?

>Cause cannot predate effect.

Not factoring that Canada  had longer lockdowns concentrated covid, creating  artificial  pockets  of more virulent virus

Remer them locking up priests? 

Oh and mandatory masks

>remember when the outbreak hit France and young people began dying of heart failure.

>The conspiracy in the US prior to vaccination was that doctors signed heart attack and lung failure deaths as COVID mortalities. They then switched to blaming vaccines a year later and I still think it would be funny if it wasn't so sad. If logic and science don't work what do we have left but mockery?

>It seems to have begun in April 2020 in Canadahttps://www150.statcan.gc.ca/n1/pub/71-607-x/71-607-x2021028-eng.html

Except the Chinese festival that Trudeau  lauded...prior  to April.

>And globally week by weekhttps://stats.oecd.org/index.aspx?queryid=104676 

>Its clear that vaccines had little to no impact on excess mortality.

🤣😂🤣😂🤣

Uhuh. Which included  deahs with covid, as deaths from.

Nice try on the spin and gaslighting.",0.0307614547854406,0.0095890760421752,0.4996227622032165,5.7220458984375e-06,0,0
post_12,post_12_61_1_1_1_1_1_1_1_1_1_1_1,"you literally changed your stance and threw out several red herrings there...

So you freely admit its likely the virus and predates the vaccine? Thanks.

Cause cannot predate effect. Unless they are time traveling Aliens XD which are totally real Right?!?!?! XD

One was tested in a controlled setting and caused zero issues in studies. The other was tested in the wild and had different results. There is a reason we do lab studies.

April was also pre lockdowns, also same time period in the US has the same data without lockdowns. Nice try lol. The Data I shred disproves whatever point you think you were making... unless that was another attempt to change the topic.

Again you simply don't read the data and look like a fool. Its why nobody takes you or your stance seriously. Red Herrings, Logical fallacies, Hyperbole.... I can tell one of us studied science and worked in research XD

What does Trudeau have to do with private corporate research? XD Who was talking about that? XD That's like admitting your a conspiracy nut with no evidence or point LMAO. He didn't do the studies nor did I listen to anything he or his government had to say. I went and read the studies and data and made the decision for myself... Not wild conspiracies and opinions of the uneducated and uninformed XD  


In fact I was left a legal cripple after COVID and still waited for 2bn doses of the vaccine(s) to be administered so I had a huge amount of data to compare real world impacts and safety. Sophistry and whataboutisms don't work on me...",0.3211146289877669,0.0087589025497436,0.3012342453002929,7.271766662597656e-06,0,0
post_12,post_12_61_1_1_1_1_1_1_1_1_1_1_1_1,">you literally changed your stance and threw out several red herrings there... 

No I haven't.  I've always  said  both cause it.

>lol, what a flake

You mean you? 

>Insults me and calls me names

Then stop with the disingenuous bad fail attempts 

> then lies when proven wrong.

😂😂🤣😂🤣😂🤣 more bad faith.

I've posted plenty  of papers citeding that covid causes myocarditis

>classy , dude, classy

Says the one who blocked me? How classy  is it? I see now why fragility  is such a bitter insult to people  like  you

You're  nothing  more than a pathetic trope",0.8376758362384203,0.0074931979179382,0.0002309679985046,2.2530555725097656e-05,0,0
post_12,post_12_61_1_1_1_1_1_1_1_1_1_1_1_1_1,"lol, what a flake. Insults me and calls me names then lies when proven wrong. Classy dude, classy...",0.9115742782234632,0.5340592265129089,0.0001935362815856,0.0142518579959869,0,0
post_12,post_12_62,"if it does turn out to be true that its the vaccine behind the deaths, will we go back to calling it “Trump’s vaccine” to make the pill easier to swallow",0.0559756754727037,0.684417724609375,0.4996813833713531,0.0002796947956085,0,1
post_12,post_12_62_1,"true, but he didn't mandate it.",0.0259286429538764,0.8414140939712524,0.4997044801712036,0.1272376179695129,0,0
post_12,post_12_63,"How do you cull the lower I.Q. from the population?

Hint; you don't poison those who choose to think for themselves.",0.3145949713131066,0.7377533316612244,0.3732784986495971,0.8621591627597809,0,1
post_12,post_12_64,"FYI, the reason I think the situation is quite dangerous right now is also because of Nostradamus' prophecy. 

Along with ""MABUS,"" the word ""FIRE"" is prophesied to be something that brings disaster to the world. 

By the way,  
I found those two words in the present's situation. 

I think the problem of side effects of vaccines is just the beginning.",0.037282035413772,0.3712998032569885,0.4997706413269043,0.889312744140625,0,0
post_12,post_12_65,Umm... The vaccines,0.030333825033478,0.8167070746421814,0.4995028674602508,0.8234187960624695,0,1
post_12,post_12_66,Covid causing heart complications.,0.0266212906256439,0.0102955698966979,0.4995193481445312,0.0003761053085327,0,0
post_12,post_12_67,Cocaine use and energy drinks. Puts a lot of stress on the heart.,0.1320335249733037,0.4174217581748962,0.499216228723526,0.9686615169048308,0,1
post_12,post_12_68,Probably climate change.  If we send more money to Ukraine it should fix everything... but only if we completely ignore covid vaccines as a potential cause. 😉,0.0293468962250698,0.0086470246315002,0.4997217357158661,0.0011095106601715,0,0
post_12,post_12_69,Vax injured,0.0826277333826777,0.8111323118209839,0.3796044588088989,0.0004327595233917,0,1
post_12,post_12_70,"A. Obesity is up like 10% in the past ten years.

B. Our healthcare system is fucked post covid, it is difficult getting timely care especially in rural areas.",0.820890205046139,0.2734441757202148,0.4985377192497253,0.0003952980041503,0,1
post_12,post_12_71,Increasing cannabis use causing heart attacks and stroked,0.0420729863380586,0.3915749788284302,0.4991964399814605,0.8609168827533722,0,0
post_12,post_12_72,"In most other reddit circles, the mention of covid vaccines being a possibility would get you a load of downvotes.",0.0296458863601343,0.394047200679779,0.4997173845767975,0.0013603866100311,0,1
post_12,post_12_73,"Ah yeah, as discussed by doctor who suggested people try a horse antiparasitic for COVID-19 with no scientific evidence that it would work for COVID-19, and a conspiratory-minded journalist who thinks mental illnesses are a hoax.

I suggest actually checking those sources and references. e.g. ""According to U.S. Mortality"" sounds like it was some very official source - it isn't, it's a website kept by anonymous people, in no way affiliated with the US government.

Without proper statistical analysis and proper sources for the data, this article has no scientific worth. It's just an opinion piece.",0.0281820787616109,0.0049525499343872,0.4997442364692688,1.4901161193847656e-06,0,1
post_12,post_12_74,COVID??,0.0365909006901366,0.4556922316551208,0.4992306232452392,0.0193179249763488,0,1
post_12,post_12_75,"Probably the covid vaccine. If it's happening across the board, then it's enviormental. What was put into our environment across the board? Maybe GMO, maybe fertilizer.... but i don't think that. I think the vaccine was either irresponsible, nefarious, or both. People were herded because of fear. And acted terribly against those that didn't want to get the vaccine.  Are they even checking whether these early deaths are of people who got the vaccine? Also, I can't imagine being a parent and not trusting the vaccine. Dealing with the social pressure and stigma of your peers simply because a lack of evidence from some new tech, RNA vac, was pretty embarrassing to witness. Alot of so called ""free thinkers"" turned on their peers very quickly beholding to not a lot of will tlor compassion on seeing the other side of the coin. Fuck civic duty if the risk is literally a chance of altering my genetics, my progeny. The future scares me as does this mob.",0.3792974477934515,0.0061677694320678,0.0028085112571716,7.748603820800781e-06,0,1
post_12,post_12_76,"It is certainly not the vaccine.  Move along nothing to see here.   I'm pushing 70, my wife had a stroke, her cousin had a stroke on the same day, the hospital had so many patients that day my wife never got to the brain trauma ward that had 16 beds, my daughter in law 36 has turbo cancer, my grand child age 1 has a rare metabolic disease (his mom was vaxed 3 times). , neighbors daughter has a kid 2 years old with brain cancer, another kid down the street age 2 also has a metabolic disease, my own daughter age 30 has the early stages of autoimmune disease. Before the vax ( I had three my wife and daughter had 4) my neighborhood just had old people dying from cancer and heart attacks.  Now we're dropping like flies in a frost. But not the vax definitely not the vax.",0.1019538208875621,0.0226666927337646,0.4163175523281097,2.9802322387695312e-06,0,1
post_12,post_12_76_1,Thats fucking horrible.,0.9970502860722964,0.7226890921592712,0.0002588629722595,1.5974044799804688e-05,0,0
post_12,post_12_77,It's definitely not that thing,0.0290930222214497,0.8604891896247864,0.4994019865989685,0.000102549791336,0,1
post_12,post_12_78,It’s the pointy needle we all had to take,0.0356195832827573,0.4371014237403869,0.4989370703697204,0.9771495163440704,0,1
post_12,post_12_79,Not allowed to talk about it sorry,0.0276294823042036,0.8898256421089172,0.0095646381378173,0.0013437867164611,0,1
post_12,post_12_79_1,well if it began a year before it was available and did not spike after introduction... then we can rule it out,0.0242268537222769,0.9040915369987488,0.4996939897537231,0.002676635980606,0,0
post_12,post_12_79_1_1,These charts shows the weekly cumulative excess mortality from all-causes for the United States and its states over time. https://www.usmortality.com/excess-mortality/cumulative,0.0243890896867779,0.0144386887550354,0.4995597302913666,0.0193210542201995,0,0
post_12,post_12_79_1_1_1,"It seems to have begun in April 2020 in Canada[https://www150.statcan.gc.ca/n1/pub/71-607-x/71-607-x2021028-eng.html](https://www150.statcan.gc.ca/n1/pub/71-607-x/71-607-x2021028-eng.html)

Looking at more detailed US trend Lines[https://www.usmortality.com/excess-mortality/cumulative](https://www.usmortality.com/excess-mortality/cumulative)

And globally week by week[https://stats.oecd.org/index.aspx?queryid=104676](https://stats.oecd.org/index.aspx?queryid=104676)

Trends begin before US vaccination dates and before even more widespread use globally. The dates don't line up with vaccination so we can rule that out. Vaccines were not available in Canada for the general public before spring 2021... That's one year after the major spike in excess deaths in the US. Look at Connecticut and its Pronounced!",0.0255174461303666,0.0189430117607116,0.4997470378875732,0.0056010782718658,0,0
post_12,post_12_80,"Oh we're pretending not to know? Let me help you, IT'S THE JAB!!!!!!!",0.0559361088336008,0.0049373507499694,0.4982594847679138,0.9998772442340852,0,1
post_12,post_12_81,💉💉💉💉💉💉,0.07232347312376,0.8564969301223755,0.4892304241657257,0.1192574501037597,0,0
post_12,post_12_81_1,"well if it began a year before it was available and did not spike after introduction...

do y'all just not look up data when folks make claims

Edit: Sorry. First vaccine in the US was end of December 2020, First availability in Canada was in April 2021, Excess mortality began April 2020 and did not see a significant spike post vaccination. Low compliance and high compliance states and provinces show the same rise in Excess mortality. One would think the data would change dramatically for later or non vaccinating regions or countries if the vaccines were the primary or a major contributor to. They seem very similar.",0.0246039681701515,0.0454163551330566,0.4997186958789825,9.5367431640625e-07,0,0
post_12,post_12_82,VARS is now bollocks for vaccine reporting. It has been bombed by cultists for the last two years.,0.1282759777105434,0.0155162215232849,0.4993042647838592,0.0015410184860229,0,1
post_12,post_12_82_1,Big true.,0.0365646006034744,0.8917863368988037,0.4946994185447693,0.9973551630973816,0,0
post_12,post_12_83,"Gas stoves, exercise, stevia, and video games. Definitely  not the Covid-19 vaccines they rushed through production and forced us all to get.",0.0281776821848982,0.6824972629547119,0.4964873194694519,1.2934207916259766e-05,0,1
post_12,post_12_84,"Jesus, when it's considered like that, one cannot discount the possibility that it was intentional.  How do we check what type of personalities those increased numbers had?  If it was largely non-conformists..",0.0256111626728444,0.1812103390693664,0.4996815025806427,0.0001439154148101,0,1
post_12,post_12_85,What’s the primary source on this? Whose life insurance data? Which companies?,0.02835428834812,0.0133570432662963,0.4996702373027801,0.0003491640090942,0,1
post_12,post_12_85_1,"The primary source appears to be VAERS, an entirely **self-reported** site about adverse effects that conservative talkshows told their listeners to go to inflate the numbers of reported vaccine-related deaths.",0.0291743118851033,0.0105139017105102,0.4996567368507385,0.0001391470432281,0,0
post_12,post_12_85_1_1,"Vaccine was supposed to decrease death.

These charts shows the weekly cumulative excess mortality from all-causes for the United States and its states over time https://www.usmortality.com/excess-mortality/cumulative",0.028944018456649,0.0197269916534423,0.4996996521949768,0.0224851071834564,0,0
post_12,post_12_86,"Jesus, when it's considered like that, one cannot discount the possibility that it was intentional.  How do we check what type of personalities those increased numbers had?  If it was largely non-conformists..",0.0256111626728444,0.1812103390693664,0.4996815025806427,0.0001439154148101,0,0
post_12,post_12_87,"ask yourself what had a huge social media blackout, on ANYONE talking about it. less testing than it should and only got released under eau

Schrodinger's cat. Both dead and alive until we actually test it. WITH real science and not capitalistic buzz words.",0.0342798926962578,0.2320887446403503,0.4502754807472229,0.050284594297409,0,1
post_12,post_12_88,Cutbacks on safety regulations!... It'll get worse now that child labor is becoming normal!,0.0755512803735108,0.2888191342353821,0.4995863139629364,7.611513137817383e-05,0,1
post_12,post_12_89,Couldn’t *possibly* be feeling trapped in a life of being a corporate slave in a cold society of unending pressure,0.3941995718422881,0.0084025263786315,0.0017259120941162,0.0638193488121032,0,1
post_12,post_12_90,[Its a mystery](https://youtu.be/OLvL3ecB82E?t=19),0.0275171013105157,0.0590056777000427,0.4946347177028656,0.0671345889568328,0,1
post_12,post_12_91,The Tories & and their policies play a big part. I reckon,0.0326959017816715,0.0173940658569335,0.4993967413902282,0.9709266424179076,0,0
post_12,post_12_92,"Same  old  tired answers,  I read it right  here,  scientific  paper on reddit,  Mitochondria in the  heart  being  affected by covid.",0.0332035246993297,0.1180611848831176,0.4915932416915893,5.346536636352539e-05,0,1
post_12,post_12_93,Work,0.0324881997688219,0.9167722463607788,0.4988872110843658,0.98990660905838,0,1
post_12,post_12_94,"""this upward trend is the result of four causes, suicides, homicides, drug overdoses and car accidents, mainly in young people 10 to 19 years old.""

""...adults 25 to 64. And most of those relate to the problems of drug overdoses, suicides, alcohol related causes.""",0.0418374946560007,0.7285344004631042,0.4996889233589172,0.0062527954578399,0,1
post_12,post_12_95,"People realize the American dream of climbing the ladder by honest hard work is gone. Your hustle and grind are no insurance policy.

If you aren't one of the well connected to the c suite, and have loads of narcissm and sociopathy, you won't get far up the ladder.

Masses are discovering that if you do the equivalent of searching for the pot of gold at the end of the rainbow, you will discover someone else got it. Also, some corporate assholes profiteered off the chase.

Whenever I read a rant about objectification, I say the the most guilty are the executives that see everyone as a pixel on an Excel spreadsheet.",0.1784721926853223,0.0209987759590148,0.0179709792137146,3.594160079956055e-05,0,0
post_12,post_12_96,"Limited  resources and opportunities, lack of drive and ambition ,and clarity , anomie generated by an ever changing, and demanding society, the man enforced  view of the present  political  correct view of human sexuality ,and identity, and last but not the least ,the exclusion  of the wisdom  of our elderly, and the fixed norms and values that served us good ,all these things destroys the future of young  people.",0.0287937271422992,0.012993574142456,0.4997472167015075,1.1622905731201172e-05,0,1
post_12,post_12_97,*cough*,0.1221782779079321,0.4417020082473755,0.0018147826194763,0.0046901702880859,0,1
post_12,post_12_98,Moderna and Pfizer are behind it,0.0456686303388798,0.0688492059707641,0.4996391236782074,0.8919515907764435,0,1
post_12,post_12_99,Because they can’t afford healthcare amidst rising inflation?,0.0419346906454561,0.4793238043785095,0.4996918439865112,0.002464085817337,0,1
post_12,post_12_100,Suicide and suicide by drug overdose.,0.8661362057760759,0.6539209485054016,0.4993888437747955,0.0166050493717193,0,1
post_12,post_12_101,Predatory employers and stress.,0.0261159501730473,0.5377910137176514,0.4996413290500641,0.0197958350181579,0,0
post_12,post_12_102,We living paycheck to paycheck... yea and because of needles,0.3671204931926137,0.0049865841865539,0.0003911852836608,0.871089369058609,0,1
post_12,post_12_103,"Overwork, low salary and no future.",0.0550909677541083,0.5578164458274841,0.4995271861553192,6.383657455444336e-05,0,1
post_12,post_12_104,Two words..  Predatory Capitalism.,0.0337496526990567,0.0376273393630981,0.4973475039005279,0.1411787569522857,0,1
post_12,post_12_105,"The typical - climate change, capitalism, exploitation",0.0263277947245237,0.3657005429267883,0.4997313320636749,0.0446107983589172,0,1
post_12,post_12_106,"Jabby jab, stabby stab required now ☠☠☠",0.4618143534559257,0.7297651171684265,0.0095056891441345,0.0043672025203704,0,0
post_12,post_12_107,"What are you trying to imply haha, this prank should have an end.",0.1298260170226807,0.5987094640731812,0.4968174695968628,0.0112380385398864,0,1
