PostID,CommentID,Text,Toxicity,Rationality,Mutual Respect,Emotion,Moderator,Diversity
post_10,post_10_14_5_1_1_2_1,I will. What happens when one of those people I also care about has an adverse reaction to a vaccine because of terrible manufacturing practices that left plasmid DNA behind? See original post,0.032803788192325,0.1101700067520141,0.499754250049591,0.1385232210159301,0,0
post_10,post_10_14_5_1_1_2_1_1,"That is far, far less likely than them dying from being hit by the virus. This is a science sub...did you actually look at peer reviewed studies before you typed that? This will assist you:

https://www.mayoclinichealthsystem.org/hometown-health/featured-topic/covid-19-vaccine-myths-debunked",0.0530568106852375,0.142768383026123,0.4997264444828033,0.0030153393745422,0,0
post_10,post_10_14_5_2,"If it ""wanes"" it's not really ""immunity"".",0.0303777715725652,0.0454744696617126,0.4997662901878357,0.0223169028759002,0,1
post_10,post_10_14_6,“Vaccine” lol.,0.0459854513559868,0.8969259858131409,0.4982831180095672,0.8910457193851471,0,1
post_10,post_10_14_7,"Immune compromised and the elderly are the ones still getting it, and at the advice of their doctors, who studied and practice medicine.",0.0257495908355293,0.3905404806137085,0.4997501373291015,0.1575993299484253,0,1
post_10,post_10_14_7_1,doctors or corporations?,0.0281958857703573,0.2593443989753723,0.4994893670082092,0.0589910447597503,0,0
post_10,post_10_14_7_2,“Practice” medicine,0.0294919206989295,0.8864092230796814,0.4479787349700928,0.973949372768402,0,1
post_10,post_10_14_8,Not all people have immune systems working at 100%. Cancer victims and older people for example can suffer from poor immune systems. Even the smallest illnesses can take them down.,0.0577743556669937,0.8994589447975159,0.4997181594371795,0.0113866329193115,0,1
post_10,post_10_14_9,"Well if you want a serious answer:

One of the reasons is that different viruses operate in different ways. Some have a short infection period and mutate often and for others it's pretty much the opposite. That means with some you could have very strong lifelong immunity from a vaccine, but with others you can only get a strong immunity for a shorter period.

Virus like COVID and the flu that spreads through the air, and infects our breathing system, tend to have a faster rate of mutation. If you get the disease and develop natural immunity from fighting it off, you can still contract it months later, because it's mutated and your body isn't fully prepared for how it's changed.

This is also why there's a lot of talk about updating the vaccines. The vaccines that were rolled out were designed on the original variant. Since then it has mutated a lot and the more it mutated, the less effective the vaccines became. They still had some effects and that's why some received a third shot, while research went into updating the vaccines.",0.0256636456886828,0.0756985545158386,0.4997475147247314,3.445148468017578e-05,0,1
post_10,post_10_14_9_1,"I think its interesting that the virus became less lethal as it mutated. Like it wants to survive by not killing its host. 

It is a little crazy to think that by the time we make and roll out a vaccine its already ineffective because the virus is mutated.",0.0295242200742296,0.3040714859962463,0.4997574090957641,7.891654968261719e-05,0,0
post_10,post_10_15,Just tryin to free up some hard drive space on earth… gotta break a few million eggs is all.,0.1276120034231246,0.0438995957374572,0.0040898323059082,0.0018443167209625,0,1
post_10,post_10_16,"Truth will eventually prevail over lies. 

""MABUS"" and ""FIRE"" cannot ,will not beat the truth.",0.1123292481475981,0.775256872177124,0.4996800720691681,0.9888575077056884,0,1
post_10,post_10_16_1,"I wouldn't get my hopes up bro, the moon landing hoax is still going strong after 54 years....",0.0318097684966073,0.6989455819129944,0.4828217625617981,0.7855309545993805,0,1
post_10,post_10_16_1_1,if it was faked then why the soviets didnt say anything?,0.0316651087681481,0.3665125370025635,0.4994994699954986,0.0055601596832275,0,1
post_10,post_10_16_1_1_1,"They can't even show the footage on TV anymore because younger people just burst out laughing - they're a bit less gullible than the boomers were

Apollo 17 Liftoff from Moon - December 14, 1972[https://www.youtube.com/watch?v=9HQfauGJaTs&ab\_channel=SmithsonianNationalAirandSpaceMuseum](https://www.youtube.com/watch?v=9HQfauGJaTs&ab_channel=SmithsonianNationalAirandSpaceMuseum)",0.0739639261922642,0.4494715332984924,0.2162516117095947,0.0031748712062835,0,0
post_10,post_10_16_1_1_1_1,So they left the cameraman on the moon?,0.0274589816162701,0.7407231330871582,0.4996304810047149,0.0088730752468109,0,0
post_10,post_10_17,Who would take this vaccine for the sniffles? Is this a joke? Pfizer loves taking money for a little cold and the sheep line up.,0.2446298123340996,0.0156700015068054,0.0060293674468994,0.0020128786563873,0,1
post_10,post_10_17_1,Tell that to all the people who have died horrible painful deaths or are disabled for life,0.5797444678022476,0.0541802048683166,0.4937240183353424,0.971303164958954,0,0
post_10,post_10_17_1_1,From the vaccine? My uncle died from a Covid vaccine adverse event.,0.0362188613039689,0.3232012391090393,0.4996266663074493,8.735060691833496e-05,0,0
post_10,post_10_18,2 x 0 is 0,0.0753410741063059,0.9278740882873536,0.4993931353092193,0.0085935890674591,0,1
post_10,post_10_19,"We do have to be careful when reading statements such as “2 times the adverse effects”. In this case it’s double the patients in the study, but it can often be misleading.",0.0230793598227424,0.0223686099052429,0.4997224509716034,0.0051801204681396,0,1
post_10,post_10_19_1,Percentage increase without also giving you absolute numbers is a great way to manipulate people. All sides tend to give you just a % and it’s awful.,0.1085714986357135,0.8615373373031616,0.4997135400772095,0.0001904368400573,0,1
post_10,post_10_19_1_1,"I see it all the time. Lipitor, a cholesterol drug by Pfizer go figure, lied to everyone. 

In the ASCOT-LLA study, which was terminated early because it was considered to have such outstanding results, there were heart attacks and deaths in 3% of the placebo (no treatment) group as compared to 1.9% in the Lipitor group. The improvement in outcome with Lipitor treatment was only 1.1 percentage point, but when this study was presented to the public, the advertisements used the inflated (relative risk) statistic, which transformed the 1.1% effect into a 36% reduction in heart attack risk",0.0264656581436638,0.5456631779670715,0.4997448325157165,4.649162292480469e-06,0,0
post_10,post_10_19_1_1_1,"Oh yeah this is a fantastic example, and one I was familiar with. So many doctors don’t even know this stuff it’s absurd.",0.0320967875326302,0.0050733089447021,0.499634176492691,0.990113377571106,0,0
post_10,post_10_20,"This post is just to make you all think about a touchy subject. 

All Covid vaccines are safe and effective for humans and any adverse effects are very very very rare. 

There are no medical journal that have written about Covid vaccines having adverse effects. 

The only sites you will find that speak about Covid vaccines having negative effects are misinformation. 

I believe you can still get banned from many subreddit for speaking anything negative Covid vaccines. So be careful before you speak your mind on the subject. It seems harsh but it would be very dangerous to the world if people had access to information that said that the Covid vaccine is anything but safe and effective. 

We need to control the information the masses have access to for safety. Some people have thoughts that might make people have thoughts that are not in support of vaccines. If there words get out into the public and some people don’t get vaccinated, then can you imagine how scary of a world we would live in?

Even though there is free speech, it is important to monitor speech on social media and ban accounts that speak information that has been deemed dangerous. 

Information such as a person saying they had complications after getting a vaccine and that others should be careful. Unless they are a doctor and they have absolute proof that their illness had anything to do with the vaccine they should not be allowed to speak. They are just reacting to their sickness most of the time and trying to find something to blame. Vaccines are an easy target. 

Vaccines are safe and effective. Any side effects are extremely rare.",0.0265782154625267,0.0103418231010437,0.4997692704200744,0.0007278323173522,0,1
post_10,post_10_20_1, This sounds like it was spat out by ChatGPT,0.0483991302713131,0.6259022355079651,0.4983208775520324,7.033348083496094e-06,0,0
post_10,post_10_20_1_1,And what if it was? Just because an AI collects information and presents it to you does not mean the information is wrong. You have to independently verify it.,0.0248893056191006,0.6309905648231506,0.4997843205928802,0.0010514259338378,0,0
post_10,post_10_20_1_1_1,“Don’t believe everything you read on the internet” but believe if if its AI ok lol,0.0474174671308402,0.7696757316589355,0.0004054903984069,0.900752067565918,0,0
post_10,post_10_20_1_1_1_1,"You really do have a reading comprehension problem, don't you?",0.2976159461461545,0.0102988481521606,0.4996235966682434,0.0973937809467315,0,0
post_10,post_10_20_1_1_1_1_1,"i can smell manufactured information when it’s presented to. Selective reporting is everywhere, AI only enhances that. The statement retorted by this bot that “all covid vaccines are safe and effective” -is dead wrong right then and there. 3 years in and we have 46,000 deaths reported to the CDC and 2.5 million adverse events reported. Moderna’s stock has dropped 70% this year and pfizers have dropped over 20% because no one wants to take these death shots anymore. 

&#x200B;

There is no one size fits all approach to health. 

Even the greatest medical interventions in history should never be forced onto people. Especially for a product with complete immunity from legal retribution. If you were to die just seconds after taking a covid shot, your family would still not be able to sue Pfizer. Way to stand behind your product right?  sketchy.",0.1285288951712785,0.4139156341552734,0.4995414018630981,1.0013580322265623e-05,0,0
post_10,post_10_20_1_1_1_1_1_1,"You can smell manufactured information but somehow you think that a user comment on a medical journal is ""peer reviewed research"". 

Yea, ok bud. You're completely delusional. 

You know what has killed literally millions of people? Covid.",0.7930070087993825,0.1722449660301208,0.4078774750232696,0.0002024471759796,0,0
post_12,post_12_0,"What's behind the spike in deaths among younger, working people?",0.0405701072696127,0.0288675427436828,0.499669998884201,0.0033020675182342,0,1
post_12,post_12_0,"[What's behind the spike in deaths among younger, working people?](https://www.msn.com/en-us/money/personalfinance/what-s-behind-the-spike-in-deaths-among-younger-working-people/ar-AA1hNERb) ([archive](https://archive.ph/Qj1at)) 


*A report by the nonprofit Society of Actuaries found that [34% more 35- to 44-year-olds died than expected](https://www.soa.org/49b504/globalassets/assets/files/resources/experience-studies/2022/group-life-covid-19-mortality-12-2022.pdf) in the last three months of 2022. More deaths occurred among white-collar vs. blue-collar workers. The organization also reported [a sudden jump in employee deaths](https://www.soa.org/49b504/globalassets/assets/files/resources/experience-studies/2022/group-life-covid-19-mortality-12-2022.pdf) in the fall of 2021. Independent sites aggregating Centers for Disease Control and Prevention data confirm these trends. According to [U.S. Mortality](https://www.usmortality.com/), excess deaths in September 2021 among 25- to 44-year-olds were [70% above normal](https://www.usmortality.com/excess-mortality/percentage/united-states/25-44)*
 
*That number has thankfully dropped, but as of May 2023, the most recent month for which data are available, deaths in this age group remained 10% above expected. Among people under 25, it was [16% above normal](https://www.usmortality.com/excess-mortality/percentage/united-states/0-24). Experts have posited all sorts of theories, from [rising obesity rates](https://fortune.com/well/2023/06/17/america-covid-excess-deaths-worse-other-rich-countries-85-percent/) to [extreme heat](https://www.usatoday.com/story/opinion/2023/07/21/heat-deaths-increase-climate-change-effects-worse/70436488007/) to lagging effects from [lockdowns](https://journals.sagepub.com/doi/10.1177/00469580221139016) to wider [alcohol abuse](https://jamanetwork.com/journals/jamanetworkopen/fullarticle/2791852). These possible contributors deserve careful consideration. Given the [sheer number](https://openvaers.com/covid-data) of COVID-19 vaccine deaths reported to the Vaccine Adverse Event Reporting System, more than 36,000 to date, the possible role of vaccines should be examined, too*.

These questions are getting increasingly rhetoric, given the fact how excess of deaths correlates with vaccination status levels [1](https://www.reddit.com/r/ScienceUncensored/comments/15tp0ah/australian_scientists_find_disturbing_patterns/), [2](https://www.reddit.com/r/ScienceUncensored/comments/16woqzd/covid_vaccines_causally_linked_to_increased/) both in time, both in space. See also:

* [Covid NOT Responsible for 'Explosion' in Heart Deaths, Major Study Shows](https://www.reddit.com/r/ScienceUncensored/comments/12h6789/covid_not_responsible_for_explosion_in_heart/) [another studies](https://www.reddit.com/r/ScienceUncensored/comments/16z5pk8/compendium_of_links_for_anyone_still_clinging_to/)
* [Civilian labour force with a disability](https://i.imgur.com/3CmKKbl.gif) - from 2021 i.e. year of vaccines roll-out?",0.0312129178794496,0.0294703841209411,0.499715119600296,0.0008293390274047,1,1
post_12,post_12_0_1,"Does it correlate? From the article in the original post:

“Comparing state-level excess mortality percentage estimates to estimated COVID-19 vaccinated percentages shows a moderate negative correlation for both the U.S. population and the Group Life data for the third quarter of 2021.
For subsequent periods, although some negative correlation was still seen in most periods, it was less pronounced than the third quarter of 2021. Note that Figure 9.21, which looks at the correlation based on the percent of the population with a completed primary vaccine series and an additional dose (booster) as of December 31, 2021 shows a small positive correlation for the Group Life data for the 2022 period. but with a very low R^2 statistic. which
indicates that vaccination rate does not explain much of the variation in excess mortality.”

Furthermore, when you look at the county level, vaccination status is both more strongly associated  with lower mortality (being negatively associated at all time points) and shows a higher R^2:

“Similar to the state-level analysis for the U.S. population, the county-level analysis shows negative correlation between the excess mortality percentage estimates and the percentages of the population that are fully vaccinated As was the case with the state-level analysis, the third quarter of 2021 shows a steeper slope than the subsequent periods. In comparing the county-level and state-level graphs, the R? statistics suggest a stronger fit at the county level relative to the state level. However, the steeper slopes on the state-level graphs relative to the county-level graphs suggest a larger change in excess mortality per percentage change in vaccination rate at the state level.”

It seems that mortality is not correlated spatially to vaccination status? In fact it’s the opposite",0.0256475870675266,0.3179690837860107,0.499736875295639,8.687376976013184e-05,0,1
post_12,post_12_0_1_1,"Yea, the excess mortality at the end of 2021 coincided exactly with the delta and omicron waves. 

Come on guys.",0.0298362980771107,0.265176773071289,0.4989403486251831,0.0093374252319335,0,1
post_12,post_12_0_1_1_1,"If the vaccine was supposed to help against covid why does excess mortality keep increasing. If this trend line is extrapolated out, say by two or three years, the US is in big trouble, why is there no concern from the health agencies about excess mortality?

These charts shows the weekly cumulative excess mortality from all-causes for the United States and its states over time https://www.usmortality.com/excess-mortality/cumulative",0.0248943589536156,0.0114575624465942,0.499758243560791,0.0007027089595794,0,1
post_12,post_12_0_1_1_1_1,"Why does the cumulative excess mortality rate still climb?  Because that's all a cumulative rate can do.

Notice how on the 2022 overall excess death rate climbs at a  slower rate as the year goes on, cumulative measurement cannot turn negative.",0.0263102941947642,0.0543869733810424,0.4997700452804565,0.9004086256027222,0,1
post_12,post_12_0_1_1_1_1_1,"So why does it still climb after the vaccine roll out, shouldn't it have gone down?",0.0282674266854882,0.429301381111145,0.499625951051712,0.0008798241615295,0,0
post_12,post_12_0_1_1_1_1_1_1,"Cumulative numbers? No. Cumulative numbers cannot go down.

To explain, I will give you a set of declining numbers as they go. Let's say January there was 30 deaths so the cumulative deaths in that time period are 30. In February there is 20 deaths so the cumulative deaths in that time period are 50.  In March there are 10 deaths, so the cumulative deaths over that time are 60.

So which month had worse numbers? Because the cumulative measure was lowest in January and highest in March.  But measuring how fast the cumulative number increases says a different story.

The rate of change is more important for what you're looking at.

and in the chart you posted as vaccines rolled out more the cumulative numbers increased at a slower rate.",0.0245133835390573,0.1733002662658691,0.4997183978557586,1.2218952178955078e-05,0,0
post_12,post_12_0_1_1_1_1_1_1_1,"if excess deaths returned to baseline rates, it would go down.",0.0734274650626628,0.871887743473053,0.499692440032959,0.0010732114315032,0,0
post_12,post_12_0_1_1_1_1_1_1_1_1,"No it wouldn't because the graph is tracking a running total,  cumulative total, and not just the number from month to month like you appear to think it does.

The actual excess deaths week to week run in conjunction with Covid 19 surges and not vaccine rollout.
The third and fourth graphs in this article show excess deaths per week and month respectfully, very clearly there are ebbs and flows.
https://healthfeedback.org/what-can-explain-the-excess-mortality-in-the-u-s-and-europe-in-2022/",0.0256176255462947,0.0130981802940368,0.4997521638870239,7.361173629760742e-05,0,0
post_12,post_12_0_1_2,">*when you look at the county level, vaccination status is both more strongly associated with lower mortality*

It depends when you look at mortality. Counties of low vaccination status have older population more impacted with Covid wave. And negative mortality persists years after vaccination so it occasionally prevails.",0.0272972998154767,0.00749272108078,0.4997444152832031,0.766154021024704,1,0
post_12,post_12_0_1_2_1,"This association also shows at the state level, not only the country level. Also this doesn’t explain the fact that the R^2 is fairly high, showing that vaccination status as an independent variable explains a good proportion of variance in death.",0.0250855223104706,0.5001716017723083,0.4997698664665222,0.0540765225887298,0,0
post_12,post_12_0_2,[Civilian labour force with a disability](https://i.imgur.com/3CmKKbl.gif) - from 2021 i.e. year of vaccines roll-out?,0.0300362499452567,0.8580704927444458,0.4997324049472809,0.0038646459579467,1,0
post_12,post_12_1,The increasing total shitness of everything?,0.9293955496778136,0.0454555749893188,0.0042487382888793,1.0251998901367188e-05,0,1
post_12,post_12_1_1,[You don't get it?](https://youtu.be/Sh7QWBb2U2A?si=6y5rCee63H7cMSds),0.1618008435166484,0.8109913468360901,0.4608716666698456,0.0033769607543945,0,1
post_12,post_12_2,It’s the thing that no one can talk about.,0.0312495455112786,0.8260225057601929,0.4994654357433319,0.9985705018043518,0,1
post_12,post_12_2_1,That’s because Dead Men Tell no Tales,0.1040944211489279,0.0099261999130249,0.4717309772968292,7.981061935424805e-05,0,1
post_12,post_12_2_2,I never thought we’d live in a world where people can be so easily programmed.,0.0791770316018694,0.3377785682678222,0.4995218217372894,0.9880731403827668,0,1
post_12,post_12_2_2_1,"People believe that they live in a free society where you cannot say ""Divoc"".",0.0281610667005055,0.0237401723861694,0.4996878802776336,0.0138228237628936,0,1
post_12,post_12_2_2_1_1,But you just did,0.0541720279155605,0.8862036466598511,0.493042528629303,0.1117818355560302,0,1
post_12,post_12_2_2_1_1_1,I didn’t.,0.0334694312082638,0.90318500995636,0.4973870813846588,0.0010692179203033,0,0
post_12,post_12_2_2_1_2,Wtf is divoc?,0.839865360425545,0.2770519852638244,0.4989280998706817,0.0001020729541778,0,1
post_12,post_12_2_2_1_2_1,An anagram for a virus that appeared in recent years.,0.0266014778647707,0.6032930612564087,0.4996161460876465,0.9948968887329102,0,0
post_12,post_12_2_2_1_2_1_1,"Oh, haha. So are we not allowed to say Covid then?",0.0307855617748546,0.0049126744270324,0.499616265296936,0.8641311824321747,0,0
post_12,post_12_2_2_1_2_1_1_1,No... I can say Covid of course. You have to read my comment on the context of the subject of this thread.,0.0239565442309596,0.1675702929496765,0.4996788799762726,0.0050849020481109,0,0
post_12,post_12_2_3,It’s actually just deaths of despair from drug use. All the young people I know irl who have died has been ODs and suicides. To the man.,0.0882055970133592,0.0344087481498718,0.0106272101402282,0.002745121717453,0,1
post_12,post_12_2_3_1,"I've lost way too many friends to fent, and its almost never clear whether its intentional or not.",0.0391942336148962,0.1906449794769287,0.4996804296970367,0.0005696415901184,0,1
post_12,post_12_2_3_1_1,"In my experience, suicide is often both intentional and not for the person involved. 

It is never black and white.",0.0964962249305289,0.7768768072128296,0.499749481678009,0.0034458637237548,0,1
post_12,post_12_2_3_2,🤦‍♂️,0.07232347312376,0.8564969301223755,0.4892304241657257,0.1192574501037597,0,0
post_12,post_12_2_4,Fight Club?,0.0421744828208477,0.6767942905426025,0.480400800704956,0.0025410056114196,0,1
post_12,post_12_2_4_1,His name is Robert Paulson,0.0313629237248563,0.8064358830451965,0.4994562864303589,0.9971543252468108,0,0
post_12,post_12_2_5,DIVOC?!,0.0627944573838496,0.0606409311294555,0.4426649212837219,0.0004110038280487,0,1
post_12,post_12_2_6,That states with a lower vaccination rate have a higher excess mortality?,0.0343157156107821,0.0079368948936462,0.4997149407863617,0.0041636526584625,0,1
post_12,post_12_2_7,The jabbbbbbbbbb.,0.2335327432381286,0.0135616064071655,0.4994342923164367,0.9116041660308838,0,1
post_12,post_12_2_7_1,"Probably economy at the end of it - it’s becoming harder and harder to live so people can’t pay their bills, some turn to opiates (fentanyl) and OD, others commit suicide due to the pressure and subsequent mental health problems. If the vaccine were killing people in droves the normies would notice lol",0.1641795331331154,0.5696950554847717,0.2174055576324463,0.0008219182491302,0,1
post_12,post_12_2_8,Capitalism?,0.0406538413904474,0.0376710295677185,0.4993120431900024,0.0246848464012146,0,1
post_12,post_12_2_8_1,"Probably yes - increasing economic pressure (gouged costs, no help from anybody) is making people turn to drugs to escape the stress or go into a mental health spiral. These deaths are probably OD’s and suicides most likely stemming from the inability for some people to afford basic things",0.0636576307488306,0.3951019048690796,0.4996454119682312,5.97834587097168e-05,0,0
post_12,post_12_2_8_1_1,It’s just ironic that the comment that named all of the symptoms of capitalism got tons of upvotes and then when I named it I got downvoted into oblivion.,0.0264781651805375,0.014551818370819,0.4960093200206756,1.233816146850586e-05,0,0
post_12,post_12_2_8_1_1_1,"That’s propaganda for you. “Capitalism” is the savior - all the symptoms tho, those are real issues that we need to use capitalism to fix. You have to word your comments carefully when talking to reactionary conspiracy types",0.0598769095404782,0.1969248652458191,0.4972081184387207,0.0146966576576232,0,0
post_12,post_12_2_9,"Death rate has gone down towards more normal level as of September 2023, so has the number of vaccinated people gone down?",0.0325526926857817,0.2868074178695678,0.4997245967388153,0.0098386704921722,0,1
post_12,post_12_2_9_1,"Find the stats and document them yourself, because the gov won’t.

That’s exactly why the stat of “recovered” was taken off the news when it was being reported and only ran the infected and dead stats.",0.0352499296529216,0.6090995669364929,0.4997441172599792,4.827976226806641e-06,0,1
post_12,post_12_2_9_2,These charts shows the weekly cumulative excess mortality from all-causes for the United States and its states over time. https://www.usmortality.com/excess-mortality/cumulative,0.0243890896867779,0.0144386887550354,0.4995597302913666,0.0193210542201995,0,0
post_12,post_12_2_9_2_1,"""Cumulative""

If you could read.",0.0246495264669738,0.8832075595855713,0.4996273219585418,6.222724914550781e-05,0,0
post_12,post_12_2_9_2_1_1,Or owned a dictionary.,0.0302012162741407,0.9277893304824828,0.4995287358760834,0.9756806194782256,0,1
post_12,post_12_2_9_3,The number of people getting boosters sure has.,0.0240022158512521,0.5325209498405457,0.4997032880783081,0.9990354478359222,0,1
