PostID,CommentID,Text,Toxicity,Rationality,Mutual Respect,Emotion,Moderator,Diversity
post_21,post_21_5_1_1_1_1_1_1_2,"I believe a teacher needs to be objective about matters of debate, and keep a tone of emotional intelligence.  That this article does not tell us exactly what this person said about or against ""ethnic diversity"", for example, shows it is biased and more of a puff piece than an example of objective journalism, ironically.  

The right did not invent freedom of speech, they merely co opted it.   What the hell is a ""liberal conservative"" anyway?  Sounds like someone that I would like to smack in the face already.",0.2316352531620773,0.0140392780303955,0.4997263252735138,6.496906280517578e-06,0,1
post_21,post_21_6,"That professor is the biggest snowflake I have ever heard of.  He gets negative evaluations from students and some colleagues avoid him so he says he is being ""canceled"".  No, dude, people just don't like you.",0.8175622886585703,0.5794232487678528,0.0335714817047119,6.765127182006836e-05,0,1
post_21,post_21_6_1,"Exactly, its your typical nonsense grift.

&#x200B;

For anyone who thinks it's real...please define ""woke"" and ""wokeness""",0.0812872686559384,0.0365228652954101,0.4996163249015808,0.0007684826850891,0,1
post_21,post_21_6_1_1,The belief that all disparities in outcome are due to discrimination.,0.0265448849749847,0.8568365573883057,0.4997590184211731,0.0008981823921203,0,1
post_21,post_21_6_1_2,"in educational  contexts i it's where the purple haired DEI  clowns run the show.   reality and  logic is replaced by insane far left ideological  nonsense.    they claim it's about equality but really, certain groups get preferential treatment while others  are guilty of perceived  infractions just based on gender or skin color .",0.1280060096383277,0.0161889195442199,0.4939028024673462,8.100271224975586e-05,0,1
post_21,post_21_6_1_3,"A trait characterizing something which insists on social justice and political correctness at the expense of quality, merit, or functionality in an ends-justify-the-means kind of way

I won't ask you to define woman in return because you'll just gaslight. But there's your definition to pick apart, any more brain busters?",0.1348943441141864,0.0569072961807251,0.499422013759613,0.0049232542514801,0,1
post_21,post_21_6_1_3_1,"That's not the definition though you moron...That's the made up definition that the right thinks it is.

Also last time I checked it wasn't ""woke"" people banning books and taking away people's rights and generally being anti human so it's weird that you talk about woke people forcing things on people.",0.8795394989781621,0.0389403700828552,0.3700982332229614,7.092952728271484e-06,0,0
post_21,post_21_6_1_3_1_1,"Lol you just didn't like the definition because it ends your whole ""this nebulous term is hard to define therefore the criticism is invalid somehow"" game. Remember: you asked what our definition was.

Also, if that's wrong somehow, please correct it. My definition is how it is used in common parlance. If I forgot part of the meaning, by all means complete it. Lmao",0.0526404007064477,0.4596105813980102,0.4990476071834564,1.4781951904296877e-05,0,0
post_21,post_21_6_1_3_1_1_1,"The actual definition is below

&#x200B;

woke  
verb  
a simple past tense of wake.   
adjective  
having or marked by an active awareness of systemic injustices and prejudices, especially those involving the treatment of ethnic, racial, or sexual minorities: In light of incidents of police brutality, it’s important to stay woke.He took one African American history class and now he thinks he’s woke.This generation of kids is trying to make woke choices in life.  
**Disparaging. as used by political opponents, of or relating to a liberal progressive orthodoxy.**

&#x200B;

You might be surprised but your fellow right wingers have many many different meanings for the term...even the dictionary can't define it as you use it other than  the fact that it is used as a dispariging remark.",0.0286033408454954,0.0091577768325805,0.4995600879192352,0.0004428923130035,0,0
post_21,post_21_6_1_3_1_1_1_1,"That's synonymous with my definition. It prioritizes those mislead virtues (social justice, or ""injustices"") at the expense of other priorities. It's also a derogatory term like it mentioned, I forgot that part but I agree. This definition is basically mine except it adds that it's ""important to stay woke"" lol, which is a clue of what kind of bias the writer has. But yeah I agree, this definition is the maximum soft version of mine but they get at the same points

How is this a gotcha again?",0.0290274379698792,0.0065603852272033,0.4984368085861206,0.0498985052108764,0,0
post_21,post_21_6_1_3_1_1_1_1_1,"It's not synonymous...its an insult you apply whenever or wherever you want on someone or something you don't like.

&#x200B;

The first (actual) definition is an internal thing...you are or are not woke...it's not something you put on other people. Notice how all the examples it gives are related to an individual, not something anyone is doing to anyone else.",0.114382370277479,0.5263481140136719,0.4997427463531494,0.0007180869579315,0,0
post_21,post_21_6_1_3_1_1_1_1_1_1,"You don't get to tell other people what their own definitions of words are lol. I read the one you provided and I agree with it. That's what it means. Again how is this a gotcha?

And even if it were impossible to define, do you think that invalidates the criticism somehow? Mind explaining how that works?",0.0335565785529062,0.0212523937225341,0.4991303980350494,0.9535965621471404,0,0
post_21,post_21_6_1_3_1_2,"You mean banning porn books from elementary school libraries? The books that parents would read excerpts from in school board meetings, full of only adults, and the parents would get shamed and kicked out for reading such vulgar stuff in public. They want that same book to be available to your 4th grade child in the school library. 

Who's ""rights"" are they taking away?",0.4485892819853419,0.0077044963836669,0.4443406760692596,3.057718276977539e-05,0,1
post_21,post_21_6_1_3_1_2_1,"Man you really are dense...giving children porn is a crime

&#x200B;

If it was ACTUAL porn...people would be in jail.

&#x200B;

Also you have any proof of any claims you are making? Can you name any books that contain ""porn""? do you even know what sort of books are beingh banned? Do you even have kids?",0.9575969036458564,0.0549386143684387,0.0700781941413879,2.855062484741211e-05,0,0
post_21,post_21_6_1_3_2,What a joke. You presume Social justice comes at the expense of quality or merit without proof that it does.,0.1771550430698164,0.0635314583778381,0.4996240437030792,8.693337440490723e-05,0,1
post_21,post_21_6_1_3_2_1,"Does prioritizing one thing necessarily take resources, effort, and focus from other priorities? Or can we have multiple top priorities like Dwight schrute",0.0278597325785052,0.6226006150245667,0.499697744846344,0.8093190491199493,0,0
post_21,post_21_6_1_3_2_1_1,The false premise is that one comes at the expense of the other. Social justice helps the other priorities.,0.0299391381642036,0.6408753991127014,0.4997799098491668,0.8758505284786224,0,0
post_21,post_21_6_1_3_2_1_1_1,"I'm sorry that's just not how anything works. Also you'd need a source to say that, since you demand one of me

Prioritizing something new does take from the previous priorities. There's no way around that and you haven't attempted even to explain your response to that point, you just keep repeating that it doesn't, so I'm not going in circles anymore

> what's your top priority?

> I have SEVEN. 

That's a joke a writer wrote thinking it was so ridiculous on its face that most people would laugh at it, realizing it's a joke. You're here saying that in a literal sense, totally serious and not as a joke",0.0302949317644122,0.0089784264564514,0.4997346699237823,0.0010530650615692,0,0
post_21,post_21_6_1_3_2_2,"https://www.cbc.ca/news/canada/prince-edward-island/pei-tyler-desroches-women-paramedics-1.6987117

a member of parliament got dropped for commenting that after targeting female paramedics and firemen, there’s been a significant increase in “lift assists”

yes, social justice comes at the expense of quality or merit",0.0302662610192496,0.649968683719635,0.4997304379940033,0.0002659857273101,0,1
post_21,post_21_6_1_3_2_2_1,Linking to an article you didn't read. The member of parliament said he was wrong. His info was wrong.,0.0261891522422608,0.8067761063575745,0.4996971487998962,4.0531158447265625e-05,0,0
post_21,post_21_6_1_3_2_2_1_1,i read it and he’s not wrong. he backpedaled after the idiot mob came after him for stating the obvious.,0.5824504597107577,0.4339416623115539,0.0170750617980957,0.0472188889980316,0,0
post_21,post_21_6_1_3_2_2_1_1_1,But it simply wasn't true.,0.0298298594093934,0.4289389848709106,0.4995978772640228,0.0004453361034393,0,0
post_21,post_21_6_1_3_2_2_1_1_1_1,"he was speaking from his own experience. sure, we’d like it to not be true, of course

> ""I just notice a lot more females in the profession now and we get a lot of calls for lift assist because — don't get me wrong, they're great, some of the women that are doing it are unbelievable — but I went to a lift assist the other day because both the females that were working the bus were 105 pounds and the man was 300 pounds and there was no way they were going to get him up.""",0.0270343038747441,0.1421559453010559,0.4997213780879974,4.291534423828125e-05,0,0
post_21,post_21_6_1_3_2_2_1_1_1_1_1,His own limited experience of hearsay,0.0291891182618317,0.524717390537262,0.4996788203716278,0.0024259984493255,0,0
post_21,post_21_6_1_3_2_2_1_1_1_1_1_1,"> ""I just notice a lot more females in the profession now and we get a lot of calls for lift assist because — don't get me wrong, they're great, some of the women that are doing it are unbelievable — but I went to a lift assist the other day because both the females that were working the bus were 105 pounds and the man was 300 pounds and there was no way they were going to get him up.""

come on man… again, yeah, we’d like it not to be true cuz it feels nicer but we’re victims of circumstance from billions of years of evolutionary biology. there’s nothing wrong with these women. they’re just human and can’t lift as much weight.",0.1474457726670236,0.0057122111320495,0.497178167104721,0.0010772347450256,0,0
post_21,post_21_6_1_3_2_2_1_1_1_1_1_1_1,That was outright bullshit. The standards had not been lowered.,0.9541311425394016,0.4716145992279053,0.4986803233623504,6.699562072753906e-05,0,0
post_21,post_21_6_1_3_2_2_1_1_1_1_1_1_1_1,"we’re talking about the outcomes here which, from his experience, have diminished as a result of adding too many women. it also tracks with our biology so it’s not that hard to believe",0.0323823806776468,0.3814118504524231,0.4997583627700805,0.9965783059597016,0,0
post_21,post_21_6_1_3_2_2_1_1_1_1_1_1_1_1_1,They have to meet the same standards. Furthermore biologically women have better stamina than men.,0.0622747000066309,0.4301264882087707,0.4996890425682068,0.8105482459068298,0,0
post_21,post_21_6_1_3_3,That was a really good definition. The only problem is that there is not a concrete answer to that question and everyone makes up their own definition. Excessive encroachment on individual rights. Woke. Losing contracts because your accused of rampant sexual assault? Also woke. Therein lies the problem.,0.1822508334793582,0.6963544487953186,0.4997567534446716,0.0005934834480285,0,1
post_21,post_21_6_1_4,"What’s your definition?

Since you think people should provide a definition.",0.0265583201583794,0.5806475281715393,0.4996898770332336,0.2243814766407013,0,1
post_21,post_21_6_1_4_1,"The problem is that there isn't one. The definition is ""anything I dont like""",0.0401970201524386,0.6533599495887756,0.499736338853836,0.0019363462924957,0,1
post_21,post_21_6_1_4_1_1,"I settled on, at least from the people who use that word directed at “the left”, it means unable to see basic logic over their cause, unyielding self righteousness while being ignorant to other opinions and discussion. This is generally what I think a person is trying to express when using this word weather they are right or not is another matter.",0.0345207095565065,0.0076715350151062,0.4997459053993225,1.436471939086914e-05,0,1
post_21,post_21_6_1_4_1_1_1,"Nah, people who use the word 'woke' as an insult are basically asleep at the wheel. You will just accept whatever ""facts"" are handed to you, never use any critical thinking skills or look into anything further (unless it's your favorite Facebook or YouTube propagandist, of course). Your brain is asleep.",0.4104977412272023,0.0184313058853149,0.4991710782051086,7.867813110351562e-06,0,1
post_21,post_21_6_1_4_1_1_1_1,"Ya that’s just not accurate at all and you just fit my description perfectly. This is probably around half the population you are talking about and the way you’re talking about them describes exactly what you’re doing right now. Someone said that to you once and you just accepted that as facts, never put a though into it, never questioned it, asleep at the wheel as you say. Now, would this lead me to say every woke person is asleep at the wheel? No that would make me dumb and ignorant.",0.1830213836881656,0.0110609531402587,0.4992055296897888,0.9905202090740204,0,0
post_21,post_21_6_1_4_1_1_2,"Sure, it might be one valid definition,  but it's pretty useless when in popular right wing media it's being use to describe things like having black mermaids,  having barbie feel empowered, and having more than two genders in your video game. 

There are real and accurate definitions to the word,  they just aren't being used",0.035595020109722,0.0106979012489318,0.4997229874134063,0.0001868605613708,0,0
post_21,post_21_6_1_5,define woman,0.2358840442883429,0.7256539463996887,0.4760973155498504,0.999780148267746,0,0
post_21,post_21_6_2,"Also, he quit the job , no one fired him, his speech was protected by law",0.0837198154700978,0.6588786244392395,0.4996511340141296,0.1889199018478393,0,1
post_21,post_21_6_3,"You are minimizing from my perspective, I’m guessing that you have never been the subject of an investigation by your employer Hiroshimaokonokiyaki",0.0559189090722979,0.5668626427650452,0.4997236430644989,0.0297431051731109,0,1
post_21,post_21_6_3_1,Most people don't tend to say racist shit over and over again,0.9649993523906848,0.5528650879859924,0.0017119050025939,0.0369846820831298,0,0
post_21,post_21_6_4,What is his take?,0.0297636800869614,0.6673989295959473,0.4992834031581878,0.0059265196323394,0,1
post_21,post_21_7,What a thin-skinned bitch,0.9968364265656252,0.6010047793388367,0.0002418160438537,2.682209014892578e-05,0,1
post_21,post_21_8,"What a piece of crap.  Stop whining, treat everyone kindly, and consider therapy.",0.989636814613065,0.3726336359977722,0.0002521872520446,2.0265579223632812e-06,0,1
post_21,post_21_9,"[University professor cancelled by students sets up a 'faculty for common sense' at rival institution to fight wokeness](https://www.dailymail.co.uk/news/article-12582107/University-professor-cancelled-students-sets-faculty-common-sense-rival-institution-fight-wokeness.html)

*[Professor Eric Kaufmann](https://en.wikipedia.org/wiki/Eric_Kaufmann) is launching war on woke at University of Buckingham*

A bit too late, one would say...;-) The problem is, many professors and Academicians collaborate with trend under silent hope, they will be sparred or even they could somehow profit on it - until they realize, they became its victims too. For instance they hire immigrants with [compliance with mobility action ](http://ec.europa.eu/research/participants/portal/doc/call/h2020/h2020-msca-itn-2015/1622613-itn_2015_-_guide_for_applicants_v1_en.pdf) under belief, they'll get cheap labour force which will not compete their tenured positions. See also:

* [University professor cancelled by students sets up a 'faculty for common sense' to fight wokeness](https://www.dailymail.co.uk/news/article-12582107/University-professor-cancelled-students-sets-faculty-common-sense-rival-institution-fight-wokeness.html)
* [Simon Evans, Paul Cox and Nick Dixon discuss a story from The Daily Mail.](https://www.youtube.com/watch?v=CkxQwgGeK5M)",0.029208768045408,0.0165182948112487,0.4995467066764831,5.0067901611328125e-05,1,1
post_21,post_21_9_1,Wow. This dude’s had it rough…,0.0655275793966726,0.5287322998046875,0.001623511314392,0.015746384859085,0,0
post_21,post_21_10,"Lol dude wasn’t cancelled, he quit. Boohooboobhoo nobody likes me because I’m an insufferable jerk. Woe is me.

Also the people comparing this to Ellen getting cancelled because she came out as Gay? Thank you for that laugh. Not even remotely in the same ballpark. 

You should have compared it to when people told Ellen to F*** off when it was revealed she was completely out of touch and a complete ass to her staff.",0.955477079291232,0.0123909711837768,0.0001971125602722,2.9206275939941406e-06,0,1
post_21,post_21_11,"So he's trying to be the British Jordan Peterson? 🤣 Weird move, let's see how it plays out for him.",0.0279279392785683,0.3301569819450378,0.4992397129535675,0.0001008808612823,0,0
post_21,post_21_11_1,Lol! He is Canadian.,0.0995176257400888,0.7735391855239868,0.0014428496360778,0.999915897846222,0,0
post_21,post_21_11_1_1,"Oh shit, so he's literally trying to be Jordan Peterson lite.",0.9623712837552788,0.0069386363029479,0.0032103657722473,0.0017887651920318,0,0
post_21,post_21_12,"What I can’t understand about PC/Woke culture is how much they embrace tribalism over universalism.

To this article, his opponents aren’t left wing, they’re posing as left wing.",0.0303981274314719,0.0088977813720703,0.4996976852416992,0.0051149129867553,0,1
post_21,post_21_13,Good,0.0259838495574143,0.8717360496520996,0.4588912427425384,0.9656976461410522,0,1
post_21,post_21_14,"Imagine being in education and actually using a term like ""wokeness"" as a bad thing. He can fuck right off.",0.9926579478961024,0.0061578750610351,0.0002074837684631,0.0006872415542602,0,0
post_21,post_21_15,What a bitch.,0.9969166068360044,0.5463359951972961,0.0003254413604736,0.0012153685092926,0,1
post_21,post_21_16,All because he couldn’t just say the n word. Smh,0.1994385721984178,0.0142256021499633,0.4790714979171753,0.0756725966930389,0,1
post_21,post_21_17,Good on him... maybe don't?,0.0279696735587223,0.0363264083862304,0.4934579133987427,0.997980386018753,0,1
post_21,post_21_18,I like laïcité.,0.0276808207378438,0.8007062077522278,0.4988115727901459,0.9690198600292206,0,1
post_21,post_21_19,Why are his statements all in the second person? It sounds so unprofessional.,0.0317093423812012,0.2995396852493286,0.4995616972446441,0.0003992021083831,0,1
post_21,post_21_20,thats awesome lol good for him,0.0345430861632532,0.402668833732605,0.0002467036247253,0.9985271096229552,0,1
post_21,post_21_21,What a shame. Common sense is one of my morals and is severely lacking these days.,0.6822688751684937,0.1184388399124145,0.4935806691646576,8.046627044677734e-06,0,0
post_21,post_21_22,Amen,0.0526828823529472,0.8770492076873779,0.4733404815196991,0.8867288529872894,0,0
post_21,post_21_23,.... Science,0.0315531872061865,0.9104092121124268,0.4994593262672424,0.9995052814483644,0,1
post_22,post_22_0,Study validates pyrvinium as treatment to prevent stomach cancer,0.0560929087513346,0.5402562618255615,0.4995583593845367,0.9912742972373962,0,1
post_22,post_22_0,"[Study validates pyrvinium as treatment to prevent stomach cancer](https://news.vumc.org/2023/10/05/study-validates-pyrvinium-as-treatment-to-prevent-stomach-cancer/) about study [Targeting Stem Cells and Dysplastic Features with Dual MEK/ERK and STAT3 Suppression in Gastric Carcinogenesis](https://www.gastrojournal.org/article/S0016-5085\(23\)05075-8/fulltext)


*[Study validates](https://www.gastrojournal.org/article/S0016-5085\(23\)05075-8/fulltext) that [pyrvinium](https://en.wikipedia.org/wiki/Pyrvinium), a drug that has been used for decades for intestinal pinworms, can be repurposed as a preventative treatment for stomach cancer. In details, pyrvinium acts through the following main mechanisms: (i) energy and autophagy depletion; and (ii) inhibition of Akt and Wnt-β-catenin-dependent pathways.*


Pyrvinium  could apparently work against additional cancers, than just stomach cancer. BTW It just happens that Ivermectin - a drug, which is also a dewormer - was recently found to have anticancer activity too. Pyrvinium is chemically close to hydroxychloroquine though (which is also a quinolinium derivative), but hydroxychloroquine doesn't lack anticancer activity also.

* [Pyrvinium selectively induces apoptosis of lymphoma cells through impairing mitochondrial functions](https://www.sciencedirect.com/science/article/abs/pii/S0006291X15310640)
* [Repurposing chloroquine and hydroxychloroquine as anti-cancer agents](https://www.ncbi.nlm.nih.gov/pmc/articles/PMC5718030/)
* [Ivermectin Kills Prostate Cancer Cells](https://www.reddit.com/r/ScienceUncensored/comments/10rlcam/ivermectin_kills_prostate_cancer_cells/), [Ivermectin converts cold tumors hot for treatment of breast cancer](https://www.reddit.com/r/ScienceUncensored/comments/zo3b6n/ivermectin_converts_cold_tumors_hot_for_treatment/)",0.0357673306439662,0.0126088261604309,0.4996457099914551,0.001685231924057,1,1
post_22,post_22_1,"Also see *Daily Mail* article: [FDA approves $12,000 cancer treatment that uses SOUND waves to disintegrate tumors - as a painless alternative to radiation and chemotherapy](https://www.dailymail.co.uk/health/article-12641137/FDA-approves-cancer-treatment-sound-waves.html)",0.024563456262533,0.0208745598793029,0.4996900558471679,0.1055814325809478,0,1
post_22,post_22_2,Also see: [Scientists Destroy 99% of Cancer Cells in The Lab Using Vibrating Molecules](https://www.sciencealert.com/scientists-destroy-99-of-cancer-cells-in-the-lab-using-vibrating-molecules),0.031645612044031,0.4009226560592651,0.499509334564209,0.0004433095455169,0,0
post_23,post_23_0,"There could be another equally massive, ""second Kuiper Belt"" hiding beyond the orbit of Pluto",0.0325123172496609,0.4063113331794739,0.4996522068977356,0.0027063488960266,0,1
post_23,post_23_0,"[There could be another equally massive, ""second Kuiper Belt"" hiding beyond the orbit of Pluto](https://www.livescience.com/space/astronomy/potential-discovery-of-a-dozen-objects-beyond-pluto-could-reveal-a-new-section-of-the-solar-system-we-never-knew-about) about preliminary report [Approaches to Detecting Kuiper Belt Objects for NASA’s New Horizons Extended Mission](https://www.hou.usra.edu/meetings/lpsc2023/pdf/2361.pdf)



There is [a whole bunch](https://i.imgur.com/Sc5NwiC.png) of [transNeptunian objects](https://en.wikipedia.org/wiki/Trans-Neptunian_object) [known already](https://i.imgur.com/Iqj7DJL.png) See also:

* [Puzzling objects found far beyond Neptune hint at second Kuiper belt](https://www.science.org/content/article/puzzling-objects-found-far-beyond-neptune-hint-second-kuiper-belt)
*Icy bodies at Solar System’s edge found during target hunt for NASA spacecraft*

 *However, the findings are hard to reconcile with unpublished negative results [from a recent survey](https://www.hou.usra.edu/meetings/acm2023/pdf/2523.pdf) of the outer Solar System using the 4-meter Víctor M. Blanco Telescope in Chile.*

* [James Webb Space Telescope spots dozens of physics-breaking rogue objects floating through space in pairs](https://www.reddit.com/r/ScienceUncensored/comments/16z870l/james_webb_spots_dozens_of_unexplained_jumbo/) 
* [A giant moon collision may have given rise to Saturn's iconic rings, study suggests](https://www.reddit.com/r/ScienceUncensored/comments/16v6bjy/a_giant_moon_collision_may_have_given_rise_to/)",0.0309703822933933,0.0125768184661865,0.4994952380657196,0.0007156729698181,1,1
post_23,post_23_1,Reminds me of the Lars Von trier movie melancholia lol,0.0372487731383927,0.2174152731895446,0.0012406110763549,0.9595114290714264,0,1
post_24,post_24_0,50-year-old Cambodian man dies from bird flu,0.4508917297958892,0.8848183751106262,0.4668738842010498,0.0004708468914031,0,1
post_24,post_24_0,"[50-year-old Cambodian man dies from bird flu](https://www.newagebd.net/article/214425/50-year-old-cambodian-man-dies-from-bird-flu)

*A 50-year-old man has died from H5N1 bird flu in Cambodia, the health ministry said, & investigating the source. Around 50 poultry, owned by him & his neighbors, died recently. ‘The dead chickens were shared among villagers to eat,’ says ministry.*",0.0435954325126533,0.7147883176803589,0.4995611011981964,0.0001390874385833,1,1
post_24,post_24_0_1,"We have a bird flu out break in South Africa, we can't really buy eggs because the prices are high as elon musks space balls",0.0777807070085554,0.318995714187622,0.002761960029602,0.0002081096172332,0,1
post_24,post_24_1,"Well if they ate diseased birds, they should of seen that coming.",0.2082450659844006,0.021035611629486,0.0135174989700317,0.0009236633777618,0,1
post_24,post_24_2,Also see: [Deja flu? Alert over spread of mystery pneumonia 'that has sickened dozens of healthy people in Argentina' | Daily Mail Online](https://www.dailymail.co.uk/health/article-13322629/Deja-flu-Alert-spread-mystery-pneumonia-sickened-dozens-healthy-people-Argentina.html),0.0322711646765974,0.6088788509368896,0.4994029402732849,0.0017844438552856,0,1
post_24,post_24_3,Also see: [I've studied bird flu for 20 years and here's why I stopped drinking milk..as FDA begin testing dairy cows for deadly virus | Daily Mail Online](https://www.dailymail.co.uk/health/article-13350921/bird-flu-stopped-buying-dairy-milk-fda.html),0.0268932207227336,0.201948344707489,0.4995151162147522,0.0002384185791015,0,0
