Subreddit,PostID,CommentID,Text,Combative,Deliberative,Toxicity,Rationality,Mutual Respect,Emotion,Moderator,Diversity
PremierLeague_data,post_1,post_1_0,"Fellow fans, this is a friendly reminder to please follow the [Rules](https://www.reddit.com/r/premierleague/about/rules) and [Reddiquette](https://support.reddithelp.com/hc/en-us/articles/205926439-Reddiquette). 

Please also make sure to [Join us on Discord](https://discord.gg/football)


*I am a bot, and this action was performed automatically. Please [contact the moderators of this subreddit](/message/compose/?to=/r/PremierLeague) if you have any questions or concerns.*",0,1,0.0242132920029378,0.0332357883453369,0.6960554838180542,0.8351684510707855,1,1
PremierLeague_data,post_1,post_1_1,If the price is right lol,0,0,0.0620634752838714,0.7276545166969299,0.1852295994758606,0.9780409038066864,0,1
PremierLeague_data,post_1,post_1_2,"He really went with ""I'm happy here, unless??""",1,0,0.0254331608420375,0.014971375465393,0.4995634257793426,0.0511132478713989,0,1
PremierLeague_data,post_1,post_1_2_1,"Dude, thats what 99% of managers will say in general..",1,0,0.0441738728196956,0.4780640602111816,0.4470028877258301,0.9994901120662688,0,1
PremierLeague_data,post_1,post_1_2_2,Gotta keep yourself open when the biggest club in London is sniffing after you 😏,0,0,0.2066340324633818,0.5280730128288269,0.0013278722763061,0.9462862610816956,0,1
PremierLeague_data,post_1,post_1_2_2_1,"*biggest bench in London

Jokes aside it would be a weird hire considering the clubs statement and Frank only bring 2 years younger than Poch",0,1,0.1043341189761195,0.0155195593833923,0.0008837580680847,0.1006037294864654,0,0
PremierLeague_data,post_1,post_1_2_2_1_1,"Agreed, would be an odd appointment when our idiot owners allegedly want a young manager",0,0,0.6301835872320973,0.6514958143234253,0.0022851228713989,0.1324776113033294,0,0
PremierLeague_data,post_1,post_1_2_2_1_2,tbf 50 is relatively young for a manager no?,0,1,0.0269078459190232,0.5321875214576721,0.4997105002403259,0.0120110511779785,0,1
PremierLeague_data,post_1,post_1_2_2_1_2_1,"Well I'd agree with that yeah, but Poch is 52. So getting rid of him because they want a young manager and hiring Frank wouldn't make sense as they're basically the same age",0,1,0.0479802328524916,0.0046380162239074,0.4678903222084045,3.4868717193603516e-05,0,0
PremierLeague_data,post_1,post_1_2_2_1_2_1_1,"Knowing Chelsea, they probably mean younger as in keeps quiet and lets the board do everything 😭",0,0,0.0314675152033484,0.5639840960502625,0.4972467422485351,0.9990655481815338,0,0
PremierLeague_data,post_1,post_1_2_3,It’s what his star striker has been saying all year so why not,1,0,0.0297009918571546,0.5285215973854065,0.499590128660202,0.965390771627426,0,1
PremierLeague_data,post_1,post_1_2_4,"In fairness, it makes complete sense. It doesn't make sense to close doors, especially not in a job where you can't be around forever.",0,1,0.0266743480284368,0.4637606143951416,0.4997594952583313,0.0654531419277191,0,1
PremierLeague_data,post_1,post_1_3,De Zerbi was also happy !,0,1,0.0278512518167889,0.0106887221336364,0.4995522797107696,0.9983693063259124,0,1
PremierLeague_data,post_1,post_1_4,"I know the current climate is the opposite but actually be a little worried if they got De Zerbi, Frank would just be another Potter",0,1,0.0383603544386967,0.4433024525642395,0.4996505975723266,0.0394456982612609,0,1
PremierLeague_data,post_1,post_1_5,"Life could be perfect, in Brentford.",1,0,0.0262460508845825,0.0165454149246215,0.4994198381900787,0.8276109993457794,0,1
PremierLeague_data,post_1,post_1_5_1_1,"Maybe you should do your 
[research](https://gprivate.com/6bc9p)",1,0,0.0243392955815184,0.4570859670639038,0.4994512796401977,0.8326616585254669,0,1
PremierLeague_data,post_1,post_1_6,"I like Thomas Frank, be a shame if he went to Chelsea.",0,0,0.1016159604660495,0.381591796875,0.4523077309131622,0.9837327003479004,0,1
PremierLeague_data,post_1,post_1_6_1,Surely he’s too smart for that,1,0,0.0717159287462929,0.5577639937400818,0.4993971586227417,0.168228805065155,0,0
PremierLeague_data,post_1,post_1_6_2,"I have to be honest and say I don't like him purely because of his salty comment when Isak scored for NUFC to win last season. 

It's entirely petty, and I don't care, but they whinged about Isak's price tag when they put a similar price tag on Toney's head. 

He's a bit of a sausage.",1,0,0.758825509903285,0.1486780643463134,0.4878390431404114,4.088878631591797e-05,0,1
PremierLeague_data,post_1,post_1_6_2_1,"I feel like every single manager in the league whines though, if you look for it probably any manager has had something to say after playing Newcastle in the past couple years either about reffing, money or whatever have you",0,1,0.0350434194735051,0.1487419009208679,0.4307478666305542,0.0145642757415771,0,1
PremierLeague_data,post_1,post_1_6_2_1_1_1,"Honestly reckon if he was backed properly he could do pretty well on a top team. Watching newly promoted Brentford play energetic pressing football and finishing midtable was pretty great to watch. And I'm all for hating and rivalries, but every manager is salty after a loss. Pep Arteta Ten Hag Klopp all have soundbites i remember off the top of my head",0,1,0.0487162524377461,0.0409733653068542,0.0003410577774047,0.9560654163360596,0,0
PremierLeague_data,post_1,post_1_7,He gone.,0,0,0.1528160769389146,0.9146326184272766,0.3884639143943786,0.8764346241950989,0,1
PremierLeague_data,post_1,post_1_8,They finished 16th and got some utter spankings. Not really sure why he’s made out to be the messiah.,1,0,0.2557355129570662,0.004747986793518,0.0004634857177734,0.0011626780033111,0,1
PremierLeague_data,post_1,post_1_8_1,"Because he did it with a team that are utter shite. Granted, they still could’ve done better, but without Toney that’s a squad that are comfortably relegated even this season, and Toney didn’t even perform at his level this season.",1,0,0.5475637730597911,0.0076475739479064,0.002428114414215,5.7220458984375e-06,0,1
PremierLeague_data,post_1,post_1_8_1_1,"Brentford hardly have a shite team, and their league position had nothing to do with the quality of the squad (other than depth), at one point Brentford had the worst injury list in the premier league and given the stink that is made about Newcastle or United or even Liverpool's injury list this season, that's worth baring in mind. The season before that they had one of the leagues best defences, the fact it fell apart because 90% of the players were injured and they lost Raya also speaks volumes. Long term injuries to both starting wingbacks all season as well, it's really unfair to say they had a shite team, shite depth, yes, but their starting 11 is comfortably mid-table.

You also don't know what you're talking about regarding Toney, who was utter shit when he returned and has had one eye on a move since. Brentford played better football when he wasn't on the pitch with a Wissa - Mbuemo - KLP front 3 than they ever did when he started this season, and again Mbuemo was injured from December - March, and Wissa went to AFCON for part of that.

The fact Frank kept them up with plenty of games to go is a testament to his abilities as a manager, but there is no denying that it would have been dicier in a more normal year. Hopefully this a wake up call on the recruitment side of things, especially if Frank decides to go elsewhere, because the squad needs depth and strengthening in key areas this season, there is always a risk of stagnating and collapsing in the Premier League.",1,0,0.3805813287947117,0.0121359229087829,0.4983566999435425,0.0034952163696289,0,1
PremierLeague_data,post_1,post_1_8_1_1_1,Factos,0,1,0.0295336808801181,0.646407961845398,0.4985559582710266,0.806278645992279,0,1
PremierLeague_data,post_1,post_1_8_1_2,">Toney didn’t even perform at his level this season.

Not really surprising. That many months out its going to be tough to get back in the flow midway through the season. If Frank stays at Brentford I'd expect Toney to fair better next season when he's had pre-season with the team and things.",0,1,0.0256336166487649,0.0064859390258789,0.4995972216129303,1.829862594604492e-05,0,1
PremierLeague_data,post_1,post_1_8_1_2_1,He's leaving... We've bought his replacement,1,0,0.0591062937328438,0.8862626552581787,0.4995290338993072,0.0342682898044586,0,0
PremierLeague_data,post_1,post_1_8_1_2_1_1_1,"We will sell him for what we can get, or he leaves for free the season after. He's not worth 25mill to us to keep him on for just 1 more year, so we'd rather sell him for that than sell him for nothing.",0,0,0.1734281825234833,0.626285970211029,0.4996388256549835,3.123283386230469e-05,0,0
PremierLeague_data,post_1,post_1_9,I really like his Brentford team. Quality manager!,0,1,0.0244611286434867,0.3299538493156433,0.472903162240982,0.999188244342804,0,1
PremierLeague_data,post_1,post_1_10,"Frank is definitely ready for a step up, he's done an excellent job at Brentford. I'm a huge admirer of him, I think his ability to play in more than one strict way is a huge quality. I'd be very excited if he became Manchester United manager.",0,1,0.0242826189714762,0.3398310542106628,0.4981257617473602,0.9998522102832794,0,1
PremierLeague_data,post_1,post_1_10_1,Ten Hag is staying until 2084,1,0,0.0660945681313906,0.7214629054069519,0.3673112392425537,0.1121788024902343,0,1
PremierLeague_data,post_1,post_1_11,He’s a salty bellend.,1,0,0.5816034626665498,0.919020414352417,0.0004207491874694,0.0154104232788085,0,1
PremierLeague_data,post_2,post_2_0,"Fellow fans, this is a friendly reminder to please follow the [Rules](https://www.reddit.com/r/premierleague/about/rules) and [Reddiquette](https://support.reddithelp.com/hc/en-us/articles/205926439-Reddiquette). 

Please also make sure to [Join us on Discord](https://discord.gg/football)


*I am a bot, and this action was performed automatically. Please [contact the moderators of this subreddit](/message/compose/?to=/r/PremierLeague) if you have any questions or concerns.*",0,1,0.0242132920029378,0.0332357883453369,0.6960554838180542,0.8351684510707855,1,1
PremierLeague_data,post_2,post_2_1,You should be asking Fulham and Leicester fans. They had him at a better age and with more game time,0,1,0.0241261854762976,0.8796937465667725,0.4996692240238189,0.7872843146324158,0,1
PremierLeague_data,post_2,post_2_1_1,"One of our massive bright sparks in a poor season (along with Andersen). He was a class above most other players but was unfairly remembered for a failed Panenka against WHU. He was inconsistent at times, but showed the potential to do what he did yesterday. 

Scott Parker is a football criminal as our relegation cost us Lookman, Andersen, Areola, and Anguissa. He played bang average winger Cavaleiro up top instead of Mitro, which says it all really. Should never get a top flight managerial role ever again.",1,0,0.0358738187298866,0.0731827616691589,0.4222852289676666,0.9039807319641112,0,1
PremierLeague_data,post_2,post_2_1_1_1,If you do a panenka for a crucial pen and fail you know it’s not something people will just forget the next day. Was his decision to take the risk,0,1,0.0597751877807306,0.1180161833763122,0.4996756017208099,0.0282967090606689,0,1
PremierLeague_data,post_2,post_2_2,"He was good when he played for Fulham, single handedly won us a match or two.",0,1,0.0273397221323407,0.057637333869934,0.4854640364646911,0.998689591884613,0,1
PremierLeague_data,post_2,post_2_2_1,"Also lost you a game when he tried to be too cocky with that penalty, I can't remember who it was against",1,0,0.1029729790101311,0.3890614509582519,0.4518808126449585,0.0013943016529083,0,1
PremierLeague_data,post_2,post_2_3,"After winning the u20 world cup with England I expected him to kick on and become a star, but its taken him a while to reach his prime. Always looked so good on the ball but something was missing, confidence possibly, but really happy to see him live up to his potential.",0,1,0.0278954160606335,0.5913549065589905,0.4987191557884216,0.9996132850646972,0,1
PremierLeague_data,post_2,post_2_3_1,"From what I read here in a Belgian article, he’s apparently only started really training at pro level at 16 (before that was amateur), and they state that he was missing a lot of stuff that he should’ve been taught at an earlier age that he was still learning when he jumped from the championship to the premier League. It was an interesting read, but it’s in Dutch, apologies/ Source: [https://sporza.be/nl/2024/05/23/opgeleid-in-amateurvoetbal-gelanceerd-door-belgische-ontdekker-het-verhaal-van-hattrickheld-ademola-lookman\~1716455938546/](https://sporza.be/nl/2024/05/23/opgeleid-in-amateurvoetbal-gelanceerd-door-belgische-ontdekker-het-verhaal-van-hattrickheld-ademola-lookman~1716455938546/)",0,1,0.0279344006209677,0.0159597992897033,0.4996692836284637,0.0027576982975006,0,1
PremierLeague_data,post_2,post_2_4,"I saw him play for Charlton against Leeds years ago and thought he looked very special, cool to see him doing so well at the highest level.",0,1,0.0238190259327979,0.5091800093650818,0.4986790716648102,0.9956378936767578,0,1
PremierLeague_data,post_2,post_2_5,"Look man, sometimes it doesn’t work out",0,0,0.031683002529547,0.5427292585372925,0.4453643560409546,0.0002971291542053,0,1
PremierLeague_data,post_2,post_2_5_1,Sometimes it isn't meant to be,0,0,0.0274143234255052,0.7663173675537109,0.4996326863765716,0.1250670254230499,0,1
PremierLeague_data,post_2,post_2_6,"Impressed me whenever I watched him, I was confused why he didn’t get more playing time.",0,1,0.0258136716543111,0.0246152877807617,0.4993557333946228,0.998993456363678,0,1
PremierLeague_data,post_2,post_2_6_1,Because he was really inconsistent but he was also young and Everton's style at the time just didn't seem to suit him,0,1,0.0284370194236658,0.3065778613090515,0.4997335970401764,0.0002904534339904,0,1
PremierLeague_data,post_2,post_2_6_2,I think some players just peak a little later on in their careers. He's probably benefitted by not playing in England as well.,0,0,0.024499959043516,0.368803858757019,0.4997371137142181,0.1415619254112243,0,1
PremierLeague_data,post_2,post_2_7,"Skilful with potential but was inconsistent, which is what you’d expect from a youngster. He seemed to get impatient at not playing more, we had shit managers who played defensively and didn’t trust him.",0,0,0.648703302345497,0.0103144645690917,0.3188830018043518,0.0001105964183807,0,1
PremierLeague_data,post_2,post_2_7_1,First time I saw him was January 2017 when Ronald Koeman’s Everton beat Guardiola’s City 4-0 (wow).  He slotted past Bravo for the fourth. It’s always a nice surprise to see him here and there since then.,0,1,0.0255902903617862,0.1973625421524047,0.4991125762462616,0.9995430111885072,0,1
PremierLeague_data,post_2,post_2_8,"Looked promising as a youngster, showed flashes of brilliance but couldn’t really do it consistently",0,1,0.0257437263591026,0.2374480962753296,0.4992603361606598,0.0001751780509948,0,0
PremierLeague_data,post_2,post_2_9,"He was alright. Didn’t set the world alight, but at the same time he was 18 or 19 and just came from league 1. I think a loan spell in the championship would have done him good, but we had bigger issues at the time.",0,1,0.0259889890680317,0.6015907526016235,0.4997051358222961,0.0086891055107116,0,1
PremierLeague_data,post_2,post_2_9_1,Think he played under Koeman & Allardyce. Two managers that didn’t rate young players nor played very attacking either.,0,0,0.027903545464642,0.0162000656127929,0.4997272193431854,0.0025067925453186,0,1
PremierLeague_data,post_2,post_2_9_1_1,Yeah it weren’t an ideal time to be breaking in to our team.,0,1,0.0286494482172637,0.0046784281730651,0.2550607025623321,0.0010416805744171,0,0
PremierLeague_data,post_2,post_2_10,"Look, man….",0,0,0.1026130091742602,0.0917425155639648,0.0235059857368469,0.9478077590465546,0,1
PremierLeague_data,post_2,post_2_10_1,"I can’t, I’m Blind Daley",0,0,0.2072436574631476,0.6728168725967407,0.0015876293182373,0.0944420397281646,0,1
PremierLeague_data,post_2,post_2_10_1_1,"Do you want to borrow my glasses? Don't worry, theyll fit, one size Fitz Hall",0,0,0.090030351991157,0.6984584927558899,0.4922996163368225,0.999892920255661,0,1
PremierLeague_data,post_2,post_2_10_1_2,Points!!,0,0,0.0387090547606141,0.0793883204460144,0.4988392293453216,0.9991194009780884,0,0
PremierLeague_data,post_2,post_2_11,"Lookman, he wasn't great",0,0,0.0850142607576815,0.6161242723464966,0.3586974740028381,8.088350296020508e-05,0,1
PremierLeague_data,post_2,post_2_11_1,"Lookman, that was a long time ago, give it a rest will ya",0,0,0.0419091690385243,0.0875340104103088,0.0239731669425964,0.0006927251815795,0,1
PremierLeague_data,post_2,post_2_12,Isn’t he the kid that did that stupid penalty for Fulham and missed?,1,0,0.8848430608079487,0.0323847532272338,0.0376725792884826,0.0012654662132263,0,1
PremierLeague_data,post_2,post_2_12_1,That's the one,0,0,0.0425700525628364,0.9317041635513306,0.4995346367359161,0.991372138261795,0,1
PremierLeague_data,post_2,post_2_12_2,This is my first thought when I hear his name.,0,0,0.025106211467679,0.5931181907653809,0.499284029006958,0.2247810661792755,0,1
PremierLeague_data,post_2,post_2_13,Everton suffered heavily from having so many different managers with so many varying styles of play. Plus he was young and generally young players need a steady platform to build into. He would have likely flourished under a Martinez or Silva if they and he were given more time.,0,0,0.0258911470487627,0.5647295713424683,0.4997259080410003,0.0663222074508667,0,1
PremierLeague_data,post_2,post_2_14,He made life hell for us when we played against Fulham a few years back,0,0,0.0777004388313837,0.2721253633499145,0.4026168882846832,0.992598593235016,0,0
PremierLeague_data,post_2,post_2_15,Mate it’s Everton. Prime Messi could play there and they would have him play terrorist football,1,0,0.213286844815941,0.2681325078010559,0.0002501606941223,0.9470900893211364,0,1
PremierLeague_data,post_2,post_2_15_1,"You clearly only watched Everton the last few years. Under Moyes and early Martinez years as well as the Ancelotti years, Everton played some great football. We had some fun attacking teams with Lukaku, Mirallas, deulofeu and prime Coleman and Baines pushing up the field",0,0,0.0244810579895382,0.1293440461158752,0.4993720054626465,0.9986753463745116,0,1
PremierLeague_data,post_2,post_2_15_1_1,Moyes teams playing great football is something I never expected to hear😂😂,0,0,0.0334801460065185,0.5492640137672424,0.4989131987094879,0.9943556785583496,0,1
PremierLeague_data,post_2,post_2_16,"we about to splash $120m for him only to find he is trash, just like he was at everton",0,0,0.8148208629579559,0.6946309208869934,0.0029857158660888,0.0024642348289489,0,1
PremierLeague_data,post_2,post_2_16_1,"Yea the problem is Lookman, not your car crash of a club.",1,0,0.5607453636151234,0.5336576700210571,0.0014482140541076,0.9782995581626892,0,1
PremierLeague_data,post_2,post_2_16_1_1,Watch your fkn mouth,1,0,0.969246521729768,0.7778176665306091,0.0002972483634948,0.9978416562080384,0,0
PremierLeague_data,post_2,post_2_16_1_1_1,"Why, what you gonna do, pay me £300k a week to hand out school meals and miss sitters?",1,0,0.1947472594806556,0.5200517773628235,0.0413817167282104,0.0001540184020996,0,0
PremierLeague_data,post_2,post_2_16_1_1_1_1,Don't you dare...,1,0,0.4325803822862739,0.916785478591919,0.003763735294342,0.0006906986236572,0,0
PremierLeague_data,post_2,post_2_16_1_1_1_1_1,Yeah! How dare he talk about Manchester’s 2nd best club like that!,0,0,0.5739321090559711,0.0055583119392395,0.0024906396865844,0.9921155869960784,0,1
PremierLeague_data,post_2,post_2_16_1_1_1_1_1_1,"The audacity, take that back!",0,0,0.3584320094212701,0.4352006912231445,0.00247722864151,0.0107342600822448,0,0
PremierLeague_data,post_2,post_2_16_1_1_1_1_1_1_1,"Dude, is this your kink?",0,0,0.3090259205777847,0.4873198866844177,0.0005250573158264,0.7792063653469086,0,0
PremierLeague_data,post_2,post_2_16_1_1_1_1_1_1_1_1,"Come on, you're ruining the fucking mood now! I was so close...",1,0,0.9975121665155252,0.4504623413085937,0.0003325939178466,0.7910825610160828,0,0
PremierLeague_data,post_2,post_2_16_1_1_1_1_2,He’s made you look like a right mug!,0,0,0.3347852485273383,0.4176525473594665,0.0008360147476196,0.1478525698184967,0,1
PremierLeague_data,post_2,post_2_16_1_1_1_1_2_1,Oof he did.,0,0,0.0769927046500555,0.94282329082489,0.0107507705688476,0.8418592810630798,0,0
PremierLeague_data,post_2,post_2_16_2,It wouldn't be the first time United haven't done their due diligence.,0,0,0.0274510990533368,0.3719126582145691,0.4997242391109466,0.0989753901958465,0,1
PremierLeague_data,post_2,post_2_17,"Was ‘the one that got away’ for Leicester. Our first RW with potential for years. Most of the fanbase is quite heartbroken we didn’t sign him, and look at him now.",0,0,0.0271374303215289,0.4325441718101501,0.4978313148021698,0.1008481085300445,0,1
PremierLeague_data,post_2,post_2_18,"Ass.

Good that he had a good game though",1,0,0.9605294268288868,0.1576399803161621,0.0007823705673217,0.9335535764694214,0,1
PremierLeague_data,post_2,post_2_19,Always had the talent jus not every player can adapt to the prem well theres always been players like that,0,0,0.0403772772868851,0.0423113107681274,0.4314023852348327,0.1072946786880493,0,1
PremierLeague_data,post_2,post_2_20,"Everton fan here. He showed massive potential but he was the definition of hot and cold when he was younger. The problem was he cost a few quid from Charlton, I think 11 million. So he came in young with an inflated ego which never left him. I believe he left due to lack of game time  which I guess made sense but his attitude didn't merit game time at that point. Some player now though",0,1,0.0390614449835403,0.3587239384651184,0.4984089732170105,0.0010052323341369,0,1
PremierLeague_data,post_2,post_2_21,"Top Championship player, not consistent enough for the prem.",0,0,0.027172442884705,0.6438283324241638,0.4992357194423675,0.768065482378006,0,1
PremierLeague_data,post_2,post_2_22,He was amazing at Charlton Athletic,0,1,0.0242817631947106,0.8772276639938354,0.4978365004062652,0.9988974332809448,0,1
PremierLeague_data,post_2,post_2_23,I remember him against us when he was at Fulham and he was banging. Then again didnt take much and was the only real spark they had on the pitch.,0,0,0.0295548219574999,0.6475653648376465,0.4971876144409179,3.045797348022461e-05,0,1
PremierLeague_data,post_2,post_2_24,"He wasn't really that good in his everton spell, balled a little bit in fulham. The thing is just that not every player will work out for a particular club/league.",0,0,0.0305140264351697,0.2426472902297973,0.4996500015258789,6.031990051269531e-05,0,1
PremierLeague_data,post_2,post_2_25,I don’t even remember him playing for Everton. That should be an indication.,0,0,0.0258199023626825,0.4857605695724487,0.4996872246265411,0.0008386671543121,0,0
PremierLeague_data,post_2,post_2_26,Scored a goal on his debut (I think) when Everton beat Pep’s City 4-0 (Pep’s heaviest defeat). But he was very young and inconsistent. The constant change of managers and instability at the club couldn’t have helped him.,1,0,0.042653543769399,0.6948626041412354,0.4996433556079864,0.0029758810997009,0,1
PremierLeague_data,post_2,post_2_27,Isn't he like really this good only this match? Saw Atalanta fan said he not usually this good,0,0,0.0325966432681434,0.0487982034683227,0.4373000860214233,0.0012795329093933,0,1
PremierLeague_data,post_2,post_2_27_1,"He just had one of the greatest ever performances in a European final last night. The only players who are regularly that good are Messi, Pele, Maradona, CR7, R9 etc.",0,0,0.0303070358754073,0.0547152757644653,0.4995582997798919,0.9989538192749025,0,1
PremierLeague_data,post_2,post_2_27_2,He’s been great for the past two seasons,0,0,0.0258755198098372,0.2520554065704345,0.4968748092651367,0.9984605312347412,0,1
PremierLeague_data,post_2,post_2_27_3,On commentary I thought I heard them say he was their top scorer last year. Although he obviously isn't that good every much otherwise he would be a prime Messi/Ronaldo tier of player.,0,1,0.0260279408184168,0.8265695571899414,0.499649703502655,0.0019364058971405,0,1
PremierLeague_data,post_2,post_2_27_3_1,Silly comment. A Messi Ronaldo tier is at the very top with very few other players. There are multiple tiers with plenty of top class players below the Messi /Ronaldo rarefied space. ,1,0,0.2080795540465154,0.0159597992897033,0.4990309774875641,0.0001344382762908,0,1
PremierLeague_data,post_2,post_2_27_3_1_1,It was an elite one off performance. If you can't grasp the context of that then that is a you issue.,1,0,0.0299070270687378,0.5836930871009827,0.4997605085372925,0.8605452179908752,0,0
PremierLeague_data,post_2,post_2_28,"He was good but inconsistent. You could see the raw talent, but somehow, he never lived up to it in the Premier League. I'd love to see him try again because he looked so good yesterday and and in some other games I've watched him this season (mostly the Afcon)",0,1,0.0269070260451601,0.0149775147438049,0.4994976818561554,0.0005486011505126,0,1
PremierLeague_data,post_2,post_2_29,Inconsistent in his prem spells with flashes of brilliance I’d say is the general consensus on his time in the league.,0,0,0.0281935425760007,0.2114496827125549,0.4997215569019317,0.9369080364704132,0,1
PremierLeague_data,post_2,post_2_30,Looked good at leicester but i dont think they could afford to sign him,0,0,0.025538893075724,0.6889051795005798,0.4950929880142212,0.0825153291225433,0,1
PremierLeague_data,post_2,post_2_31,He was English back then 🤣,1,0,0.0414257463628612,0.8922286629676819,0.4990001022815704,0.0866917669773101,0,1
