Subreddit,PostID,CommentID,Text,Combative,Deliberative,Toxicity,Rationality,Mutual Respect,Emotion,Moderator,Diversity
NeutralPolitics_data,post_4,post_4_1_1_2,"> Is it tuition dollars, or endowment dollars that are going towards these investments? 

The students are aware that the investments are part of the endowment and not taken from their tuition. Many universities acknowledge at the institutional level that their choice of investments ought to represent the values of the university as a place of learning populated by faculty and students, and have looked in the past to students to hear opinions on how to direct endowment funds. Some quotations from Brown University students' overview statement [Brown Divest Now](https://drive.google.com/file/d/1J3VLPCRi7qvMkdcWqj-2HPwR9C1Oq1uL/view):

> [Brown's Advisory Committee on Corporate Responsibility in Investment Practices] served to represent and articulate the Brown community’s moral expectations when it comes to how our endowment is invested. (p.2)
> 
> “[Divestment] is a critically important and strong statement by the University community..."" (quotation from Brown President Ruth J. Simmons on a past decision to divest from Sudan in 2006; p.1)

The fundamental issue raised by the Brown protesters is that the university endowment's Advisory Committee already endorsed divestment in 2020. The current president rejected the committee report in 2021 and refused to bring it to the university corporation, which has been the cause of protests ever since. (p.37, footnote 9) A vote of 90% of graduate students and a supermajority of the student council have called on the corporation to implement the committee's decision. (p.22)

For Brown students, the objective of the encampment protest was simply to force the president and the corporation to agree to a vote. Last week, they reached such an agreement and dismantled their encampment. ([NPR report](https://www.npr.org/2024/05/01/1248403491/at-brown-university-protesters-and-administrators-reach-deal-to-end-encampment))

I have no knowledge of the position of students in other states so can't comment on anti-BDS laws.",0,1,0.0262644164519623,0.1843041181564331,0.4997410476207733,0.0019173026084899,0,1
NeutralPolitics_data,post_4,post_4_1_1_2_1,"Excellent information. Thanks!

It seems like the students at Brown have well-defined, achievable goals.",0,1,0.0230438268290433,0.0235064625740051,0.6965780675411224,0.9987226724624634,1,0
NeutralPolitics_data,post_4,post_4_1_1_3,"Many investment professionals would say that “targeting” investments is a bad strategy, though. (That’s one of the [core tenets](https://www.bogleheads.org/wiki/Bogleheads%C2%AE_investment_philosophy) of the [Bogleheads](https://www.bogleheads.org) line of thinking.)

But this brings up a host of secondary questions, including: what exactly defines a company that has ties to Israel? Is it any company that has a physical presence in the country? Agreements with the government? Customers in that country? (Does Google / Microsoft / Apple / other large American multinationals that do business in almost every country in the world count?)

And honestly, an index fund won’t have a major stake in any single company (that’s kind of the point). [Here’s an overview of VTI](https://www.investopedia.com/articles/investing/122315/vti-vanguard-total-stock-market-etf.asp), one of the most popular index investment vehicles, which includes more than 3,700 stocks. As a result, I don’t think there’s a big chance that divestment would have a meaningful impact on the company in question. Divestment from said funds would largely be symbolic, which, sure, but it feels like a weird goal to use as your primary demand.

I mean, if Columbia had 50% of their endowment planted in Raytheon stock, that would make sense. But I’m not sure the general public understands how this kind of investing typically works.",0,1,0.0248876509610851,0.2902155518531799,0.4997707009315491,0.0004115402698516,0,1
NeutralPolitics_data,post_4,post_4_1_1_4,"> Is it tuition dollars or endowment dollars that are going towards these investments? My understanding is that tuition dollars get spent entirely on education. In a university like Harvard, tuition revenue doesn't even cover operating expenses and the endowment has to make up the difference

This is complicated from the fact that money is fungible. On paper, it can be separated out into various inputs and outputs and trade certain money from one to the other. In practice, if an entity has a certain amount of money coming in (e.g., combined funds from tuition and endowment) and a certain amount of money going out, does it really make a difference which money comes from where? At the end of the day, decisions have to be made based on cumulative totals on both sides (in and out), and things can get fuzzy in order to make the desired outcomes happen.",0,1,0.0245707028760509,0.2879759073257446,0.4997642636299133,0.0001855492591857,0,1
NeutralPolitics_data,post_4,post_4_1_1_5,"Some demands are much more reasonable. For example, MIT's students simply demand the university to divest from the IDF. This should be a much more morally conscious decision.",0,1,0.0240168104878124,0.2822363972663879,0.4997711777687073,0.0029922127723693,0,1
NeutralPolitics_data,post_4,post_4_1_2,[deleted],0,0,0.0260687223098937,0.8900734782218933,0.4747309684753418,0.0003655850887298,0,1
NeutralPolitics_data,post_4,post_4_2,"I don't have time for a long post. I'll edit later if I remember. 

Several universities including Brown have agreed to meet and vote on the protestor demands. What you make of this may depend on your level of cynicism. 

This article does a decent job of summarizing both the demands and agreement. 

[https://www.npr.org/2024/05/07/1249368151/gaza-college-protest-deal-brown-rutgers](https://www.npr.org/2024/05/07/1249368151/gaza-college-protest-deal-brown-rutgers)

>""We thought the best way to sustainably deescalate the situation was to actually talk with our students,"" Northwestern President Michael Schill [told WBUR's *Here and Now*](https://www.wbur.org/hereandnow/2024/05/02/northwestern-campus-protestors). ""We have a good sustainable agreement which provides a number of things that the students wanted and that we wanted to do.""

>Northwestern's agreement, for instance, permits peaceful demonstrations — though no tents — through the end of classes on June 1, gives students representation on an investment committee and pledges to bring Palestinian students to campus, [among other commitments](https://www.northwestern.edu/leadership-notes/2024/agreement-on-deering-meadow.pdf).",0,1,0.027000021951678,0.3349663019180298,0.4997225701808929,0.2289277613162994,0,1
NeutralPolitics_data,post_4,post_4_3,"Zadie Smith has an [excellent article in the New Yorker](https://www.newyorker.com/news/essay/shibboleth-the-role-of-words-in-the-campus-protests) detailing what’s going on, problems with it, use of language by protestors, and she avoids taking a stance one way or the other. Strategies and response seems to vary by state. Palestinian Student Alliance has been active on college campuses since the 90s, and their presence seems to grow in the aftermath of significant conflicts.",0,1,0.0250903516930613,0.2312241196632385,0.4997563362121582,0.912561297416687,0,1
NeutralPolitics_data,post_4,post_4_4,"I haven’t seen many concise arguments for why they are protesting at all. In fact my sister asked me the other day why students are randomly supporting a terrorist group. 

So real quick, the October 7 Hamas attack killed around 1,200 people and 253 people were taken hostage. This includes 764 civilians killed (36 children) while the remaining were Israeli military. 

https://tennesseelookout.com/2024/02/20/the-most-tragic-victims-in-the-israel-hamas-war-are-those-who-have-no-say-in-it/

Since October 7th, Israel has killed 34,535 Palestinians and there may be an additional 10,000 under rubble. This includes more than 11,000 women and 13,800 children. 

https://www.npr.org/2024/02/29/1234159514/gaza-death-toll-30000-palestinians-israel-hamas-war

So there is a huge mismatch between deaths of Israeli and Palestinians especially among women and children (36 Israeli children and 13,800 Palestinian children in 7 months, and counting) 

Additionally, Gaza is surrounded by a wall and the two borders crossings are closed. Israel has 1 border and has closed it (because war) and Egypt is worried about Hamas among refugees sneaking into Egypt and moving the Palestine/Israel problem and turning it into an Egypt/Israel problem if Hamas attacks Israel from Egypt. 

https://www.npr.org/2023/12/12/1218388766/egypt-israel-gaza-palestinians-hamas

So for now, the 2 million people in Gaza are stuck there. Women and children who would be refugees fleeing violence are instead part of the death count. 

Killing children is a war crime. The US gives Israel military aid which has people upset and I would argue is the root of the protests. 

Colleges invest their money in the stock market including companies currently profiting by the US support of Israel in this war. Students hope that by pressuring colleges to remove stocks/investment in these companies (divesting), they can make profiting from the war unprofitable for companies as their stocks dip. Colleges have a lot of wealth and power, and students hope to twist their university’s arm into divesting from companies like Boeing will pressure these companies to stop building weapons that may be used to kill Palestinian women and children. 

https://time.com/6974063/divestment-explained-campus-protest-israel/

There’s a whole host of unanswered questions for me, like why protest colleges and not the US government directly?  But I suppose colleges are smaller fish to debate and colleges like Brown are negotiating divestment with students as a direct response to the protests. 

https://www.theguardian.com/world/article/2024/may/04/universities-allow-student-campus-protest-encampments

Edit: this comment is a great write up about why it’s so hard to pinpoint “who started it” and why the most important thing may instead be “what’s are we going to do about it in the future”, hopefully less killings on both sides. 

https://www.reddit.com/r/NeutralPolitics/s/coDRWpbE0D",0,1,0.1085201216219884,0.359831690788269,0.4996718466281891,3.88026237487793e-05,0,1
NeutralPolitics_data,post_4,post_4_4_1,are any outside parties validating the death tolls?,0,0,0.0300107390738995,0.8357781767845154,0.4996873438358307,0.000344693660736,0,1
NeutralPolitics_data,post_4,post_4_4_1_1,"The IDF and Israeli intelligence officials both believe the Gaza Health Ministry death toll to be reliable.

https://www.newarab.com/news/israeli-intel-confirms-gaza-health-ministry-stats-reliable

The Gaza death toll has also been affirmed by the US:

https://www.wsj.com/world/middle-east/u-s-officials-have-growing-confidence-in-death-toll-reports-from-gaza-b3b5183a?st=arejzgntqzb3py3&reflink=desktopwebshare_permalink

As well as the UN:

https://english.almayadeen.net/news/politics/un-affirms-accuracy-of-gaza-ministry-of-health-death-toll-fi",0,1,0.0267637170155694,0.5689817070960999,0.4996293485164642,0.049988716840744,0,0
NeutralPolitics_data,post_4,post_4_4_1_2,"Yes, by both [Johns Hopkins](https://www.thelancet.com/journals/lancet/article/PIIS0140-6736(23)02713-7/fulltext) and [The London School of Hygiene and Tropical Medicine](https://www.thelancet.com/journals/lancet/article/PIIS0140-6736(23)02640-5/fulltext) using bombing reports and satellite imagery: [https://time.com/6909636/gaza-death-toll/](https://time.com/6909636/gaza-death-toll/)",0,1,0.0247243546265528,0.5423301458358765,0.4997151792049408,0.000307559967041,0,1
NeutralPolitics_data,post_4,post_4_4_1_2_1,"Those first two links seem to be the same and they're both broken. Would you please review and revise them?

Same thing in your other comment in this thread.",0,1,0.023884214085122,0.8241618871688843,0.6927034378051757,5.364418029785156e-06,1,0
NeutralPolitics_data,post_4,post_4_4_1_2_1_1,"That's weird, they are working from me and were copied directly from the Time Magazine article. I relinked them manually, so hopefully that fixes it. Either way, the same sources are available in the Time Magazine article.",0,0,0.0260524788156974,0.0203829407691955,0.4997345507144928,0.0001230537891387,0,0
NeutralPolitics_data,post_4,post_4_4_1_2_2,thank you for validating the data.,0,0,0.0224210265336347,0.6168208122253418,0.6983027398586272,0.9142012894153596,0,0
NeutralPolitics_data,post_4,post_4_4_2,[removed],0,0,0.0260143950586149,0.8984742760658264,0.4377089142799377,0.058917611837387,0,0
NeutralPolitics_data,post_4,post_4_4_2_1,"This comment has been removed for violating [//comment rule 2](https://www.reddit.com/r/NeutralPolitics/wiki/guidelines#wiki_comment_rules):

> If you're claiming something to be true, you need to back it up with a [qualified source](https://www.reddit.com/r/NeutralPolitics/wiki/guidelines#wiki_sources). There is no ""common knowledge"" exception, and anecdotal evidence is not allowed.

After you've added sources to the comment, please reply directly to this comment or send us a [modmail message](https://www.reddit.com/message/compose?to=/r/NeutralPolitics&subject=Comment%20removal&message=https://www.reddit.com/r/NeutralPolitics/comments/1clf4ix/-/l2wxg2j/) so that we can reinstate it.



If you have any questions or concerns, please feel free to message us.",0,1,0.0248958004040314,0.069609522819519,0.3631564080715179,0.0001445114612579,1,0
NeutralPolitics_data,post_4,post_4_4_2_2,"I would actually argue that it is well known that Hamas committed war crimes on Oct 7 but I had told my sister for the very first time last week that Netanyahu has committed war crimes (she doesn’t follow politics at all really). 

She knew about the hostages, she knew about the Hamas killings, she had no idea that Netanyahu had committed a single war crime. She was very annoyed at the student protests and was confused why anyone would side against the Israelis after the Oct 7th attack. She genuinely did not know tens of thousands of Palestinian children had died and continue to die. 

Both sides have committed war crimes. Specifically the children are the victims. One started it and brutally killed 36 children, but the other side continues to commit war crimes and has killed 13,800 children and counting. And the US is funding the ongoing violence. And they can’t escape either. There is no excuse as to oopsie kill that many children. 

Hamas is a terrorist organization and shouldn’t be funded, but Netanyahu probs shouldn’t be funded until there’s some sort of ceasefire and the Egypt border open/ (or other option) for women and children to escape. It’s complex but I can understand from an empathy perspective how that many dead children is something people want to end.",0,1,0.0693959325814794,0.4416710138320923,0.4995298087596893,0.0002013146877288,0,0
NeutralPolitics_data,post_4,post_4_4_2_2_1,You're incorrect and stating Hamas started this. Israel started this with the Nabka decades ago. They have been continuously oppressing and occupying Palestinians for decades.,1,0,0.1086742269301248,0.6587334275245667,0.4996852576732635,0.0004972517490386,0,1
NeutralPolitics_data,post_4,post_4_4_2_2_1_1,"Please edit in a source for this claim, per Rule 2.",0,0,0.0234025966011877,0.8721018433570862,0.4979538321495056,0.0249035954475402,1,0
NeutralPolitics_data,post_4,post_4_4_2_3,[removed],0,0,0.0260143950586149,0.8984742760658264,0.4377089142799377,0.058917611837387,0,0
NeutralPolitics_data,post_4,post_4_4_2_3_1,"This comment has been removed for violating [comment rule 2] (https://www.reddit.com/r/NeutralPolitics/wiki/guidelines#wiki_comment_rules) as it does not provide sources for its statement of fact.  If you edit your comment to link to sources, it can be reinstated.  For more on NeutralPolitics source guidelines, see [here] (https://www.reddit.com/r/NeutralPolitics/wiki/guidelines#wiki_sources).

If you have any questions or concerns, please feel free to message us.",0,1,0.0239284012780724,0.073092520236969,0.6929812312126159,0.0001069605350494,1,0
NeutralPolitics_data,post_4,post_4_4_2_4,[removed],0,0,0.0260143950586149,0.8984742760658264,0.4377089142799377,0.058917611837387,0,0
NeutralPolitics_data,post_4,post_4_4_3,"Why protest colleges? Because it’s their (and their family’s) money that they are paying to the college, that is going to Israeli companies. That is the protestors’ position.",0,1,0.0422259342767068,0.4365537762641907,0.4996762573719024,0.0002921819686889,0,1
NeutralPolitics_data,post_4,post_4_4_4,"this rationale presumes that the deaths from the surprise terrorist attack  are equivalent to collateral damage from retaliatory action wherein the terrorists have a [long history of using their civilian population as human shields](https://amp.theguardian.com/world/2023/oct/30/human-shield-israel-claim-hamas-command-centre-under-hospital-palestinian-civilian-gaza-city). are you suggesting that Israel should retaliate until they have killed the exact same number of people as the losses they suffered on October 7th and then stop? would the same logic hold true for the number of [rapes](https://www.vox.com/world-politics/24093631/un-israel-october-7-sexual-violence#:~:text=Based%20on%20its%20findings%2C%20the,subjected%20to%20sexual%20violence%2C%20too) and [hostages](https://www.bbc.com/news/world-middle-east-67053011.amp)?",1,0,0.0774030016549406,0.6054232120513916,0.4991810619831085,0.0001079142093658,0,1
NeutralPolitics_data,post_4,post_4_4_4_1,"Israel has already [taken more hostages](https://www.hrw.org/news/2023/11/29/why-does-israel-have-so-many-palestinians-detention-and-available-swap) and there have been plenty of [reports of sexual violence](https://amp.cnn.com/cnn/2024/02/20/middleeast/israel-hamas-un-investigation-sexual-abuse-intl) against Palestinians. 

No, the idea is not to retaliate to the exact number, obviously. The idea is a proportionate response that seeks to avoid killing civilians. When Israel does things like [attacking hospitals](https://www.nytimes.com/2024/04/02/world/middleeast/gaza-al-shifa-hospital.html?smid=nytcore-ios-share&referringSource=articleShare&sgrp=c-cb) and [aid centers](https://amp.cnn.com/cnn/2024/03/05/middleeast/israel-fire-palestinians-aid-northern-gaza-intl), it seems like they are doing very much the opposite. When [mass graves](https://www.aljazeera.com/amp/news/2024/4/25/signs-of-torture-as-nearly-400-bodies-found-at-gaza-hospitals-mass-graves) are found of hundreds of civilians in restraints, Israel isn’t even trying. 

Israeli officials have also been [pretty nakedly clear](https://apnews.com/article/israel-palestinians-south-africa-genocide-hate-speech-97a9e4a84a3a6bebeddfb80f8a030724#:~:text=TEL%20AVIV%2C%20Israel%20(AP),a%20charge%20that%20Israel%20denies) with their goal to wipe Gaza off the map. 

Obviously the violence by Hamas is reprehensible but it doesn’t give Israel license to massacre civilians as they see fit.",0,1,0.0543468907921391,0.0441575646400451,0.4990524649620056,1.7464160919189453e-05,0,1
NeutralPolitics_data,post_4,post_4_4_4_1_1,"as mentioned (and cited) earlier, Hamas' defense strategy of using human shields (including hospitals, as cited in the Guardian article) contributes to civilian casualties. i'm not sure how one judges what is ""proportional"" to a terrorist attack that largely targeted young concert-goers and families, but i'd be interested to see some examples of where such a constraint was placed on a country for a similarly heinous attack.",1,0,0.0248410262389386,0.0340056419372558,0.4997495412826538,0.0005898773670196,0,0
NeutralPolitics_data,post_4,post_4_4_4_1_1_1,"Human shields might contribute to human casualties, but there are increasingly reports of IDF soldiers murdering civilians ([source](https://www.bbc.com/news/articles/cw07wgrwzywo)), and even luring civilians out of buildings using drones that broadcast cries for help, only to shoot anyone who emerges ([source](https://www.middleeastmonitor.com/20240418-israel-using-drones-to-broadcast-cries-for-help-in-gaza-to-lure-shoot-palestinians/)), and with the lockout of journalists from Gaza there is likely more we don't know about. It's not just about whether the response is proportional, but what the actual goals of the Israeli government is. If their goal is to get the hostages back, they could have taken the deal offered by Hamas yesterday. If their goal is actually ""[complete victory](https://www.pbs.org/newshour/world/defiant-netanyahu-declares-israels-goal-is-complete-victory-in-gaza-after-un-court-ruling)"" as Netanyahu has stated, presumably continuing the siege and famine on Rafah until Hamas surrenders, then as an American Jew I find that a completely unacceptable level of response and far beyond being ""similarly heinous"" to what Hamas did on October 7th.

Hamas, who's leadership resides in Qatar, cannot be defeated this way ([according to an EU diplomat](https://www.politico.eu/article/eu-josep-borrell-israel-hamas-military-means-munich-security-conference/)). It would appear to me that Israel wants Gaza bulldozed, but even if they succeed in the genocidal act of doing so, the children who survive this conflict will likely turn into radical extremists, as we've seen happen so many times previously, so I question even the efficacy of their strategy, beyond it's immorality.

Israel is also risking dragging Iran into a war, which would be nightmarish scenario for Iran, Israel and the US.",0,1,0.0349835718132135,0.3244028687477112,0.4997320473194122,5.513429641723633e-05,0,0
NeutralPolitics_data,post_4,post_4_4_4_1_1_2,"I think the other reply to this does a good job explaining that there are clear instances of civilians dying when they're not human shields. Can you give any examples of that happening in this conflict that doesn't come from the IDF? Particularly at a rate that explains the number of civilian casualties? That's not to say it doesn't happen - I'm just curious because I know it's happened in the past. 

In terms of a 'proportional response', I'm not sure about other countries operating under this constraint, but that doesn't mean it's a bad standard. I think most people agree that the US used more force than necessary in invading the middle east. I suppose you could argue that protests against that war was people attempting to place that same constraint.

I'd also push back on the identities of the victims of October 7th having to do with 'proportional responses', especially when civilian deaths are involved. What happened that day was clearly horrific and a tragedy, but when invoked in discussing the magnitude of response, I worry that it just paves the way for civilian death on the other side, which is also horrible. By that logic, what is to stop Palestinians from seeing massacres at hospitals and aid sites and deciding on their own response? Where would it end?",0,1,0.0271126655538384,0.0146294832229614,0.4997617602348327,0.0104455351829528,0,0
NeutralPolitics_data,post_4,post_4_4_4_1_1_3,[removed],0,0,0.0260143950586149,0.8984742760658264,0.4377089142799377,0.058917611837387,0,0
NeutralPolitics_data,post_4,post_4_4_4_1_1_3_1,"Hamas is overwhelmingly supported by the Palestinian people and [3/4 Palestinians agree with the October 7th attack](https://www.reuters.com/world/middle-east/poll-shows-palestinians-back-oct-7-attack-israel-support-hamas-rises-2023-12-14/). Attackers on October 7th [included Palestinian militant groups and civilians working in concert with Hamas](https://flashpoint.io/blog/israel-hamas-war-military-and-terrorist-groups/). UN employees had direct involvement in the October 7th attacks. [\[1\]](https://www.reuters.com/world/middle-east/un-palestinian-refugee-agency-investigates-staff-suspected-role-israel-attacks-2024-01-26/) [\[2\]](https://www.nbcnews.com/news/un-workers-played-direct-role-oct-7-hamas-attack-israeli-intelligence-rcna136201) [\[3\]](https://www.cnn.com/2024/02/16/middleeast/israel-allegations-unrwa-october-7-intl/index.html)

  
i'd also like to point out that you are using twitter and instagram as your sources and i'm using reuters, cnn, and msnbc. LOL",0,1,0.0286938647758064,0.60890793800354,0.4996604323387146,0.0006855130195617,0,0
NeutralPolitics_data,post_4,post_4_4_4_1_1_3_1_1,"They are literal videos of Israeli officials , does it matter where it's from?

Im also using ""Times of Israel"" to show Israelis themselves critize how Bibi backed Hamas, but u seem to have ignored that part 〽️",1,0,0.1340072134143882,0.6901739835739136,0.4964784383773803,5.698204040527344e-05,0,1
NeutralPolitics_data,post_4,post_4_4_4_1_1_3_1_2,"I don’t believe there has been any evidence to support the claims that the UN employees were involved in October 7th other than Israel’s claims. 

Your first source also specifies that the war in Gaza has raised the level of support of Hamas. It seems pretty circular to claim civilians support them, attack said civilians and raise their level of support, and then point to the resulting number. 

Not to deny that there is indeed support, but given Hamas’ authoritarian nature, I don’t believe it’s exactly fair to hold citizens accountable in this way.",0,1,0.0244214332898172,0.1502467989921569,0.4997643828392029,6.145238876342773e-05,0,0
