Subreddit,PostID,CommentID,Text,Combative,Deliberative,Toxicity,Rationality,Mutual Respect,Emotion,Moderator,Diversity
AskALiberal_data,post_5,post_5_1_1,This. Republicans used to be the party of higher education once upon a time long ago. The scholarly wing of the party is severely lacking these days.,1,0,0.0473147960134704,0.1153629422187805,0.4997466802597046,0.0048817694187164,0,1
AskALiberal_data,post_5,post_5_2,"The elites of both political parties are extremely well-educated.  You can stereotype however you please, but the typical member of Congress -- Republican or Democrat -- looks a lot more like Ted Cruz (Princeton BA, Harvard JD) than Lauren Boebert.

More educated people tend to be a lot more ideologically consistent, so if America were substantially more educated, then you'd probably see a higher degree of ideological consistency and thus a higher degree of polarization.  

More educated people also tend to be less susceptible to the appeal of populism, so I imagine that you'd see a much reduced appeal for populist movements like Trumpism/the Tea Party, and a lot more appeal for the kind of elite-driven, pro-business style of conservatism associated with the Mitt Romneys or George HW Bushes of the world.",0,1,0.0251141625146785,0.0192949175834655,0.4997572898864746,0.0125586092472076,0,1
AskALiberal_data,post_5,post_5_2_1,"> More educated people also tend to be less susceptible to the appeal of populism

This is only true because educated people tend to be more well off. As more people educate themselves but still end up in the underclass this will change.",0,1,0.0286153966688053,0.5962405204772949,0.4997549653053283,0.0089335143566131,0,1
AskALiberal_data,post_5,post_5_2_1_1,"Yeah. If everybody is elite, then nobody is. The parameters would shift to make the elite different. 

Populism still seems like it would be around",0,1,0.0274070290664225,0.0486325025558471,0.4996850788593292,0.0019782781600952,0,1
AskALiberal_data,post_5,post_5_2_2,"This is roughly correct in my opinion. If we had a more educated population, Everything would be closer to the center. Right now that means that the dominant strains in the Republican party would instead be fringe people and someone like Mitt Romney would be considered pretty much as far right as mainstream goes. 

Someone like AOC would be about as far left as you could get except she would have to, probably more correctly, identify as a Social Democrat versus a Democratic Socialist. Someone like Cori Bush would not even get elected as a dog catcher.",0,1,0.0282462153721626,0.0284298062324523,0.4997164905071258,0.0004100501537322,1,1
AskALiberal_data,post_5,post_5_2_2_1,">Everything would be closer to the center. Right now that means that the dominant strains in the Republican party would instead be fringe people and someone like Mitt Romney would be considered pretty much as far right as mainstream goes.

You can move away from populism without moving towards the center.  In the current moment, those are pretty closely related but they don't have to be.

I'd actually posit that we'd see somewhat *more* extreme positions under a more educated public.  Look at how many PhDs are actual Marxists out to the left.

As to the right, you'd probably see more libertarians.  Out on the fringes of the intellectual right, there's been a real surge of interest in  integralism especially in the form of Adrian Vermeule's common-good constitutionalism.  That is a zero percent populist but definitely extreme set of ideas.",0,1,0.0276355468936267,0.0137038230895996,0.4997606873512268,0.9992011487483978,0,0
AskALiberal_data,post_5,post_5_2_2_1_1,Yeah. Its hard to understand what theyre talking about unless the assumption is that the intellectually correct position is the center/close to it.,0,1,0.0260253621757881,0.0056524872779846,0.4997219741344452,0.0165192782878875,0,0
AskALiberal_data,post_5,post_5_2_3,Do you know what makes the less educated more interested in populism?,0,1,0.0311424277706589,0.1168790459632873,0.4996865689754486,0.0453921258449554,0,0
AskALiberal_data,post_5,post_5_2_3_1,It's almost definitional.  Populism is anti-elitist.  Highly educated people are part of the elite.,0,1,0.0530908926524147,0.448509931564331,0.4996547698974609,0.0175228714942932,0,0
AskALiberal_data,post_5,post_5_2_3_1_1,"I was thinking that too. Ive heard some say its an ignorant approach, but that doesnt seem reasonable to me.",0,1,0.0363596516626534,0.4383496046066284,0.4996199011802673,0.0001028478145599,0,0
AskALiberal_data,post_5,post_5_2_3_2,"Probably because the less educated have less economic opportunity and therefore have to compete with “imported” low skill migrants for work and are undercut by cheaper undocumented labor. 

It’s always weird when the people are caught saying dumb shit like “well who’s going to pick your fruit?, if we don’t let these immigrants in you’re going to pay way more at the grocery store ”…implying that they approve of the exploitation of an underclass of people. 

While the idea of globalization and equity is nice in concept, people fail to understand that the local average is much higher than the global median. If standards of living and quality of life were equalized, it wouldn’t “raise people up”. It would actually lower standards of living dramatically for everyone in developed countries. 

China isn’t competitive in the global economy because they are so much better than everyone else and “create” value. They are competitive because they treat their people like shit and EXTRACT value from their large population. And they can do that as a result of competition, prisoners dilemma, and tragedy of the commons. 

Listen to blue collar construction folk talk about the hispanics as a direct threat to their livelihood in the same way white collar well educated tech workers talk about Indians and you’ll understand populism. 

The people that don’t care aren’t threatened. 

In theory I don’t care about immigrants because my career is very unlikely to be threatened by them. But I can say that sitting in an airport these days is weird. I’ve noticed a dramatic increase in prices (for a variety of reasons) and reduced availability of empty seats. A flight was delayed and now I have a 10 hour delay because every single flight is full. After a couple hours here I have to wonder if the multitude of clearly non-citizens all wearing the same outfits with their folders and baggy that have been boarding flights to multiple cities by the dozens somehow have an effect on the demand side of this equation and are part of the reason my flights are so expensive now…

I’ve been traveling a lot and every major airport I’ve been in lately has had large groups of travelers that clearly didn’t buy their own tickets.",0,1,0.1881617649722899,0.3903865814208984,0.4995584189891815,6.538629531860352e-05,0,1
AskALiberal_data,post_5,post_5_2_3_3,"Populist policies tend to be direct and immediate in effect, for example: a party may promise a check of $1000 to every family if it wins an election. It may sound condescending, but this has more appeal to the less educated while the more educated consider longer term ramifications like inflation from overspending.",0,1,0.0284239879358706,0.034443974494934,0.4997665286064148,0.7776945531368256,0,1
AskALiberal_data,post_5,post_5_2_4,"> pro-business style of conservatism associated 

Not so much.  You get a bit ""educated"", own a few companies, be involved with 5 start ups, etc.  and you start to appreciate the longer term planning and the wealth creation model largely supported by the Democrats instead of the lack of planning and wealth accumulation model of the Republicans.",0,1,0.0280125976276207,0.013395607471466,0.4997399747371673,0.0137143731117248,0,1
AskALiberal_data,post_5,post_5_3,"The correlation between conservative voters and lack of education is there, but I don't believe that it is the cause.

The entire conservative platform (currently) revolves around ideals that are generally ""selfish"". Selfish is probably not the best fit for what I am trying to describe, but its close enough. 

For example, not wanting to spend their hard earned money, in the form of taxes, on other peoples healthcare. ""Why should I pay for someone elses stupid decisions?"" is a common generalization I have heard. They do not want to benefit anyone that does not include themselves.

This attitude is not tied to education, it is tied to culture and upbringing. While education can help widen someone's perspective on things, it does not necessarily mean that they are willing to accept outside opinions. You typically see examples of this with kids that grew up in small rural towns, who then go to college and get to experience what life is like for people that are not like them, thus the possibility for changing their views opens up, but is not guaranteed.",0,1,0.035204046924742,0.0082528591156005,0.499765932559967,0.0002754032611846,0,1
AskALiberal_data,post_5,post_5_3_1,I agree. It doesnt seem like us being more educated would really do much for our polarization.,0,1,0.0258528729166747,0.648544430732727,0.4996795356273651,0.0300807058811187,0,0
AskALiberal_data,post_5,post_5_4,"Probably not much.  Studies show that smarter people don't change their opinions, they just have a better ability to justify them.

To the extent anything would change it would be the process of more people going to college would increase the variety of people they interact with which would reduce the ability of bad actors to demonize them somewhat.",0,1,0.0277012178937315,0.0082156658172607,0.4997637867927551,1.5676021575927734e-05,0,1
AskALiberal_data,post_5,post_5_5,"I read somewhere once that people with education aren't any more liberal but do tend to be more firm and non centrist in their views

so I'd expect that if everyone in the US had a good education we would see some changes in both parties in the realm of populism and other areas where people have seemingly conflicting views

also I think we would see more engagement as a default, so less pandering to lowest information voters from politicians",0,1,0.0249444358041718,0.0390868186950683,0.4997518658638,0.0437323153018951,0,1
AskALiberal_data,post_5,post_5_6,"If the right were more educated, they’d probably favor a more populist and paternalistic conservatism like we see in many European countries. Most likely they’d go farther left economically but remain pretty much the same when it came to social issues, since those are more a matter of personal opinion than objective truth.",0,1,0.0257591872475366,0.0313498377799987,0.49976247549057,0.0194087922573089,0,0
AskALiberal_data,post_5,post_5_7,"I don't think Trump supporters necessarily lack knowledge . . . though it's hard to see how they could still support Trump if they cared about or had knowledge of the rise of fascism throughout history. I just don't really perceive supporting Trump as falling anywhere on a knowledge spectrum. Knowledge is not a useful variable explaining support for Trump.

Which education is different from 'having knowledge'. 

If there were more structured classroom environments with individualized attention where people have trust in school administrators . . . then yeah there probably would be less animosity directed towards 'the establishment' which is a motivator for Trump supporters.

I mostly explain support for Trump as a consequence of arrested development. That person experienced trauma of some kind and has adopted a phony tough guy affectation as a defense mechanism to keep them from feeling vulnerable. They fundamentally feel insecure and are comforted by Trump's projected invincibility and lack of empathy. They don't want to feel because feeling is painful. 

I'm not sure 'education' as in the content taught in schools is going to fix that more than just having a stable environment where people of integrity support them.",1,0,0.0272871905587689,0.0067871809005737,0.499750554561615,6.514787673950195e-05,0,1
AskALiberal_data,post_5,post_5_7_1,"lot of nazis, falangists, and other fascists were quite educated.",1,0,0.7164439234089134,0.0074015855789184,0.4992822706699371,0.2314107716083526,0,1
AskALiberal_data,post_5,post_5_8,"Despite what the liberal echo chambers tell you, the right are not all a bunch of dumb hicks.  College education numbers do currently favor democrats, but not by a huge margin (55 vs 42) according to pew: [https://www.pewresearch.org/politics/2024/04/09/partisanship-by-race-ethnicity-and-education/](https://www.pewresearch.org/politics/2024/04/09/partisanship-by-race-ethnicity-and-education/) ).

I suspect part of this stereo type comes from what each side ""knows"":  Liberals might want to discuss things like climate-change or racial disparities in net worth.  Conservatives aren't super knowledable about this, so might seem ""dumb"" or ""uneducated"" on these topics.  Conservatives might want to discuss gun control (most gun-control advocates are laughably unknowledable about guns, and conservatives laugh at them about this), or immigration and liberals have very different sets of knowledge on this.

So giving conservatives more ""education"" might sound good in theory, but unless you're running them through the same sources of education that you've got, they might not come to the same conclusions.  You can't simply ""re-educate"" all conservatives and they'll magically be just like you and your buddies.",0,1,0.1949234043130147,0.0094333291053771,0.4997178614139557,0.0001399219036102,0,1
AskALiberal_data,post_5,post_5_8_1,I dont think the left - right spectrum really has anything to do with education.,0,1,0.0263441777937688,0.0121011137962341,0.4996570944786072,0.0025102794170379,0,0
AskALiberal_data,post_5,post_5_8_1_1,"I was talking about this statement:   


>The American Right is often perceived as being very uneducated and as thriving off of that lack of education

Your perception of them being uneducation is just that, a perception.  Based off stereotypes and them ""knowing"" different things than you.  My girlfriend works in Academia (at a top university) and 100% of her co-workers are incredibly liberal.  I work in tech and it's probably 50%/50%.  Both of us are highly educated.",1,0,0.0290422530862102,0.0047884583473205,0.4997108578681946,0.1579255163669586,0,0
AskALiberal_data,post_5,post_5_8_1_1_1,"Thats not my perception. 

My perception is that education has nothing to do with it",1,0,0.0358479229554564,0.0045910477638244,0.4997294843196869,0.0013414919376373,0,0
AskALiberal_data,post_5,post_5_9,"Interesting question.

I think it would be very difficult to make the claim that lack of education, ignorance, or even stupidity are the key factor that makes people support right wing policies and politicians in the US. From what I can see, especially over the last 20 year or so, the key motivating factor for Americans on the right is anger, dissatisfaction, and maybe even spite. Sure, poor education contributes to those feelings, but I dont think it is causal. Additionally, I think people on the left need to acknowledge that in some key ways, the anger that motivates people on the right is justifiable, even if we profoundly disagree on the cause of that anger or how to fix it. 

Personally, I don't see access to education, in this context, as all that difference than access to any other resource, like healthcare, social saftey nets, and/or affordable housing. My reading of the current climate is that right wingers are primarily upset due to difficulties with accessing these resources, perceptions that they face difficulties to accessing these resources, and believing that their access to these resources is being threatened by outsiders.

So, with this in mind, I do think better access to education would make the right significantly different. Not because they would become smart enough to change their views, but that the anger they feel would be diminished and replaced with a degree of civic pride/enthusiasm. Similarly, I would apply that same logic to accessing any vital resource.  

This is where I think the Democratic party has failed. They are failing to really improve access to resources in the communities where right wingers typically live. Additionally, in some cases, they dont do a good enough job at making sure these communities understand that it is Democratic policy that is giving them access. This is a big reason why I am a communist. We cant lecture the right wing into abandoning their position. We need to actually deliver what they need, where they are at. Once that is done and we can improve their material conditions in a measurable way, we can bring them back from the current wave of reactionary thinking.

Finally, I understand that in many ways it is right wing policy which is destroying their access to resources. I have worked in health care and public schooling for the last 10 years and I find it equal parts frustrating and amusing when right wing families (and they often like to tell everyone just how right wing they are) complain about the horrible state of the systems which their policies destroyed. However, rubbing their noses in it utterly fails to win them over, and infact just makes them more angry, perpetuating the cycle. I am not sure if the cycle is intentional, but if right wing politics and media intentionally built this cycle, it is pretty brilliant.",0,1,0.0381920662429136,0.0161981582641601,0.4997627735137939,0.0008684694766998,0,1
AskALiberal_data,post_5,post_5_10,Hasn't really got much to do with education. The American right is a reactionary movement that's about restoring white Christians to dominance.,1,0,0.2121270511350445,0.0052684545516967,0.4996798932552337,0.0095082819461822,0,0
AskALiberal_data,post_5,post_5_10_1,I agree,0,1,0.0249010920210003,0.8862821459770203,0.4986074268817901,0.9920707046985626,0,0
AskALiberal_data,post_5,post_5_11,Racial white grievances wouldn’t change. Rural America is being left behind by economic and technological progress. Those Old factory towns are still gonna be dead.,0,1,0.5526689955794973,0.0974971055984497,0.0408120155334472,0.023044466972351,0,1
AskALiberal_data,post_5,post_5_12,"I think our overall Covid response would’ve been better. There’s an open resentment on the right towards people who are more educated than them, and Republicans use that to sow division.",1,0,0.0631664440045787,0.050311267375946,0.4997540116310119,6.449222564697266e-05,0,1
AskALiberal_data,post_5,post_5_13,"There are plenty of “educated” people who are extremely racist, sexist, etc, and vote conservative.  


What we REALLY need is better ways to combat bigotry!


College education helps, but not necessarily for the reason you would think.  It’s because going away to college tends to expose you to people of different backgrounds!   It’s a LOT harder to believe that black people are criminals when one of them is your roommate!   Or that Muslims are terrorists when one of them is your classmate!   Just for example.",0,1,0.6273273290097837,0.0107181072235107,0.4997479319572449,0.0009151697158813,0,1
AskALiberal_data,post_5,post_5_14,"If our country was better educated I feel how society is governed will be more liberal and the only difference would be how economy policy is governed.

So overall I feel left or right, legal abortion would be accepted, gay marriage would be welcome, and there wouldn’t be a fight on diversity. 

Man it would be awesome for the only arguments to be taxes and the amount of government oversight.",0,1,0.0338350289305816,0.3914729952812195,0.4996983408927917,0.0236837863922119,0,1
AskALiberal_data,post_5,post_5_14_1,How do you figure?,0,1,0.0285180072899744,0.4191550612449646,0.4996102452278137,0.1026229858398437,0,0
AskALiberal_data,post_5,post_5_14_1_1,"How do I figure what?

I mentioned multiple things.",1,0,0.023970008377529,0.0783629417419433,0.4996958374977112,0.0023126900196075,0,0
AskALiberal_data,post_5,post_5_14_1_1_1,Your first two paragraphs. How does greater education mean less bigotry?,0,1,0.1431039819422805,0.0253495573997497,0.4997621774673462,0.0229482352733612,0,0
AskALiberal_data,post_5,post_5_14_1_1_1_1,"Idk. It’s just what i would expect - per your question.

Having an education doesn’t mean someone ISNT bigoted.

also comes down to the overall support system someone has. Are they in an environment that harbors bigotry? If so would having more education change them? Who knows?",1,0,0.1881926874359884,0.008537471294403,0.4996918439865112,0.8501579463481903,0,0
AskALiberal_data,post_5,post_5_14_1_1_1_1_1,Thats what i found interesting. Where does this expectation come from?,0,1,0.0239812684377087,0.8139076232910156,0.4997225105762481,0.9480312764644624,0,0
AskALiberal_data,post_5,post_5_14_1_1_1_1_1_1,More education.,0,1,0.0284841940295878,0.7729050517082214,0.4992614090442657,0.9853337705135344,0,0
AskALiberal_data,post_5,post_5_14_1_1_1_1_1_1_1,"Essentially

More education > more liberal society **because** > more education > more liberal society?

No reasoning here?",1,0,0.032593227054711,0.0073951482772827,0.4996135234832763,0.0170224010944366,0,0
AskALiberal_data,post_5,post_5_14_1_1_1_1_1_1_1_1,"Nope.

Just a liberal society that argues on economic policy.",0,1,0.029690289483964,0.1085451245307922,0.4993128180503845,0.0004866123199462,0,0
AskALiberal_data,post_5,post_5_15,I think the debate discourse would be closer to what it was like in the eighties where policy and outcomes were debated instead of what it has been lately where we debate birth certificates and secret pedophile rings.,0,1,0.0357298515742368,0.3001519441604614,0.4997490644454956,0.0378550589084625,0,1
AskALiberal_data,post_5,post_5_16,"Way more libertarian, at least over time.  Political conflict would probably shift away from culture wars and more towards economic issues.",0,1,0.0266506982190115,0.0052059292793273,0.4996551871299743,0.0029720664024353,0,1
AskALiberal_data,post_5,post_5_17,I think if *everyone* were better educated then our population would be more engaged and our discourse more constructive.,0,1,0.0241632355968775,0.0218233466148376,0.4996770918369293,0.0004248619079589,0,1
AskALiberal_data,post_5,post_5_18,"I don't think the level of education affects the ""hot button"" issues like trans, immigration, etc. Why would having a PhD make me feel differently after immigration, for example?",0,1,0.0240071007086637,0.6303288340568542,0.4997589588165283,0.7957256138324738,0,1
AskALiberal_data,post_5,post_5_19,"My dad is a conservative with a PhD, what catches him up, I think, is semantics. 

I think how the Republicans have threaded that needle is they have excelled at double speak. They say just enough that white supremacists will feel validated while not enough that it is explicit. 

And I have seen a lot of liberals fall into validation traps, where they inadvertently support the claims of the Republicans. A good example of this was Critical Race Theory. Republicans started fear mongering that it shouldn't be taught in elementary school. Many tried countering with the obvious point that is a graduate level subject primarily for lawyers (and public health in my case) that is not taught at all in elementary school. But still many liberals took the bait, and argued that CRT ""should stay in public school"" inadvertently supporting their claim that it was there to begin with.",0,1,0.0521010118025818,0.0251660346984863,0.4997719824314117,8.991360664367676e-05,0,1
AskALiberal_data,post_5,post_5_20,"Looking at Europe, it would be more left-wing.  There would still be a right-wing political class, but the far-right would be less significant.",0,1,0.0251644473129346,0.0547508597373962,0.4996662437915802,0.0006771385669708,0,1
games_data,post_1,post_1_0,"MultiVersus - Official Jason Voorhees ""Weirdo in a Mask"" Gameplay Trailer",0,0,0.0432324903835307,0.0215199589729309,0.4981484711170196,0.0288284718990325,0,1
games_data,post_1,post_1_0,"Jason looks like he drank the lake around him - all the same I love his design and the Jason X outfit!

So glad we're seeing a return of Friday the 13th considering the legal mess that tied up the rights for *so* long. 

Between this and MKX I can't believe I have the chance to be a Jason main twice",0,1,0.0305586852736445,0.4015438556671142,0.4863905608654022,0.998648077249527,0,1
games_data,post_1,post_1_0_1,Time to make mother proud,0,1,0.1616103004470376,0.857332170009613,0.0139538645744323,0.9991663992404938,0,1
games_data,post_1,post_1_1,I'm actually pretty tickled to see so many deep cuts of Jason lore be incorporated into his move set. Such as the call back to Freddy Vs Jason bed death and the sleeping bag rather than him just using a machete and that be it. Or the call back to part 6 and 7 with the trailer intro.,0,1,0.0248728125909016,0.09940767288208,0.499181181192398,0.9746055901050568,0,1
games_data,post_1,post_1_2,"I love the sleeping bag special, and I hope that was a nano-machine install. I dont have high expectations for this game, but dang that was commical.",0,1,0.0296486330732672,0.752856969833374,0.4902247488498688,0.9994958341121674,0,1
games_data,post_1,post_1_2_1,"One thing Multiversus does well is filling every character’s kits with fan-service.

Velma is hillarious because instead of physically attacking she talks and makes big speech bubbles that hurt people. And Tom and Jerry are too busy fighting each other and their attacks can hurt others.",0,1,0.1019062679961047,0.0864430665969848,0.4995495080947876,0.8784482777118683,0,1
games_data,post_1,post_1_2_1_1,Tom and jerry were my favourite in the beta because of how well animated they were,0,1,0.0336364352925665,0.4936337471008301,0.4995438456535339,0.999548077583313,0,1
