Subreddit,PostID,CommentID,Text,Combative,Deliberative,Toxicity,Rationality,Mutual Respect,Emotion,Moderator,Diversity
ScienceUncensored_data,post_17,post_17_0_3,"I recommend ""the wages of humanity"" by Cixin Liu. https://www.goodreads.com/book/show/17935230-the-wages-of-humanity",0,1,0.0244775697120856,0.3495267033576965,0.4948112964630127,0.9384062886238098,0,1
ScienceUncensored_data,post_17,post_17_0_4,"Not true.  A large body of poor people is a big hassle.  Look at America's low income  black communities.  They have brought all sorts of negative impacts to non-black people: 1) Crime and violence in black  neighborhoods (*bad*) that spills out into other communities (*more bad*); 2) Continued welfare needed   to offset the worst conditions (= higher taxes on everyone); 

3) Costly race riots ([George Floyd Riots Caused Record-Setting $2 Billion in Damage](https://fee.org/articles/george-floyd-riots-caused-record-setting-2-billion-in-damage-new-report-says-here-s-why-the-true-cost-is-even-higher/?__cf_chl_jschl_tk__=75129cb36ecfb8881f8607ce48f729052579d92e-1615124793-0-AS0Njv9F3til13cmOAneftp8IdH7ErincaA5Mz-2sjoBA4kJ6ogs2N14H0re1rlLDkiWUGd6Ar6ttiwJlfA1tuCyJMDKmjQRivfFEzm6RWjyvnvuCelkM4GMTNwQwS7Cmyddx9v_3Oh8_bcuB4dRcU8KMIVB-qIvDD7K9voRFv9rwy-Ai6m227bCFoOtedlYcZkpvE171cpfmxWB17zCzb7dWgbBBFME9VII9iq6H-xPER8_H4amnb9yihLDINo6Kt9cJ4E5BwSMLQJRe-OJZOmGNv2K5zLdwJfWA1wIYg1zIlrgyGsxJYqD61JIQN1wzTlPnX1xW5oAlzlaPXNPkxbNsWjJ2E9XPfjK44Cq5RT1Td6RX0gKZht2gLt3IITD3lriF8g0oGEpRCScX6AfqhzApHjmLayPbelV6SI5PsWFl4jRv7ABuyJ9zy6FS_C8cPOVyNaETMWuriYIk1XsAR3nypqukfDO-6RCR-3c50fz&filter_by=popular7&_page=84&fbclid=IwAR1KNV6Cw51moi0SKpnwhMw1Egz4gh1AzPleqC_3-qhavizBzQcR7pU7jqk&ref=hexometer&utm_campaign=targetingUSA&utm_medium=display&utm_source=facebook)) and other social unrest, and 4) Black children in dysfunctional families/communities developing  poor life habits -- meaning more chance the undesirable conditions in those communities will persist.

Leftists persist in coming up with the faulty analysis that  dire poverty benefits  rich elites.  The benefits of paying workers low wages is more than offset by the above.",0,1,0.4436158266180487,0.0447649955749511,0.0008447170257568,9.992718696594238e-05,0,1
ScienceUncensored_data,post_17,post_17_1,"[Angus Deaton, Nobel Memorial Laureate, on the state of economics:](https://www.theguardian.com/inequality/2023/oct/07/angus-deaton-interview-book-economics-in-america)

 “*The time has come, Deaton argues, for economists to get back to serving society. ‘The discipline has become unmoored from its proper basis, which is the study of human welfare*’”",0,1,0.0249273487846717,0.0242359042167663,0.4997207820415497,0.0010428130626678,1,1
ScienceUncensored_data,post_17,post_17_1_1,". . . from a guy who has been an economist at Princeton since the 1980s.

He's going to say he's advocating for progressive policies when in fact he is distracting from the progressive agenda. Don't buy the BS, peeps.",1,0,0.0506606526907519,0.3903810381889343,0.4988597929477691,3.826618194580078e-05,0,1
ScienceUncensored_data,post_17,post_17_2,"I think the title is a bit silly, but it is an interesting article.

One thing I didn't know is:

>Deaton said rightwing politicians and economists fixed the numbers so they could claim, in the words of Ronald Reagan, that in the war on poverty, poverty won. Official income statistics left out welfare payments so those receiving them often appeared to still be living below the poverty line when, by other measures, government assistance demonstrably helped.

I've always wondered about this.  I prefer creativity and socialization over consumption, which means I spend very little.  So because of that despite having plenty of money, I tend to spend below the poverty line out here in Silicon Valley, which is about 57k.

If I ate out every day of the year at a decent sit down restaurant I would spend 36k, combined with an above median rent of $2000 a month I'd spend 60k a year, I'd be just over the poverty limit.  This seems insane to me.  I can live comfortably, regularly travel to Europe for vacation, eat out, have a decent reliable car, and still be in poverty?  The numbers always seemed off to me.  Apparently out here all those things are not enough to be considered a liveable wage.

Now to be fair, that would be a bit tough with a kid, but the poverty limit is set based on size of household, so 57k is one person.  It goes up for two people, and a kid is a 3rd person, so it goes up higher to account for that.",0,1,0.0415525095717269,0.0270426273345947,0.4997518062591553,0.001045137643814,0,0
ScienceUncensored_data,post_17,post_17_3,"Hey hey guys, a British royal title guy who has been working and teaching at Princeton since the 1980s is now on the side of the poor!! For real guys.

He's seriously concerned about white people dying, especially via what he and Case call [deaths of despair](https://press.princeton.edu/books/hardcover/9780691190785/deaths-of-despair-and-the-future-of-capitalism), i.e. drug and alcohol deaths and suicides. Of course our polluted water and air and food haven't played a role, duh! Or any of that other stuff. We've been CHOOSING to poison OURSELVES!!

And you know what else doesn't play a role, because Case and Deaton didn't even think to mention it in their book? Student debt. BOOM. Economists from Princeton know that crushing debt is sort of like, an insignificant detail. Because of course no one who hasn't graduated has student debt, and in fact, college educated people are currently [flourishing.](https://www.nytimes.com/2023/10/03/opinion/life-expectancy-college-degree.html) (\*\* please correct me if I'm wrong. I thought I paid careful attention while listening to their book but could've missed something. \*\*)

You can tell Deaton really cares about the poor because he's promoting progressive policies like [this](https://www.nytimes.com/2023/10/03/opinion/life-expectancy-college-degree.html):

>We are encouraged by the efforts of both public and private employers to remedy this; it is a low-cost policy that could have large benefits. For example, Gov. Josh Shapiro of Pennsylvania signed an executive order removing the B.A. requirement for 92 percent of state jobs; similar policies are in place in Utah, Maryland, Colorado, Georgia, South Carolina, Virginia, New Jersey and Alaska.  
>  
>Anything that reduces health care costs would help, as would replacing employer-funded health insurance with vouchers paid for by general taxation. Fighting NIMBYism (residents’ “not in my backyard” opposition to local development) and expanding affordable housing in successful cities would increase mobility. Job creation under the Inflation Reduction Act is a move in the right direction. Working people would do better with stronger unions and fewer hostile measures such as right-to-work laws.

Did he say ""vouchers""? Oh wait . . . is Sir Dr. Deaton from Princeton possibly trying to distract us from ACTUALLY progressive policies, such as universal health care, free (and public?) post-secondary education, stricter water, air, and land protections, undoing the hoarding of real estate by the wealthy, more rigorous food safety standards, jobs guarantees, student debt relief, support for small farmers and action against conglomerate farms, etc. Though it is cool he is advocating for unions . . . but history shows that union gains can be easily undone as needed. Hmmmmmm.

(And a bit of extra fun, the Princeton economists also say that its our [mental distress](https://qz.com/583595/deaths-of-despair-are-killing-americas-white-working-class) that caused some of us to support Bernie Sanders, rather than any sincere and rational belief in the need for collective action. Quick, someone get us help.)",1,0,0.1665125030804088,0.0130784511566162,0.4996964931488037,0.0767058432102203,0,0
ScienceUncensored_data,post_17,post_17_4,"Great article.  I've been thinking about this a lot, since so many ""economists"" on Reddit think the whole system is impartial and magical.   My favorite bit:

*A friend of mine, a conservative economist and deeply religious man, is fond of saying that ‘fair’ is a four-letter word that should be expunged from economics*.",0,1,0.0247742323723095,0.0092856884002685,0.4997215569019317,0.9984104037284852,0,1
ScienceUncensored_data,post_17,post_17_5,Inequality is heavily determined by differences in innate abilities between people which are taboo to discuss.  I welcome analysis into looking at inequality but our society won't allow it.,0,1,0.0266194899755324,0.0284414887428283,0.4997716546058655,0.0210196077823638,0,1
ScienceUncensored_data,post_17,post_17_6,"just like every other war, war on poverty created a cottage industry whose only interest is promoting and maintaining the said condition for profit purposes.",0,1,0.072326560362413,0.7474601864814758,0.4997507333755493,0.001478761434555,0,1
ScienceUncensored_data,post_18,post_18_0,Efficacy and safety of in-hospital treatment of Covid-19 infection with low-dose hydroxychloroquine and azithromycin in hospitalized patients: A retrospective controlled cohort study,0,0,0.026882132384974,0.3180270791053772,0.4996454119682312,0.9966934025287628,0,1
ScienceUncensored_data,post_18,post_18_0,"[Efficacy and safety of in-hospital treatment of Covid-19 infection with low-dose hydroxychloroquine and azithromycin in hospitalized patients](https://www.sciencedirect.com/science/article/pii/S2052297523000914)

*A retrospective study of 3885 patients (352 treatment, 3533 control) of hydroxychloroquine and azithromycin versus standard of care. Risk of deaths in the treatment group was 63% vs controls and this survival benefit was consistent in all age groups.  No torsade de pointes or malignant ventricular arrhythmias observed during treatment (hydroxychloroquine is thus safe for heart).*

These results could be undoubtedly even better if they would use a full Dr. Zelenko protocol, i.e. including antibiotics and mineral zinc supplements. Also the dose used  (2 ​× ​200mg for five days) was rather low. See also:

* [How a False Hydroxychloroquine Narrative Was Created](https://ahrp.org/how-a-false-hydroxychloroquine-narrative-was-created/)
* [Hydroxychloroquine blocks SARS-CoV-2 entry into the endocytic pathway in mammalian cell culture](https://www.reddit.com/r/ScienceUncensored/comments/xhgrz2/hydroxychloroquine_blocks_sarscov2_entry_into_the/)
* [He who laughs last laughs best: Dr. Zelenko's Hydroxychloroquine protocol works](https://www.ncbi.nlm.nih.gov/labs/pmc/articles/PMC8712288/)
* [French doctor once again under fire over hydroxychloroquine protocol](https://www.reddit.com/r/ScienceUncensored/comments/13voyk0/french_doctor_once_again_under_fire_over/)
* [Anti-malaria drug hydroxychloroquine is the most effective coronavirus treatment currently available](https://www.dailymail.co.uk/news/article-8184259/Malaria-drug-hydroxychloroquine-effective-coronavirus-treatment-currently-available.html) 
* [Repurposing Drugs in Oncology (ReDO)—chloroquine and hydroxychloroquine as anti-cancer agents](https://www.ncbi.nlm.nih.gov/pmc/articles/PMC5718030/)
* other HCQ related posts [1](https://www.reddit.com/r/ScienceUncensored/comments/13voyk0/french_doctor_once_again_under_fire_over/), [2](https://www.reddit.com/r/ScienceUncensored/comments/15t7wt1/how_a_false_hydroxychloroquine_narrative_was/), [3](https://www.reddit.com/r/ScienceUncensored/comments/17285mw/efficacy_and_safety_of_inhospital_treatment_of/), [4](https://www.reddit.com/r/ScienceUncensored/comments/fkw0mg/hydroxychloroquine_a_less_toxic_derivative_of/), [5](https://www.reddit.com/r/ScienceUncensored/comments/fwi9lk/trumpbacked_antimalaria_drug_hydroxychloroquine/), [6](https://www.reddit.com/r/ScienceUncensored/comments/gq6d93/is_hydroxychloroquine_really_linked_to_increase/), [7](https://www.reddit.com/r/ScienceUncensored/comments/hzuvwh/doctor_has_999_success_rate_with_over_2200_covid/), [8](https://www.reddit.com/r/ScienceUncensored/comments/i0cm0l/the_people_with_hidden_immunity_against_covid19/), [9](https://www.reddit.com/r/ScienceUncensored/comments/i2zzol/repurposing_drugs_in_oncology_redochloroquine_and/), [10](https://www.reddit.com/r/ScienceUncensored/comments/i30wbd/scientists_uncover_evidence_that_a_level_of/), [11](https://www.reddit.com/r/ScienceUncensored/comments/i4cqgu/did_fauci_say_in_2005_virology_journal_that/), [12](https://www.reddit.com/r/ScienceUncensored/comments/j17afi/florida_doctors_found_a_coronavirus_cure_thats/), [13](https://www.reddit.com/r/ScienceUncensored/comments/j18zyz/covid19_vaccine_protocols_reveal_that_trials_are/), [14](https://www.reddit.com/r/ScienceUncensored/comments/jtexq6/fauci_versus_frontline_doctors_and_science/), [15](https://www.reddit.com/r/ScienceUncensored/comments/k0tntz/drinking_baking_soda_could_be_an_inexpensive_safe/), [16](https://www.reddit.com/r/ScienceUncensored/comments/lqwz1k/the_american_journal_of_medicine_now_recommends/), [17](https://www.reddit.com/r/ScienceUncensored/comments/pgjiki/researchers_tell_doctors_stop_prescribing/), [18](https://www.reddit.com/r/ScienceUncensored/comments/sah3zw/he_who_laughs_last_laughs_best_dr_zelenkos/), [19](https://www.reddit.com/r/ScienceUncensored/comments/sire6u/has_the_red_carpet_been_rolled_out_for_a/), [20](https://www.reddit.com/r/ScienceUncensored/comments/srphom/antihistamines_may_help_resolve_long_covid/), [21](https://www.reddit.com/r/ScienceUncensored/comments/va0d4o/new_missouri_law_protects_doctors_bars/), [22](https://www.reddit.com/r/ScienceUncensored/comments/vx6iug/the_effect_of_ivermectin_on_the_viral_load_and/), [23](https://www.reddit.com/r/ScienceUncensored/comments/wjggkn/our_experience_concerning_covid_19_treatment_with/), [24](https://www.reddit.com/r/ScienceUncensored/comments/wjggkn/our_experience_concerning_covid_19_treatment_with/), [25](https://www.reddit.com/r/ScienceUncensored/comments/wjggkn/our_experience_concerning_covid_19_treatment_with/), [26](https://www.reddit.com/r/ScienceUncensored/comments/wp7bj2/new_metaanalysis_results_suggest_potential_for/), [27](https://www.reddit.com/r/ScienceUncensored/comments/x2pb4z/regular_use_of_ivermectin_as_prophylaxis_for/), [28](https://www.reddit.com/r/ScienceUncensored/comments/x5hevo/ivermectin_shows_antiviral_activity_against/), [29](https://www.reddit.com/r/ScienceUncensored/comments/xhfyd4/ivermectin_soc_cohort_does_significantly_better/), [30](https://www.reddit.com/r/ScienceUncensored/comments/xhgrz2/hydroxychloroquine_blocks_sarscov2_entry_into_the/), [31](https://www.reddit.com/r/ScienceUncensored/comments/z4qrm2/in_another_1984_moment_fda_tells_judge_it_never/), [32](https://www.reddit.com/r/ScienceUncensored/comments/zxxquo/ivermectin_is_safe_and_effective_the_evidence)",0,1,0.0282739051464345,0.0158684849739074,0.4993879497051239,0.0296590924263,1,1
ScienceUncensored_data,post_18,post_18_1,"Full article is freely available.

>Conclusion  
>  
>Treatment of COVID-19 using a combination of hydroxychloroquine plus azithromycin was safe and was associated with a statistically significant mortality benefit in the treatment of COVID-19 infection in hospitalized patients. Our findings do not support the current negative recommendations regarding this treatment.",0,1,0.0241484148977384,0.0612527132034301,0.4996764361858368,0.1403438746929168,0,1
ScienceUncensored_data,post_18,post_18_2,How a False Hydroxychloroquine Narrative Was Created https://ahrp.org/how-a-false-hydroxychloroquine-narrative-was-created/,0,1,0.0341335513181654,0.0268095135688781,0.4997194111347198,5.4776668548583984e-05,0,1
ScienceUncensored_data,post_18,post_18_3,"But WIKIPEDIA says it is a conspiracy theory and that the FDA, which is completely independent of political interference, and things like its board members hopping to and from the board of directors of pfizer doesn't happen, said it doesn't work and should not be investigated further!!!:

[https://en.wikipedia.org/wiki/Peter\_A.\_McCullough#Early\_advocacy\_for\_hydroxychloroquine](https://en.wikipedia.org/wiki/Peter_A._McCullough#Early_advocacy_for_hydroxychloroquine)",1,0,0.0292313488674576,0.0131282806396484,0.4996423423290252,0.0002978444099426,0,1
ScienceUncensored_data,post_18,post_18_4,"Azithromycin & Clarithromycin could have been used to reduce hospitalizations but the corrupt FDA didn’t want that.

Ventilator-associated Pneumonia was a major driver of hospital deaths.

https://www.jci.org/articles/view/170682

Budesonide is a very effective alternative treatment that was underutilized. 

https://www.medrxiv.org/content/10.1101/2021.02.04.21251134v1

Early Start of Oral Clarithromycin Is Associated with Better Outcome in COVID-19 of Moderate Severity

https://www.ncbi.nlm.nih.gov/pmc/articles/PMC8345236/",0,1,0.0325879422011065,0.2579364776611328,0.4995554387569427,0.0003755986690521,0,1
ScienceUncensored_data,post_18,post_18_5,"This is IHU Marseille bullshit review.  
https://researchintegrityjournal.biomedcentral.com/articles/10.1186/s41073-023-00134-4",1,0,0.9692226917925276,0.823445737361908,0.4628943204879761,0.0097416937351226,0,1
ScienceUncensored_data,post_18,post_18_6,Remember when you used to go to jail for mentioning hydroxychloroguine or ivermectin over the past few years? Yea weird,1,0,0.3589534982845301,0.0647366642951965,0.4802643656730652,0.0001466572284698,0,1
ScienceUncensored_data,post_18,post_18_6_1,"Nah, don't remember that, like at all",0,1,0.0281973979047407,0.5440605878829956,0.4862338900566101,0.0002084076404571,0,1
ScienceUncensored_data,post_18,post_18_7,Ehats crazy is no one ever says hey we were wrong and this would have helped.,0,1,0.2094299166099635,0.0307371020317077,0.069745123386383,0.0462939739227294,0,1
ScienceUncensored_data,post_19,post_19_0,Why Are Wind Turbines Being Switched Off? - Power Transmission is Just as Important as Generation,0,0,0.0253113773087406,0.4905125498771667,0.4997342526912689,0.9983104467391968,0,1
ScienceUncensored_data,post_19,post_19_0,"I absolutely fucking hate if someone tries to get a point across that is quantifiable, about money and then fails to put up actual numbers. Look at a sentence like this:

> In 2022, it was reported that Brits paid millions to switch off wind turbines

**How many millions!?**

Also ""millions"" is just a ""whoa this sounds big!"" but considering that there live ""millions"" of people in GB you are at what order of magnitude? Right, 1 pound per person per year. Maybe as low as a tenth or as high as 10 times that. _Depending on how many millions._

Arguing the grid needs to be expanded **requires** a cost analysis. Perhaps expanding the grid is more expensive than shutting down a few wind turbines? Perhaps we can find a nice formula or even an easy rule of thumb to determine a threshold for policymakers and utilities. Of course the cost analysis would have to take into account the value of each kWh curtailed at the time it is curtailed. Obviously the price of electricity is not constant.

But not arguing _with numbers_ just makes the entire point moot. That the only number besides the year 2022 in this article is a phone number at the end, making it look like an ad, leaves a very sour aftertaste.",0,1,0.955757882139855,0.0136577486991882,0.4989943504333496,4.231929779052734e-06,0,1
ScienceUncensored_data,post_19,post_19_0_1,"The principial problem is, wind/solar electricity increases electricity prices, so it must be subsidized with carbon energetics. [Just the cost of supporting offshore turbines is higher than value of electricity](https://www.theguardian.com/environment/2019/sep/20/new-windfarms-taxpayers-subsidies-record-low), which they produce: which is quite bizarre economy. And we still are talking just about OPEX, i.e. operating expenses.",0,1,0.0250786194240103,0.0691683888435363,0.4997661709785461,5.08427619934082e-05,1,1
ScienceUncensored_data,post_19,post_19_0_1_1,"I don't think you understand what the article has been saying at all - it says capex and opex of new offshore wind is now cheaper than just the opex of existing electricity generation - neither has this any relevance to my original criticism.

Beyond that, the increase in renewables in the German power grid gas demonstrably lowered the average wholesale electricity price between roughly 2010 and about a year before the Ukraine war began (Gazprom already reduced gas shipments in ""anticipation"" of the war).",1,0,0.0251446753378943,0.0438758134841918,0.4997616410255432,0.0001700520515441,0,0
ScienceUncensored_data,post_19,post_19_1,"[Why Are Wind Turbines Being Switched Off? - Power Transmission is Just as Important as Generation](https://www.altenergymag.com/article/2023/09/why-are-wind-turbines-being-switched-off-power-transmission-is-just-as-important-as-generation/40170)

This doesn't solve the problem, that wind plants generate electricity just in time where it's least needed. Power grid has no electricity storage effect. Stronger power lines just means that more concrete, copper and pillars gets wasted over long periods of wind droughts.

* [European Wind Turbines at a Standstill Amid an Ongoing “Wind Drought”](https://www.greenmatters.com/news/wind-drought) *While gas prices have soared to the energy crisis, wind turbines across Europe are at a standstill thanks to an ongoing ""wind drought.""*
* [Situation on Polish-German border poses threat of European blackout](https://wysokienapiecie.pl/en/1295-situation-on-polish-german-border-poses-threat-of-european-blackout/) The problem isn't lack of energy but occasional surplus of electricity from wind and solar plants from Germany.",0,1,0.0263274807773353,0.065462589263916,0.4997584819793701,5.0902366638183594e-05,1,0
ScienceUncensored_data,post_19,post_19_1_1,"As an electrical engineer, my solution would be to implement variable pricing when charging electric cars to encourage people to only charge when the electricity is plentiful, which would solve alot of our problems all at once.",0,1,0.0282008171970048,0.6116520166397095,0.4997583031654358,0.1456342935562133,0,1
ScienceUncensored_data,post_20,post_20_0,The psychology of hate:Moral concerns differentiate hate from dislike,0,1,0.072458197498185,0.2443321943283081,0.4996805489063263,0.8119630217552185,0,1
ScienceUncensored_data,post_20,post_20_0,"[The psychology of hate:Moral concerns differentiate hate from dislike](https://onlinelibrary.wiley.com/doi/epdf/10.1002/ejsp.2906)  ([PDF](https://onlinelibrary.wiley.com/doi/pdfdirect/10.1002/ejsp.2906?download=true))

*People express hatred because it is connected to their sense of morality. Hate isn't the lack of morality, but the inclusion of it.*",0,1,0.0339669881251238,0.0313716530799865,0.4997439384460449,0.0052533149719238,1,1
fauxmoi_data,post_1,post_1_0,Lana Del Rey accepting the Special International Award at the Ivors Academy Awards 2024,0,0,0.023898741954923,0.0139234066009521,0.4971059262752533,0.99799582362175,0,1
fauxmoi_data,post_1,post_1_0,"Respectfully, so many of her outfits look like they came from the mall. Not a bad thing, but a thing.",1,0,0.0330500369329109,0.5523203015327454,0.4996958374977112,0.0940755307674408,0,1
fauxmoi_data,post_1,post_1_1,Looking like a Sephora bag 🛍️💅🏻,1,0,0.7467634780173203,0.5270994901657104,0.4993560314178467,9.301304817199708e-05,0,1
fauxmoi_data,post_1,post_1_2,INFO: Ivor Novello Awards are judged by acclaimed songwriters and composers from The Ivors Academy and awarded for craft and creative excellence. The only awards for songwriters and composers judged by their peers.,0,1,0.0235325158881824,0.438803493976593,0.4989344477653503,0.99043270945549,0,1
fauxmoi_data,post_1,post_1_3,"we're seriously back in 2012, she looks great",0,1,0.0251883764293447,0.5995462536811829,0.4992978870868683,0.9975729882717131,0,1
fauxmoi_data,post_1,post_1_4,gosh I lovee her hair,0,1,0.144822169396787,0.5890880823135376,0.0004627704620361,0.9984790086746216,0,1
fauxmoi_data,post_1,post_1_5,[deleted],0,0,0.0260687223098937,0.8900734782218933,0.4747309684753418,0.0003655850887298,0,1
fauxmoi_data,post_2,post_2_0,"Bella Hadid attends the ""L'Amour Ouf"" (Beating Hearts) Red Carpet at the 77th Cannes Film Festival",0,0,0.0251897929673637,0.6780500411987305,0.4990455210208893,0.9979957640171052,0,1
fauxmoi_data,post_2,post_2_0,she is the moment 🥺♥️,0,1,0.1274967073618454,0.4691434502601623,0.4932612478733063,0.9983094334602356,0,1
fauxmoi_data,post_3,post_3_0,Miley Cyrus stuns in new photo from Netflix’s ‘My Next Guest Needs No Introduction with David Letterman.’,0,0,0.0419807363022239,0.6772254705429077,0.0997045636177063,6.562471389770508e-05,0,1
fauxmoi_data,post_3,post_3_0,Love she is brunette again this is the best her hair has looked in years,0,1,0.0596761369343144,0.4725079536437988,0.1352505683898925,0.9917016327381134,0,1
fauxmoi_data,post_3,post_3_0_1,She looks more like her old self than she has in most recent photos and I love it.,0,1,0.0323740301658929,0.0279343128204345,0.499418705701828,0.9995642006397248,0,1
fauxmoi_data,post_3,post_3_0_2,Couldn't agree more. It looks so full and HEALTHY!,0,1,0.0244557953822195,0.0141896605491638,0.4964920878410339,0.9988594353199004,0,1
fauxmoi_data,post_3,post_3_0_2_1,"It’s a wig but I agree it looks really nice.

Edit: dang y’all! I’ve learned so much more about wigs, clip ins, extensions, y’all are awesome!",0,1,0.0801265761873909,0.0416069626808166,0.2534993290901184,0.9987617433071136,0,1
fauxmoi_data,post_3,post_3_0_2_1_1,I actually think it is extensions. If you look at the top it is very full with short layers to give volume and hide whatever is keeping the hair on her head. The longer part is all kind of one layer and looks *just slightly*  different in color and texture than the top part. Source: wore extensions for years and learned all the tips for hiding your tracks.,0,1,0.0257553816561062,0.8865011930465698,0.4997287690639496,0.0161622762680053,0,1
