PostID,CommentID,Combative,Deliberative,Text,Toxicity,Rationality,Mutual Respect,Emotion,Moderator,Diversity
post_3,post_3_35,0.0,1.0,"Hi there, I'm a first nations man from Australia, (call me Jermz) i have played a little of the game so far and its truely something amazing!  
for myself, growing up in the 80's - onwards i found it hard to see representation in popular culture of powerful and positive representations of my people to look up to let alone live up to. i ended up grasping at a bunch of other cultures for strength and powerful imagery. martial arts, grew a mohawk... etc. all to find myself in other cultures... anyway

My Question; Is Tales of Zenzera: ZAU your way to provide the coming generations more representations of themselves in the world... to show there is more to them than the negative things they are told?",0.0255730282907888,0.0082499384880065,0.999756395816803,0.9984217882156372,0,1
post_3,post_3_35_1,0.0,1.0,"For me it was about creating and telling a story that was deeply human and universal. The African perspective was simply my perspective! Yes, I do hope it inspires many to tell greater stories - be it from Africa or even Norse. At the end of the day though, by showing a side that isn't shared much, and doing it from a place of truth - you inspire many!

I'm so glad you're enjoying the game :)",0.0249775517529984,0.0089524388313293,0.9991440773010254,0.9999670386314392,0,0
post_3,post_3_36,0.0,1.0,Any plans on exploring other genres with your next game?,0.0271588710677397,0.5412376523017883,0.9988340735435486,0.0806867182254791,0,1
post_3,post_3_36_1,0.0,1.0,"Absolutley. If it lends to the story we want to convey, most definitely.",0.0245293043133396,0.2348759174346923,0.9173599481582642,0.2266021370887756,0,0
post_3,post_3_37,0.0,1.0,"Hello, I've taken notice of this game because the art style is quite appealing to me and I love to see more diverse stories being told. However, I was disheartened when I checked the [Steam discussion forums of your game](https://steamcommunity.com/app/2316580/discussions/) and noticed it was full of reactionaries calling it ""woke garbage"" while using lots of racist dog whistles. What's your opinion on many of the Steam forums going unmoderated like that? Do you feel that Valve has a responsibility to clean up the forums of different games to prevent these sorts of discussions thriving on their platform?",0.0472907735386472,0.0145866274833679,0.9997220635414124,0.006498247385025,0,1
post_3,post_3_37_1,0.0,1.0,"This is a great question and I feel like I need to answer this early.

Our forum isn’t unmoderated. We as a studio think it’s super important to give people a space to talk. Yeah you get people who spam and that isn’t needed, but look, if you want a healthy discussion, go on and go forth.

There is definitely nuance missing in a lot of online discussion I feel, and look, in truth, there are some incredibly derogatory and hurtful messages that are shared. But from our experience, Valve have been helpful when we’ve needed it. They are very aware of what’s going on.",0.0240295916908743,0.0065758228302001,0.9990992546081544,0.9799370765686036,0,0
post_3,post_3_37_1_1,0.0,1.0,That's really great to hear. It's nice to know that Valve has been helpful. Thanks for the answer.,0.0231291635412341,0.159750759601593,0.8976150751113892,0.9990416765213012,0,0
post_3,post_3_37_2,0.0,0.0,[removed],0.0260143950586149,0.8302389979362488,0.995477259159088,0.058917611837387,0,1
post_3,post_3_37_2_1,0.0,0.0,[removed],0.0260143950586149,0.8302389979362488,0.995477259159088,0.058917611837387,0,0
