PostID,CommentID,Combative,Deliberative,Text,Toxicity,Rationality,Mutual Respect,Emotion,Moderator,Diversity
post_2,post_2_2_1,0.0,1.0,"2016 - Ratchet & Clank

2018 - Spider-Man

2020 - Spider-Man: Remastered

2020 - Spider-Man: Miles Morales

2021 - Ratchet & Clank: Rift Apart

2023 - Spider-Man 2

2025 - Venom

2026 - Wolverine

2028 - Spider-Man 3

2029 - Untitled Ratchet & Clank Project

2030 - X-Men

2031 - New IP

*and* that's not including DLC, the Spider-Man: Silk spin-off, the (*cancelled?*) Spider-Man multiplayer game *and* the inferred future X-Men games in their exclusivity agreement either. If Insomniac manage to stick to this leaked schedule, I'll be extremely impressed",0.0273602863530474,0.3220531940460205,0.8607382774353027,0.0026946067810058,0,0
post_2,post_2_2_1_1,0.0,1.0,"Man, gaming kinda sucks massively for kids now with the dev time we're seeing. Imagine being 10 and playing Rift Apart and having to wait until you're an adult for a sequel. In comparison, Jak and Daxter 1 through 3 all came out in a 3 year span.",0.7014544032022358,0.0052083730697631,0.9997995495796204,0.0006176233291625,0,1
post_2,post_2_2_1_1_1,0.0,1.0,That's why Fortnite is so popular with kids. Constant updates.,0.0346649934270973,0.5056238174438477,0.998928964138031,0.9015783071517944,0,1
post_2,post_2_2_1_1_1_1,0.0,1.0,People wonder why f2p games are so popular but when I talk to Genshin fans it always sounds like there's a new small update every few months and a huge one every year.,0.0256880241006878,0.3584176301956177,0.9807361364364624,0.1719292998313903,0,1
post_2,post_2_2_1_1_1_1_1,0.0,1.0,On the flip side I have seen people say single player games like BG3 are dead because no new dlc or updates… like not every game needs constant support lmao.,0.0314590624696213,0.5739875435829163,0.990995466709137,0.0018937587738037,0,1
post_2,post_2_2_1_1_1_1_1_1,0.0,1.0,"I agree, I basically only play single player, ""completed"" games nowadays. 

I just think there's a hunger for that live service stuff because a section of gamers want constant updates.",0.0236872550856861,0.00510174036026,0.6075125336647034,0.0014027953147888,0,0
post_2,post_2_2_1_1_1_1_1_1_1,0.0,1.0,"Yea I’m not immune to love service stuff, I play Star rail and Destiny 2. But I find myself spending more time just playing single player stuff tbh",0.0492310067840332,0.0055536031723022,0.9996328353881836,0.0015997886657714,0,0
post_2,post_2_2_1_1_2,0.0,1.0,"> Imagine being 10 and playing Rift Apart and having to wait until you're an adult for a sequel. 

As someone who watched my generation grow up with Pokemon and Harry Potter and then never move on from liking those things, I think it's good kids might have to actually force themselves to get interested in more than a handful of franchises.

jak and Daxter is a funny example since 3 had that abrupt switch to being ""adult""",0.1046043711812369,0.0055136084556579,0.9995194673538208,0.1939651668071746,0,1
post_2,post_2_2_1_1_2_1,0.0,1.0,"Jak 3 was just teenager-y. Like Warrior Within. I kinda wish we would see more of that these days, games growing up with their audience.",0.0282290618467921,0.0135999917984008,0.9930251836776732,0.9877948462963104,0,0
post_2,post_2_2_1_1_2_1_1,0.0,1.0,I wouldn't necessarily say Jak 3 or Warrior Within were examples of growing up. It's like a kid's idea of what being an adult means. I was a teenager at the time and it felt pretty forced to me.,0.0301369775574326,0.3164259195327759,0.9984056353569032,0.0031343400478363,0,0
post_2,post_2_2_1_1_2_1_1_1,0.0,1.0,"I agree. That's why I was saying teenager-y. I'm not saying the specific approach was great with both of them, but games at least aiming to evolve their subject matter as their audience grows up is a far more interesting thing than the alternative.",0.0237928585843128,0.0120225548744201,0.9208703637123108,0.0054737031459808,0,0
post_2,post_2_2_1_2,0.0,1.0,"Excellent round up! And supposedly we're getting the free Spider-man DLC starting this year and maybe pouring over into the next. If that's the case we should hear about it at next week's showcase. If true, and if the schedule you posted above holds, then 2027 will be the only year for the next 7 years in which Insomniac is not releasing something.  Makes the Sony-mandated Insomniac layoffs even more puzzling.",0.0317712136119482,0.599719762802124,0.9995056390762328,0.8000765144824982,0,1
post_2,post_2_2_1_3,0.0,1.0,Is SM3 a PS6 title? The timeline would make sense.,0.0266427753281927,0.6255054473876953,0.9989959597587584,0.0094569027423858,0,1
post_2,post_2_2_1_3_1,0.0,0.0,It'll probably be cross-generational.,0.0271193018236407,0.5664329528808594,0.9989016056060792,0.0618488788604736,0,0
post_2,post_2_2_1_4,1.0,0.0,"What year is Sunset Overdrive 2 coming?! I don’t see it in your list, there must be some mistake.",0.0458386010878017,0.4456360340118408,0.9944273233413696,1.3113021850585938e-05,0,1
post_2,post_2_2_1_5,0.0,0.0,">New IP

Gimme Spider-Verse\~",0.0378822833027402,0.0049371123313903,0.9994267225265504,0.9996635913848876,0,1
post_2,post_2_2_1_6,0.0,1.0,"That's a great schedule, but I sort of wonder what we can expect until the end of this year. Is 2024 just an emtpy year in terms of big releases other than Final Fantasy Rebirth?",0.0242691591676518,0.0057170391082763,0.9897183179855348,0.0295688807964324,0,1
post_2,post_2_2_1_6_1,0.0,1.0,"In terms of PlayStation specifically, you have [Silent Hill 2](https://youtu.be/ayKICAIUHkA?si=dsf59UzvUk3v4yhU) on the way, alongside the *supposed* DLC for [Spider-Man 2](https://youtu.be/9fVYKsEmuRo?si=SCQ689Qkcvr0LNOP). There's also [Concord](https://youtu.be/Zb-xvCPecps?si=xjTGirVSzbUwHuJI), which is an FPS developed by one of Sony's new teams, [Firewalk Studios](https://www.firewalkstudios.com). As well as [Zenless Zone Zero](https://youtu.be/If7LQKe3C2w?si=COtSzZdb299xGhAV), the new title from MiHoYo (*if gacha games are your kinda thing*).

Some smaller PlayStation exclusives releasing later in this year would be:

• [Baby Steps](https://youtu.be/xcpEijrd98E?si=EGpBzw1wriGBCn-W)

• [Sword of the Sea](https://youtu.be/KXUmt8SPfJk?si=sE_sF1Yg86a1czfL)

• [Towers of Aghasba](https://youtu.be/NZt7faLIwyE?si=-TcjuWH-K-D1kasa)

... and (*supposedly*) a new [Astro](https://youtu.be/33zqCAJ-qrE?si=m8opiHZxGHToxGT_) game that is going to be announced in the coming week.


Hopefully you find something more than FFVII to play!",0.0774128523302861,0.3434224724769592,0.9995381832122804,0.8034191727638245,0,0
post_2,post_2_2_1_7,0.0,1.0,"Damn, didn't realize it was going to be so long till the next Ratchet & Clank game.",0.5847080811426361,0.2218546867370605,0.999796450138092,0.1364005208015442,0,1
post_2,post_2_2_1_7_1,0.0,1.0,"It might possibly be even longer. Some of the material suggested that Venom was actually targeting a 2027 release instead of 2025. If true then that means anything on that list could potentially be targeting a later window than original though.

Also worth noting this was before the layoffs, who knows how that has impacted timelines.",0.0246711852580926,0.3750532269477844,0.9990301132202148,0.0055259466171264,0,1
post_2,post_2_2_1_8,0.0,1.0,Arent they making a Blade game as well?,0.0322906856826882,0.7946676015853882,0.9957261085510254,0.001467615365982,0,1
post_2,post_2_2_1_8_1,0.0,1.0,"No, Blade is being developed by Arkane Studios (*a company owned by Xbox*). They're the developers of Deathloop and Dishonored",0.0419093565396565,0.563909113407135,0.9996271133422852,0.0001538395881652,0,0
post_2,post_2_2_2,0.0,1.0,"To be fair three of those are basically the same game and some are pretty short.

The ‘expandalone’ genre like Miles Morales and Uncharted Lost Legacy is genius and I wish more studios did it as the gaps between AAA sequels are growing.",0.0250575056159422,0.0073628425598144,0.995416522026062,0.0657210350036621,0,1
post_2,post_2_2_2_1,1.0,0.0,Point stands,0.0285719867699601,0.8949061036109924,0.9983556866645812,0.9993136525154114,0,1
post_2,post_2_2_3,0.0,1.0,"I’m in zero rush for their next title. They need to overhaul their encounter/mission design completely; this many games in and it’s a real drag how predictable and unengaging the encounters are because of their choice of an open ended progression system. You have to be able to beat evry ebemey and boss with the basic starting attacks and that’s rags down a lot of the mission design across the board.

Unfortunately the leaks showed they’re copying that same spider/man enemy wave closet design for Wolverine, so hopeful more time will give them the chance to give that an overhaul or at least post the variety way beyond the current approach they’re using.",0.0288741126419554,0.0117454528808593,0.9961012601852416,0.0001128017902374,0,1
post_2,post_2_2_4,0.0,1.0,I agree. It sucks that the game got leaked because it is making people even more impatient now. I’m fine with them taking their time because by the time it does come out I’m hoping the new  Steamdeck will be out and can run it really well lol.  ,0.1577147551734132,0.2453653812408447,0.999789297580719,0.1035408079624176,0,1
post_2,post_2_2_4_1,0.0,1.0,Tbh the leaks probably helped with that by setting a realistic expectation of when we’re actually gonna see the game. Revealing Wolverine in 2021 and then not showing anything until 2025 at the earliest would’ve had people frothing at the mouth.,0.1107724232580467,0.3281455636024475,0.98305743932724,0.0140564143657684,0,1
post_2,post_2_2_4_2,1.0,0.0,Well it probably won’t release on PC right away so you will have an even longer wait lol.,0.039085554233893,0.3678244352340698,0.9997467398643494,0.0031678080558776,0,1
post_2,post_2_2_4_2_1,0.0,1.0,That’s a good point but I’m in no rush because I don’t believe in FOMO anymore and thanks to the rise of more smaller developers making games than ever there will be plenty of great games to play in the meantime!,0.0272661677367317,0.0112547278404235,0.9951451420783995,0.8685161173343658,0,0
post_2,post_2_2_4_3,1.0,0.0,"I'm not sure how you figure that a steam deck 2 will definitely be able to run a game that's not even been formally announced.

The current steam deck already struggled with new AAA games, and I expect a new model to be similar.  Targeted towards mid-range gaming",0.0254575084581114,0.0464777946472168,0.9821457266807556,2.747774124145508e-05,0,1
post_2,post_2_2_4_3_1,0.0,1.0,"Steamdeck will be able to run SM2 (if you’re okay with 30 fps), i think it’s a reasonable expectation for its next iteration to run Wolverine.",0.0272504318964131,0.3344093561172485,0.9825916290283204,0.0086915791034698,0,1
post_2,post_2_2_4_3_1_1,0.0,1.0,"I’m not too sure. It currently struggles to run Horizon Forbidden West and that’s one of the last cross-gen titles for the platform. SM2 is a full-on PS5 game, and while Spider-Man Remastered runs perfectly fine on there, that still has the foundation of a PS4 game.",0.0297424604485033,0.1570108532905578,0.9995418787002563,0.0705434083938598,0,1
post_2,post_2_2_4_3_1_1_1,0.0,1.0,"https://www.reddit.com/r/insomniacleaks/s/9gvz55x7Lu

This is ofc an ‘unoptimised’ port, so i’d expect the real thing to do a bit better which should be enough for a constant 30fps",0.0281983722336978,0.00615656375885,0.999309539794922,0.0001644492149353,0,0
post_2,post_2_2_4_3_1_2,0.0,1.0,"It CAN run SM2 now…there is a PC build of the game from the leak.

https://www.youtube.com/watch?v=N5W0tGS0hQ0",0.0523262300635176,0.3181378245353699,0.9989786148071288,0.0070186555385589,0,1
post_2,post_2_2_5,0.0,1.0,"i mean, all developers equally ""deserve"" to take their time with their next game. developers don't owe anyone anything when it comes to their games in development that haven't been sold yet. and no, purchasing their previous games does not make you a stockholder in the company, and they can spend the profits they made off you by burning it in a fire pit if they wanted to.",0.0626094128642147,0.6594162583351135,0.9989187717437744,0.0012915730476379,0,1
post_2,post_2_2_6,1.0,0.0,"High quality and game are debatable. Their last few ""games"" are basically cookie cutter on rails experiences ",0.0239300845616383,0.0131265521049499,0.7363021969795227,0.0621173083782196,0,1
post_2,post_2_3,1.0,0.0,I hate that these seasoned developers feel they need to respond to the whims of whiny online 12-year olds,0.5008935097305713,0.1880080103874206,0.999772608280182,9.420514106750488e-05,0,1
post_2,post_2_3_1,0.0,1.0,If only if was 12 year olds.,0.0620143788435485,0.9016419649124146,0.998375415802002,0.1553923785686493,0,1
post_2,post_2_3_2,0.0,1.0,12 year olds are busy playing Roblox and Minecraft on their phones.,0.2813482377888086,0.5021166801452637,0.9972123503684998,0.018236368894577,0,1
post_2,post_2_3_3,1.0,0.0,Those people are their consumers so yes they kind of have an obligation to ,0.0275987407565051,0.0207020044326782,0.9893222451210022,0.9985227882862092,0,0
post_2,post_2_3_3_1,1.0,0.0,I don't know why some people think that the hyper online core of obsessive fans and anti-fans on twitter and reddit are somehow representative of some larger gamer market these companies have to appease. The vocal online types are a very loud but relatively small minority of their market. They often just don't matter that much.,0.0850089063825572,0.0112285017967224,0.9996432065963744,0.0001436173915863,0,1
post_2,post_2_3_3_1_1,0.0,1.0,They're definitely a minority but theyre whales. The passionate fans make up a large chunk of your revenue and are the people who keep your name in the public zietgiest so yes they are very important,0.0932671909823914,0.5600846409797668,0.999247431755066,0.9975582361221312,0,0
post_2,post_2_3_3_2,0.0,1.0,They absolutely do not have an obligation to reply to random people on twitter,0.0394636123712057,0.646997332572937,0.7356970906257629,0.9583241939544678,0,1
post_2,post_2_3_3_2_1,0.0,1.0,Oh sure but then don't get mad when their audience gets mad at them for ignoring their audience ,0.208545607465449,0.0061247944831848,0.9991254210472108,0.1133119165897369,0,0
post_2,post_2_3_3_2_1_1,1.0,0.0,"If you get mad over a game, that's on you. Also nobody Insomniac can do whatever their audience eats it up because their games have consistent quality.",0.1815362958825726,0.0080857276916503,0.999710977077484,0.9817224740982056,0,1
post_2,post_2_3_3_2_1_1_1,0.0,1.0,Lots of people can't unfortunately. I don't think it's quality do much as good marketing ,0.0259574842036748,0.3895163536071777,0.952424168586731,0.0030440092086791,0,0
post_2,post_2_3_3_2_1_1_1_1,0.0,1.0,"You are getting into ""opinion"" territory, so can't comment on that. Insomniac fames are relatively held to a high standard by most reviewers and their financial success shows their audience buys their games.


Whether some people dislike them, well, opinions differ.


Insomniac doesn't owe people an announcement they never commited to. This is based on leaks, and those aren't fully reliable.",0.025808075473686,0.0134326219558715,0.9988003969192504,1.0073184967041016e-05,0,0
post_2,post_2_3_3_2_1_1_1_1_1,0.0,1.0,Fair enough. But the leaks werent like rumours and what not but full on hacked data. That's reliable so it makes sense for them to come out and quash the hype before it reaches critical mass. I'm surprised they didn't do it sooner tbch,0.104042466944592,0.4610133767127991,0.999727427959442,0.0001486241817474,0,0
post_2,post_2_3_3_2_1_1_1_1_1_1,0.0,1.0,"They did come out and quash the hype. They mentioned iirc, that the information contained within was not meant to be seen becayse it's not final. Release dates change constantly based on how development progresses... That's the problem with leaks, even if they are real, the way people interpret the information can be extremely harmful.",0.0266408909192895,0.6906439065933228,0.9723056554794312,3.713369369506836e-05,0,0
post_2,post_2_3_3_2_1_2,1.0,0.0,"I won't, that sounds like the last important thing ever.",0.0285271121347634,0.5363765954971313,0.9731343388557434,0.0009766817092895,0,0
post_2,post_2_3_3_3,0.0,1.0,"If there's a major news event or public controversy that genuinely needs to be addressed by them for the sake of PR, then sure. 

People getting restless on Twitter waiting for game development to finish doesn't qualify.",0.0238396373477634,0.5659967660903931,0.7382137179374695,0.0004055798053741,0,1
post_2,post_2_3_3_3_1,0.0,1.0,I guess their pr team thought different,0.0249973115462665,0.4996333718299866,0.9948831796646118,0.0002667009830474,0,0
post_2,post_2_4,0.0,1.0,"I wish they made more than marvel slop these days, Ratchet and Clank ps2 series is miles above everything they've made recently, save for the graphics.",0.0496970561085514,0.3533164262771606,0.9995150566101074,0.8518144190311432,0,1
post_2,post_2_5,0.0,1.0,"I always wonder what effect (if any) having parts of your game leaked may have on internal development. Like if you get tons of negative feedback, do you consider changing course or do you just brush it off? 99% of the criticisms I saw about Wolverine came from people that don't understand a work in progress looks like, but I'm still curious if they listened to anything people were saying about it.",0.0249559874189437,0.0532863736152648,0.998978853225708,1.1980533599853516e-05,0,1
post_2,post_2_6,0.0,1.0,They will probably wait until after the Deadpool and Wolverine movie comes out so people are thirsty for more Wolverine.,0.0357932310602663,0.5070623159408569,0.999698042869568,0.0202935338020324,0,1
post_2,post_2_7,0.0,1.0,Weren't those news already shared by hackers?,0.027567959649799,0.7318215370178223,0.997733235359192,0.0003782510757446,0,1
post_2,post_2_8,0.0,1.0,Is this the same Wolverine that had its  early prototype released on warez sites?,0.0315095896865235,0.7433711886405945,0.8091833591461182,0.0053240954875946,0,1
post_2,post_2_9,0.0,1.0,"Superheros are are inherently a bad premise for video games. 

Hear me out: Progression. 

The set abilities and static power level of the DC and Marvel heros makes progression in the games break the fundamental concept of those comic book worlds. The narrative, stories and conflicts are designed around villain-hero relationships in power level. This means that games with these characters diverge from the pathways in narrative that define their interaction in the world.

Pretty sure someone could write a thesis about this on the topic of ludonarrative dissonance.  

Spiderman and Tony stark are the two I can think off that progress via technology. And you get rare moments of significant change.",0.0288762443898641,0.0064648389816284,0.5529337525367737,0.0028147995471954,0,1
post_2,post_2_9_1,0.0,1.0,Almost every superhero comic/movie has the hero getting stronger as the story progresses.,0.0244856191075916,0.0081056952476501,0.9978700876235962,0.996730625629425,0,1
post_2,post_2_9_1_1,0.0,1.0,"I suppose my definition of progression might be different from yours and that makes sense. Mine is one of logarithmic growth over the narrative growth of wolverine who gets a metal skeleton. Of the physical aging of superman who comes more fully into his powers over time. Or thor getting a new hammer and blessing. Batman is a good example of technological and physical progression in skill but he is fundamentally limited by the capacity of human growth.

Dragonball is a good example of the progression that can exist when it is foundational to the ruleset of the world. Even better, consider Naruto: the entire premise of the show is about gaining strength and progressing in skills. Progression is built into the world and its characters. Marvel and DC heroes exist in a flat world where progression is not the premise of society at all. Training is undertake to use held power but it is certainly not to gain new powers.",0.0249831708780591,0.0138912796974182,0.8509051203727722,0.9038144648075104,0,0
post_2,post_2_9_1_1_1,0.0,1.0,"Maybe not to gain new powers, but they discover new ways of using their own powers all the time. Plenty of superhero movies have montages where they're trying out their abilities and gradually coming to master them.",0.0291493735942708,0.006556749343872,0.9873360991477966,0.940175712108612,0,0
post_3,post_3_0,0.0,0.0,"Hello, I'm Abubakar Salim. We launched Tales of Kenzera: ZAU a month ago on all platforms. AMA on the 23rd May @ 8am PT (16:00 UK time)",0.0244746945412179,0.2517858147621155,0.9880856275558472,0.8979121148586273,0,1
post_3,post_3_0,0.0,1.0,"Love your voice man, you killed it as Bayek",0.1889259041973413,0.4743255376815796,0.9997190833091736,0.9966998100280762,0,1
post_3,post_3_0_1,0.0,0.0,And Father.,0.0393079852235537,0.9108167886734008,0.9979392886161804,0.9983707368373872,0,1
post_3,post_3_0_1_1,0.0,1.0,Praise Sol!,0.0332734313783687,0.4567315578460693,0.9012631773948668,0.9982927441596984,0,1
post_3,post_3_0_1_2,0.0,1.0,And thank you too!,0.0240228021448522,0.5309825539588928,0.5004305243492126,0.9892271161079408,0,1
post_3,post_3_0_1_2_1,1.0,0.0,I had a slight crisis of confidence when I realised you were several years younger than me. Such gravitas and authority as both Father and Bayek.,0.0270672359927072,0.1803528070449829,0.9959706664085388,0.998789280653,0,0
post_3,post_3_0_2,0.0,1.0,Thank you!,0.0255501394781739,0.5309825539588928,0.5004305243492126,0.9651955366134644,0,0
post_3,post_3_1,0.0,1.0,Hi Salim! I was moved by your speech at the Game Award and I hope the sales and feedback have been positive for you and your team! I also like that you have been very proactive in responding to the reviews on Steam. I can't wait to see your next project and im sure your dad would be proud!,0.0275546703090484,0.1706541180610656,0.9968783855438232,0.9994371831417084,0,1
post_3,post_3_1_1,0.0,1.0,"From all the famous person I have seen at those kind of event you could tell he was one of the few that was passionate and genuinely happy to be there, I was moved by his story. He was excellent in Raised by wolves, pleasantly surprise to see him in house of dragon, he totally deserve it!",0.0272548221464581,0.2641560435295105,0.998778760433197,0.9994074106216432,0,1
post_3,post_3_1_1_1,0.0,1.0,<3,0.0299578423265908,0.9211889505386353,0.9967827796936036,0.9973036348819732,0,0
post_3,post_3_1_2,0.0,1.0,Appreciate this. Thank you so much. Spoke from the heart and I'm glad it resonated.,0.0228082315835456,0.2384921312332153,0.960565149784088,0.9952027499675752,0,0
post_3,post_3_2,0.0,1.0,"First off, congratulations on the release! I really liked the story. Way above par for the genre, and the end of act 3 in particular hit really hard. I have one non-spoilery question and one spoilery question:

1. What aspects of the game are you proudest of, and what lessons did you take away for next time?

2. Within the inner story, was >!Kalunga real at any point, or was Zau just hallucinating the whole time!<? Or maybe >!Zuberi and his Baba!< have different takes on that?",0.0653566230084665,0.0080229640007019,0.9997311234474182,0.9999057948589324,0,1
post_3,post_3_2_1,0.0,1.0,"Thank you for playing! I'm glad you enjoyed.

1. For me, it was just getting a game out there, hah! Game dev is so hard. SO HARD. In regards to the actual game itself though, I'm just really happy I was able to get a team together to build something we are deeply passionate about. And having led with that in mind, I've learnt that that is truly the way to create something you can be proud of - by building it from a place of love and passion.
2. >!Kalunga, the God of Death was always real in Zau's world. In my eyes, Zau was conversing with Death - his take on what Death is - which was his Baba. The image of Death for Zau, at that moment, was his Baba. And I think that was the realisation that Zuberi had that allowed him to complete his Baba's story!<",0.0406595795896802,0.0080772042274475,0.9996143579483032,0.9994613230228424,0,0
post_3,post_3_2_1_1,0.0,1.0,"Thanks for the answers! Just FYI, your spoiler tag on the second one will appear broken on some platforms. There shouldn't be a space between the ! in the tag and the rest of the text.",0.0303723465333,0.3867309689521789,0.9970104694366456,8.675456047058105e-05,0,0
post_3,post_3_2_1_1_1,0.0,1.0,Legend. Editing now!,0.0285757228024595,0.8673107624053955,0.937357783317566,0.999554008245468,0,0
post_3,post_3_3,0.0,1.0,"Hey Abubakar, we met many years ago and just wanted to say congratulations and this success couldn’t have come to a nicer, more deserving individual. Keep crushing it.",0.0291259957878644,0.0305007100105285,0.9928663969039916,0.0085205733776092,0,1
post_3,post_3_3_1,0.0,1.0,Thank you so much. I hope you have been crushing at life also since we last met :D,0.0322367514773457,0.5571138262748718,0.8343252539634705,0.991561323404312,0,0
post_3,post_3_4,0.0,1.0,"Hey Abu. Once again, congrats to you and the team for creating a truly special game. My question to you is something I’m sure many developers have to deal with but is there something that you regret cutting from the game because you guys ran out of time or that it just didn’t make sense anymore with the current iteration of the game? Another question is what are you proudest of in the game? I’m truly curious about your process.",0.0308311422660994,0.0116035342216491,0.9990203380584716,0.9924260079860688,0,1
