PostID,CommentID,Combative,Deliberative,Text,Toxicity,Rationality,Mutual Respect,Emotion,Moderator,Diversity
post_1,post_1_0,0.0,0.0,"MultiVersus - Official Jason Voorhees ""Weirdo in a Mask"" Gameplay Trailer",0.0432324903835307,0.0166957378387451,0.9083391427993774,0.0288284718990325,0,1
post_1,post_1_0,0.0,1.0,"Jason looks like he drank the lake around him - all the same I love his design and the Jason X outfit!

So glad we're seeing a return of Friday the 13th considering the legal mess that tied up the rights for *so* long. 

Between this and MKX I can't believe I have the chance to be a Jason main twice",0.0305586852736445,0.0534109473228454,0.9997488856315612,0.998648077249527,0,1
post_1,post_1_0_1,0.0,1.0,Time to make mother proud,0.1616103004470376,0.8198384046554565,0.995043396949768,0.9991663992404938,0,1
post_1,post_1_1,0.0,1.0,I'm actually pretty tickled to see so many deep cuts of Jason lore be incorporated into his move set. Such as the call back to Freddy Vs Jason bed death and the sleeping bag rather than him just using a machete and that be it. Or the call back to part 6 and 7 with the trailer intro.,0.0248728125909016,0.1623018980026245,0.9997393488883972,0.9746055901050568,0,1
post_1,post_1_2,0.0,1.0,"I love the sleeping bag special, and I hope that was a nano-machine install. I dont have high expectations for this game, but dang that was commical.",0.0296486330732672,0.5905025005340576,0.9996215105056764,0.9994958341121674,0,1
post_1,post_1_2_1,0.0,1.0,"One thing Multiversus does well is filling every character’s kits with fan-service.

Velma is hillarious because instead of physically attacking she talks and makes big speech bubbles that hurt people. And Tom and Jerry are too busy fighting each other and their attacks can hurt others.",0.1019062679961047,0.0485637187957763,0.9997267127037048,0.8784482777118683,0,1
post_1,post_1_2_1_1,0.0,1.0,Tom and jerry were my favourite in the beta because of how well animated they were,0.0336364352925665,0.620262861251831,0.9772639274597168,0.999548077583313,0,1
post_1,post_1_2_1_1_1,0.0,1.0,Yep I didn't expect them to become one of my mains but they are fun and strong too!,0.0274376629502648,0.0112829208374023,0.999525547027588,0.9995511770248412,0,1
post_1,post_1_3,0.0,1.0,"People rightfully bitch and moan about egregious monetization and WB being a troublesome publisher, but I can't help but love this game and hope it succeeds for a long time. Who thought we'd ever have a game where Jason could fight Shaggy and Wonder Woman?


Here's hoping WB doesn't ruin a good thing.",0.8537437779994346,0.0047999620437622,0.999775230884552,0.9986006617546082,0,1
post_1,post_1_3_1,0.0,1.0,"It seems they are making good improvements so far by putting premium currency in the battlepass.

Now the real test will be whether the battlepass is a grindy slog or not.",0.0571503354498575,0.5413504838943481,0.749430239200592,0.9563084244728088,0,0
post_1,post_1_3_1_1,1.0,0.0,"I wonder if they'll do that extremely scummy thing where, for example, the battle pass costs 500 points of in-game currency, but you can only buy 450 points of in-game currency for $10, and then the next jump is buying 900 points at $20. So you're essentially forced to pay double the amount you should because they deliberately choose scamming breakpoints.   
  
I seem to remember doing that last time they launched the game, but maybe I'm thinking of something else.",0.1193698920597617,0.0598055124282836,0.999745786190033,3.814697265625e-06,0,1
post_1,post_1_3_1_1_1,0.0,1.0,I remember there was a 450 pack but I think there was also a 1000 pack which was enough to get the battlepass.,0.025739279634869,0.4627730846405029,0.950416386127472,0.105307936668396,0,0
post_1,post_1_3_1_1_2,0.0,1.0,The Battle Pass costs 950 Gleamium. You can buy 1000 Gleamium for $10.,0.0309636408687221,0.484584629535675,0.9787352681159972,0.0018933117389678,0,1
post_1,post_1_3_1_1_3,0.0,1.0,I think they mentioned in the last update that they're will be enough in each battle pass to buy the next one,0.0259186062306799,0.0183656811714172,0.961560070514679,0.1389084160327911,0,1
post_1,post_1_3_1_1_3_1,1.0,0.0,"That's not what they're asking, though. What they want to know is if it'll be possible to buy the exact amount of currency to buy the Pass or not.",0.0258957115525259,0.4577391743659973,0.7450615167617798,0.0020462870597839,0,1
post_1,post_1_3_2,0.0,1.0,"When coming from other F2P titles, paid characters seems egregious. But when compared to other fighting games, the majority of which cost €60 or more for entry, they're charging the same price for fighters. 

Funnily enough the fact that it's included with a battle pass instead of being a separate charge like Tekken or Mortal Kombat seems to have set off /r/games radar more than usual, just because it has the phrase ""battle pass"" in the deal.",0.0291371271815289,0.0100389719009399,0.9150082468986512,0.8473461270332336,0,1
post_1,post_1_3_2_1,0.0,1.0,"Yeah like you said, when it comes to other fighting games it is less egregious.


They seem to skate by quite often.",0.0285598321176452,0.0048459768295288,0.6435040831565857,0.9987512528896332,0,1
post_1,post_1_3_3,0.0,1.0,"> Who thought we'd ever have a game where Jason could fight Shaggy and Wonder Woman

Be real. This hasn’t been a unique compelling concept since Fortnite started doing crossovers",0.0326961510190689,0.3361455798149109,0.9983028173446656,0.0039973556995391,0,1
post_1,post_1_3_3_1,0.0,1.0,"It's quite a bit different because in Fortnite, they're all shooting guns and are reskins of each other. In this, you have Jason reenacting his iconic horrifyingly gruesome kills on Steven Universe and Bugs Bunny.",0.0864156997317949,0.0462051033973693,0.999656081199646,0.961215764284134,0,0
post_1,post_1_3_3_1_1,0.0,1.0,"I find this funny because  neither of the two meta weapons right now are guns. 

Its water bending and the chain of hades.",0.028890253567126,0.5006040334701538,0.9992923736572266,0.9981578290462494,0,1
post_1,post_1_3_3_1_1_1,0.0,1.0,I thought both were gone already?,0.0269562455976141,0.7123214602470398,0.6769373416900635,0.2152669429779052,0,1
post_1,post_1_3_3_1_1_1_1,0.0,1.0,"They came back a few weeks ago. 

And will disappear tomorrow.",0.0292530049243635,0.8223743438720703,0.8916562795639038,0.0027355849742889,0,1
post_1,post_1_3_3_1_1_1_1_1,0.0,1.0,Ah gotcha. Rip. Water bending was real fun,0.0619123217942699,0.5596567392349243,0.9997430443763732,0.9998858869075776,0,0
post_1,post_1_3_3_1_1_1_2,0.0,1.0,today is the final day of the season,0.0658457466360474,0.9006655216217041,0.9990678429603576,0.9545848071575164,0,0
post_1,post_1_3_3_1_1_2,0.0,1.0,Guess I'm talking out my ass then. I didn't realize they've added all those weapons haha. It's been a bit since I've played.,0.9518128728097472,0.1018697023391723,0.9995883107185364,0.0015085041522979,0,0
post_1,post_1_3_3_1_1_2_1,0.0,1.0,"They usually add unique weapons with the big crossovers now so like this season we got

Avatar skins with bending the elements.

Star wars skins with blasters, bowcasters and Vader's light saber.

Greek gods with chain of hades, Zeus's lightning bolts, wings of Icarus. 

Tomorrow is the new season start and it's wasteland themed so we are getting fallout stuff like power armor skins, laser rifles, nuka cola, new vehicles and some other stuff that I can't quite tell what it is from the trailer.


Edit. Oh and the map also changes and has events added so right now the map has mount Olympus, Hades like zone, empire bases and avatar temples.",0.0264149339493224,0.0060445666313171,0.9885923266410828,0.0047858357429504,0,0
post_1,post_1_3_3_1_1_2_1_1,0.0,1.0,"Very interesting, thanks for the info. So only players who buy X skin get the X weapon?",0.0249981276921175,0.01146000623703,0.4873720705509186,0.9830699265003204,0,0
post_1,post_1_3_3_1_1_2_1_1_1,0.0,1.0,"No, the skins are only cosmetic. The weapons are lootable items in the game.",0.028690542791707,0.7751825451850891,0.9990264177322388,0.0250610709190368,0,1
post_1,post_1_3_3_2,0.0,1.0,"And you know, *smash bros ultimate*",0.0308975558450545,0.3839656114578247,0.9906365275382996,0.9972759783267976,0,1
post_1,post_1_3_3_2_1,1.0,0.0,What on earth are you talking about? Smash bros ultimate is the best example of crossovers. Sakurai would literally dedicate ~30 minute long videos to talk about just how much effort he and his team put into each character to make them feel like how they feel in their home properties as much as possible. Sakurai's attention to detail puts any other crossover to shame.,0.0538629288680893,0.0342255234718322,0.8753466606140137,0.9038826525211334,0,1
post_1,post_1_3_3_2_1_1,0.0,1.0,"Didn't gotta tell me, I agree with you!",0.0282276287367774,0.6791398525238037,0.9888796806335448,0.9828648269176484,0,0
post_1,post_1_3_3_2_2,1.0,0.0,Fortnite was an apt comparison there's no need to bring up a less impressive crossover,0.031241634672298,0.4052474498748779,0.99919456243515,0.9924015998840332,0,1
post_1,post_1_3_3_2_2_1,1.0,0.0,That ain’t a fucking thing less impressive about Smash Bros. The sheer amount of jumping through hoops that Sakurai’s team needed to get the licensing to Sora is nothing less than genius.,0.9753384662900736,0.2132150530815124,0.9997914433479308,0.9999284148216248,0,1
post_1,post_1_3_3_2_2_1_1,0.0,1.0,"How is sora in smash not less impressive than the hundreds of equally impressive character crossovers in fortnite?

Hell he's probably gonna be in fortnite soon if the leaks are correct so..",0.1817852797865727,0.4294368028640747,0.999788224697113,0.8608140051364899,0,0
post_1,post_1_3_3_2_2_2,0.0,0.0,[removed],0.0260143950586149,0.8302389979362488,0.995477259159088,0.058917611837387,0,1
post_1,post_1_3_3_2_2_2_1,0.0,0.0,[removed],0.0260143950586149,0.8302389979362488,0.995477259159088,0.058917611837387,0,0
post_1,post_1_3_3_2_2_2_1_1,0.0,0.0,[removed],0.0260143950586149,0.8302389979362488,0.995477259159088,0.058917611837387,0,0
post_1,post_1_3_3_3,0.0,1.0,There's a huge difference between skins and having the actual characters with a designated moveset.,0.0248090126366825,0.6904169917106628,0.99853515625,0.9599131941795348,0,1
post_1,post_1_3_4,0.0,1.0,"I want to like it so much, but it just feels so *bad* to play. The physics, the hits, all of it just feels bad to me. I wish I knew literally what the issue was so I could articulate why it feels so much worse than something like Smash, but I just can’t get into it.",0.0444386709896621,0.1590409278869629,0.9995157718658448,8.64267349243164e-06,0,1
post_1,post_1_3_4_1,0.0,1.0,"The animations are too floaty. Attacks never felt like they had weight behind them. Take any fully charged attack in Multiversus and it doesn’t come close to a forward smash Ganondorf, or a Falcon Punch. Smash has a “meaty” feel to attacks, combined with satisfying hit stop animation and sounds, and it feels great to fight.",0.0568703338423714,0.1361888647079467,0.9981808662414552,0.000454843044281,0,1
post_1,post_1_3_4_2,0.0,1.0,"For starters, it physics are just too floaty. Its done intentionally of course, but its just way less satisfying to move your chatacter around than non-floaty physics.


Second of all, the animations and visual clarity in Smash are just unrivalled and always will be.",0.0313866206762826,0.0110683441162109,0.9966187477111816,4.363059997558594e-05,0,1
post_1,post_1_3_5,1.0,0.0,WB *will* ruin a good thing.,0.1336363456814308,0.005289077758789,0.9989674091339112,0.007634699344635,0,1
post_1,post_1_4,0.0,1.0,"He kind of looks like the guy from Splatterhouse, who was themself inspired by Jason, so we've come full circle.",0.0283263576155991,0.0047322511672973,0.9996294975280762,0.999544322490692,0,1
post_1,post_1_5,0.0,1.0,Couldn't wait for September to release him on a Friday the 13th? Actually considering Zazlav yeah do it now.,0.0337869991515915,0.0047199726104736,0.9985139966011048,0.0285137891769409,0,1
post_1,post_1_6,0.0,1.0,Huh I didn't even realize Friday the 13th was owned by WB?,0.0321702971713017,0.4005290269851684,0.7114821672439575,0.0002340674400329,0,1
post_1,post_1_6_1,0.0,1.0,"The rights are a mess. At one point they were distributing the movies but now the rights are split between two separate IP holders, none of which are WB. This is technically the game’s first true 3rd party character.",0.0283215261478825,0.4334716200828552,0.6314825415611267,0.0005890429019927,0,1
post_1,post_1_6_1_1,0.0,1.0,"Yeah new line cinema owns the Friday the 13th name, the original writer owns the first movie minus the name, and horror inc owns everything else.

Thankfully because Jason is only really a character in part 2 onwards and already has movies where it's just ""Jason: subtitle"" horror inc can kinda dance around the issue by not referencing the events of the first movie which still sucks but isn't as bad as it could have been.",0.1191249430607262,0.005312442779541,0.9995929598808287,0.0004299283027648,0,0
post_1,post_1_7,0.0,1.0,"It's really hard to tell what to think about this game. Stuff like this looks great. I never played the beta, but it looks like it's full of personality. But then you see the gameplay they've been showing on twitter, and it looks like when you're playing Tekken and your opponent is playing on a pc that can barely run the game. I'll probably end up giving it a try regardless, but I'm very reserved on it right now.",0.0238942612575383,0.0065284967422485,0.9949148893356324,0.8310416638851166,0,1
post_1,post_1_7_1,0.0,1.0,"FWIW during the beta I had similar issues with the gameplay footage but I found that it felt way better to play than it looked. Granted they’ve changed a lot since then and I’m not sure if I’m a fan of the crazy hitstun they’ve added on every move but I have faith in the dev team. 

I don’t think it’s a very good “esports” game compared to any other smash-like but it’s a lot of fun to mess around with, especially if you have a friend to play with",0.0291178648445503,0.2179130911827087,0.9988896250724792,0.880206823348999,0,1
post_1,post_1_8,0.0,1.0,Will there be a way to just buy all characters/stages straight up?  I've been trying to research this but getting conflicting information.,0.0236848565995291,0.0113789439201354,0.9062198400497437,0.0002265870571136,0,1
post_1,post_1_8_1,0.0,1.0,"No. It’s a live service game with an infinite spending cap. To get all the characters, you need to buy them individually (with real money purchase or ingame earned currency), unless they’re currently in the battlepass which means you need to buy the battlepass. After the 2-month battlepass is over, you can then buy the character separately (same currency options as before).",0.0297833397186292,0.0074753165245056,0.8963876366615295,0.0001221001148223,0,0
post_1,post_1_8_1_1,0.0,1.0,Pretty sure they're putting out a challenge to unlock characters as well after their bp ends,0.0290165623913754,0.0071320533752441,0.8950899839401245,0.8373847007751465,0,1
post_1,post_1_8_1_2,0.0,1.0,You can unlock them through play also after the battlepass is over,0.0299100835564387,0.170228362083435,0.9375796914100648,0.8458451330661774,0,1
post_1,post_1_8_1_3,0.0,1.0,"Alright thanks for the response, I'll pass.",0.0233164632278566,0.6894009113311768,0.9964845180511476,0.0105964541435241,0,0
post_1,post_1_8_2,0.0,1.0,"I'm not sure if they have spoken about it but all characters were available in ""local play"".

Edit: During the early access period",0.023762952927488,0.0075653791427612,0.9961979985237122,0.0005432367324829,0,1
post_1,post_1_9,1.0,0.0,"i dont know why they want to burn money. this game already failed onnce, it will fail again and burn a studio to the ground",0.3702865253465148,0.0180982947349548,0.999765932559967,1.4007091522216795e-05,0,1
post_1,post_1_9_1,0.0,1.0,It didn’t need to fail that first time. The foundation and ideas for the game were solid but the developers were in way over their head when it came to supporting it. Which is why the game going on a year long hiatus and the team expanding is good. For their sake they better have learned the right lessons because there is a market for a free to play platform fighter featuring its own roster of iconic characters.,0.0252888202026622,0.0131700634956359,0.9989880919456482,0.0001218616962432,0,0
post_1,post_1_9_1_1,0.0,1.0,People to seem weirdly anticipatory of this game's downfall. There's been a lot of gloom and doom about its chances and its expected lifetime. Sometimes it feels like people are more excited to see a game fail than they are for it to succeed.,0.0276930889994447,0.0103289484977722,0.9600667357444764,3.0994415283203125e-05,0,0
post_2,post_2_0,0.0,0.0,"Insomniac Games about Marvel's Wolverine: ""We'll share news when the time is right, and the right time isn't now.""",0.0272635620957222,0.3932130336761474,0.9995368719100952,0.0048142969608306,0,1
post_2,post_2_0,0.0,1.0,"Was anyone expecting news? Everything we've seen about this game is very far off, if the leaks we did see are anything to go off, they're far more likely to talk about the Venom game out next year according to the leaked schedule. 

This just kinda feels like an empty post, ""no news"" is I guess news, but not much to talk about.",0.0251051588663308,0.5591893792152405,0.9993208646774292,1.9073486328125e-06,0,1
post_2,post_2_0_1,0.0,1.0,"I'd imagine the Spider-Man 2 DLC will take priority at the moment in terms of announcements, *potentially* with a Venom tease",0.0281813207444671,0.0129810571670532,0.9820924997329712,0.0148845314979553,0,1
post_2,post_2_0_1_1,0.0,1.0,Assuming we even get Spider-Man 2 DLC. We haven't had any official news on that front.,0.0271796941924409,0.4639443159103393,0.761448860168457,0.0008636116981506,0,1
post_2,post_2_0_1_1_1,0.0,1.0,"True, although I believe the Insomniac leaks did show us there was at least a plan for three DLC's at one point in time. The first featuring Beetle, the second focusing on Carnage, and a third revolving around Spider-Verse.",0.0246213860000424,0.1102623343467712,0.8726112246513367,0.1325472593307495,0,0
post_2,post_2_0_1_1_1_1,0.0,1.0,"Right, but that's all leaks, and there's a good possibility that at least 2 of those things got yanked into the Venom game.",0.0257979433334808,0.0521818399429321,0.9997101426124572,0.0005933046340942,0,0
post_2,post_2_0_1_1_1_1_1,0.0,1.0,"That Carnage side quest in Spider-Man 2 just abruptly ends before anything meaningful happens, I really hope they don’t pull the Carnage DLC into Venom.",0.0322183522689895,0.6838749051094055,0.9970391988754272,0.0142761766910552,0,1
post_2,post_2_0_2,0.0,1.0,People just have Wolverine on the brain with the new Deadpool film coming in two months. Though it's been a very long time since video games had any sort of synchronicity with other media like that.,0.0294489074812779,0.0146467089653015,0.9063339233398438,0.0006374418735504,0,1
post_2,post_2_0_2_1,0.0,1.0,"Not only that, but X-men '97 too. Here's hoping Marvel is secretly publishing a new throwback X-men beat 'em up in the style of TMNT: Shredder's Revenge to release in the meantime. They gotta strike while the iron is hot!",0.1394931556777021,0.0087097883224487,0.9997574687004088,0.9700063169002532,0,1
post_2,post_2_0_2_1_1,0.0,1.0,"According to the licensing terms, I think Insomniac and Sony would be the only one with the rights to make and publish an X-Men game of any genre.

However, if the game featured Marvel as a whole outside of just the X-Men, the terms of the agreement allow X-Men characters to be included, however they cannot be used as a console exclusive for Xbox or Nintendo.

So, new X-Men beat-em-up is probably out of the question, but a Marvel beat-em-up that includes X-Men characters would be perfectly allowed under the exclusivity deal that was included in the leaks.",0.0254496795469126,0.0058576464653015,0.933386504650116,0.0006106197834014,0,1
post_2,post_2_0_2_1_1_1,1.0,2.0,"You've missed that in said licensing agreement, there are a series of X-Men titles from the 90's that are exempt from the rule. They specifically make an exception for them, so I'd wager that there is indeed a non-PlayStation retro beat 'em up collection on the horizon

You're right however in that no *new* X-Men games can be published without Sony's approval outside of games that have team members as part of an ensemble cast. So stuff like Ultimate Alliance or Marvel vs Capcom can still feature X-Men characters

Another notable exception is that Deadpool is not listed among the characters that PlayStation have permission to use as part of these future X-Men titles",0.0255349931058855,0.0050834417343139,0.85445636510849,0.0001590251922607,0,0
post_2,post_2_0_2_1_1_1_1,1.0,0.0,"Yes I didn't think that needed to be mentioned since the person I was replying to explicitly was asking about NEW games, so re-releases of old games didn't need to be mentioned, because the discussion was about new games.",0.0238389890852136,0.0300945043563842,0.998499870300293,0.0839369595050811,0,0
post_2,post_2_0_2_1_1_2,0.0,1.0,"No wonder Midnight Suns wasn't strictly an X-men game. Ugh. I really hope Insomniac's next Marvel game hits hard with fans, because if not we might end up down the same rabbit hole that Star Wars landed in with EA.

Dont get me wrong, I'm a big fan of SW: Battlefront and Fallen Order, and a lot of what Insomniac has done so far, but I'm tired of franchises being restricted to specific devs like this.",0.0451455172856625,0.012882649898529,0.9997616410255432,5.054473876953125e-05,0,0
post_2,post_2_0_2_1_1_2_1,0.0,1.0,"TBF, in addition to that, Marvel had just come off a LONG campaign of character assassinating X-Men, as I dont think they ever expected to get the rights back from Fox. 

Marvel basically tried to replace Mutants with Inhumans, and set up a lot of story lines in the comics between 2007 and when Disney acquired Fox that made X-men kinda suck (only really turning around in 2019 with House of X). Its why Kamela Khan was an Inhuman (though now they've hilariously retconned that either she's a mutant or both), and why in the shows they were setting up stories that were carbon copy mutant stories just as ""inhumans"" instead. 

Funnily enough, since 2019, Inhumans have basically vanished from the comics. I think Black Bolt has had less than 5 appearences since 2019, and he's one of the most important characters in the Marvel world.

Basically, I dont know if Marvel or the developers were confident that having JUST Xmen characters would be enough when they've only recently been regaining popularity.",0.0353486867388329,0.0057432055473327,0.9997097849845886,7.623434066772461e-05,0,1
post_2,post_2_0_2_1_1_2_1_1,0.0,1.0,Hopefully if Deadpool and Wolverine does well enough Marvel will remember what a massive cash cow the X-men franchise is and start going all in on it again.,0.0752525359562878,0.0925427079200744,0.9972047209739684,0.7562199831008911,0,0
post_2,post_2_0_2_1_1_2_1_1_1,0.0,1.0,"Theyve been working on it, the House of X storyline was  one of the biggest comic storylines in a while, and really helped to re-establish the X-men as Marvel royalty",0.0254057302842643,0.0070939064025878,0.5473889708518982,0.9997768104076384,0,0
post_2,post_2_0_2_1_2,0.0,1.0,"That would make me so, so happy. Which means it'll never happen.",0.0345800806916523,0.6324564814567566,0.9974491000175476,0.9990383386611938,0,1
post_2,post_2_0_3,0.0,1.0,"Yeah it's just a response to twitter spam, should have been ignored by Insomniac, should be ignored by us.",0.0910392450209526,0.0049723982810974,0.9996211528778076,5.370378494262695e-05,0,1
post_2,post_2_0_4,0.0,1.0,"Probably just them getting ahead of all the upcoming shows (state of play, summer game fest) when people start clamoring for things. Let people know they won't see anything now so they don't get bummed when it's not there, makes sense to me.",0.0270168419466505,0.0126012563705444,0.9996336698532104,0.0072934925556182,0,1
post_2,post_2_0_5,0.0,1.0,The hack said it was coming out in 2025. If it was the 1st half of 2025 then maybe.,0.0251393852120082,0.0158032774925231,0.8277015089988708,6.115436553955078e-05,0,1
post_2,post_2_0_5_1,1.0,0.0,"Nope, the leaked schedule places it in late 2026. Venom was slated for late 2025.",0.0278890834360286,0.5931299924850464,0.9964183568954468,0.0007541179656982,0,0
post_2,post_2_0_5_2,0.0,1.0,I thought it was venom 2025 and wolverine 2026?,0.0285868964098275,0.6530142426490784,0.6898397207260132,0.0005789697170257,0,1
post_2,post_2_0_6,0.0,1.0,"I didn’t really expect anything from Insomniac, but I expected Sony first party studios to release games almost as often as they did it on PS4.",0.0328924938908903,0.0057846903800964,0.982419729232788,0.0094143152236938,0,1
post_2,post_2_1,0.0,1.0,"Leaks said 2026.

Leaks also said they have a spiderman 2 mini sequel like Miles Moralas in 2025.   I will guess we won’t hear about wolverine until they reveal that spider man game.

I could see next years Sony summer showcase having a big reveal for the Spider Man game announced as ""coming this holiday"" then cutting to a teaser for Wolverine coming in 2026.",0.0257306101014612,0.0072996020317077,0.979694664478302,1.901388168334961e-05,0,1
post_2,post_2_1_1,0.0,1.0,"The 2025 ""*mini sequel*"" as per the leak should be Venom

There's also mention of a Silk spin-off, which I'm guessing will likely be the ""*mini sequel*"" after Spider-Man 3",0.0275100479070868,0.3680214285850525,0.7430576086044312,0.0016293227672576,0,0
post_2,post_2_2,0.0,1.0,They have put out FOUR very high quality AAA games since 2018. If any developer deserves to take their time with their next game its them.,0.0252266296474133,0.8860146999359131,0.9982335567474364,0.999893456697464,0,1
