PostID,CommentID,Combative,Deliberative,Text,Toxicity,Rationality,Mutual Respect,Emotion,Moderator,Diversity
post_3,post_3_4_1,0.0,1.0,"Thank you. I'm glad you enjoyed our experience!

I would say that it wasn't necessarily regret, more so an understandable sacrifice. For example, we didn't have time to implement a true fog of war system because we had other elements (combat, enemy AI, etc.) that would  give the player a better experience overall. There was a few of those, hah! 

One element that did get cut that didn't make sense was that the player could flip between 4 masks (Maskless counted as a masked state to a degree). When playing it over and over, it didn't make sense so we went down to 2 masks.

I'd say there are many elements I'm proud of with this game, but the biggest one is the Reflection moments - the player simply sitting under a tree and increasing their chances of survival by speaking about how they feel.",0.0237338446837421,0.012682020664215,0.9973013997077942,0.0112436115741729,0,0
post_3,post_3_4_1_1,0.0,1.0,Really enjoyed those as well as other lore elements of this universe. I was especially engrossed by the stories of the past shamans. Were those inspired by any specific Bantu myths? It would actually be really cool to play as one of them in a future game. And again kudos to the writers who came up with those stories!,0.0244550908573599,0.0051175355911254,0.697488009929657,0.9996282160282136,0,0
post_3,post_3_4_1_1_1,0.0,1.0,All the past Shaman stories actually play into the deeper lore of the Kenzera universe hah! So all came from our heads!!,0.0406173860539937,0.0077064037322998,0.7926472425460815,0.1097922623157501,0,0
post_3,post_3_5,0.0,1.0,"Hey man. Thanks for doing this AMA; super pumped to see you as Alyn of Hull. I'm sorry for asking a not-games question...


But is that rumored Raised by Wolves graphic novel series happening?! Best sci-fi in a decade and it did not deserve its end. I have a physical NEED to find out where it was going.",0.0284198305250965,0.3908196091651916,0.9997537732124328,0.9960592985153198,0,1
post_3,post_3_5_1,0.0,1.0,"Thank you for the question! No need to apologise hah!

In truth, I wish I knew. All I know though is that I have my eyes on that IP, and I know the team know it haha. It's all about getting to a point of success that I can...well, just have fun haha!",0.0270223784324657,0.0184841156005859,0.9991313815116882,0.9914261400699615,0,0
post_3,post_3_6,0.0,1.0,"Hey, I thoroughly enjoyed the game.  Did the game go through some different genre ideas or was it always intended to be a side scrolling metroidvania from the beginning?",0.024810325317892,0.2855364680290222,0.9952810406684875,0.9996712505817412,0,1
post_3,post_3_6_1,0.0,1.0,"Always intended to be a side-scrolling adventure. The metroidvania aspect was always an inspiration from the get-go too. It was definitely a balancing act between telling a ""linear"" story through the metroidvania structure and in the time we were given though!",0.025444870324417,0.2809714674949646,0.9919541478157043,0.9998286366462708,0,0
post_3,post_3_7,0.0,1.0,You were so good in Raised by Wolves and its cancellation is one of the most tragic show cancellations of my life; did you get any answers or were you left on as much of a cliffhanger as us viewers?,0.0458724526648521,0.005361258983612,0.9980220794677734,0.0001949369907379,0,1
post_3,post_3_7_1,0.0,1.0,No. And it kills me everytime. :(,0.3184949083213199,0.5421507358551025,0.9982554316520692,0.0018417835235595,0,0
post_3,post_3_8,0.0,1.0,I bought and played your game. I enjoyed it and was pleasantly surprised by its story.,0.027198939169206,0.0740565061569213,0.559547483921051,0.9968761503696442,0,1
post_3,post_3_8_1,0.0,1.0,I'm happy you enjoyed! And thank you for buying the game!,0.0242062834602176,0.1450284719467163,0.9692490100860596,0.9967642724514008,0,0
post_3,post_3_9,0.0,1.0,"Hello Abubakar! Thank you so much for bringing this game to us. Loved hearing you on friends per second, your approach to building a game and only implementing things that serve the story that you want to share was eye opening. 

Do you have advice for someone who aspires to create a game but struggles with visualizing the finer details? Seeing games like Stardew Valley and Animal Well being developed and published by individuals gives me hope that I can do it. 

What were some pitfalls that you ran into when developing ToK:Z?

Also how was it talking to the FPS crew?

Thanks a bunch!!",0.0254364757388011,0.7026494145393372,0.999373733997345,0.9777688384056092,0,1
post_3,post_3_9_1,0.0,1.0,"Thank you for playing. 

I would say the biggest advice I can give is to find the time to just do it. Start slowly and just start somewhere. Zau started with the idea of depicting grief and with the character. The level design element started with me drawing on paper. If you can get the ball rolling, you'll find those finer details the deeper you get into it. It's just about giving yourself that small push. Pirate Software is a great person to listen to in regards to just getting into making games!

The FPS crew are awesome. Wholesome people who love games and the people within it. Truly, that's the thing I'm seeing more and more of the deeper into the industry I get - it's full of wonderful people who care about it as an art form.",0.0242198527088927,0.0310099124908447,0.99946266412735,0.9999303221702576,0,0
post_3,post_3_10,0.0,1.0,"How has voice acting changed how you view the production side of video games, like with Tales of Kenzera: ZAU? Also thank you for making Bayek come to life!",0.0346134405057106,0.3846144080162048,0.9878941178321838,0.9992755353450776,0,1
post_3,post_3_10_1,0.0,1.0,"Bayek was such a great role to play! 

I would say that it's given me a much deeper respect for how hard it is for developers and studios to give the actor what they fully require in order to do their job! You learn that a lot of VA work relies on having a story and an idea of where the character is going, which, in game dev, can change any minute!

For example, we recorded all of Tales of Kenzera's dialogue in two weeks. We then implemented it in game, realised some bits didn't make sense, and needed to do an additional week of pick ups. From the actors perspective, you're like ""But it made sense to me!"" but from a Devs perspective, you gotta think about the whole user experience and flow and pacing as a whole!

It's another puzzle in itself haha!",0.0426499490988013,0.0129704475402832,0.9976488947868348,0.9995281994342804,0,0
post_3,post_3_11,0.0,1.0,"Hello Mr. Salim, I am currently working through the game's first act. It's always great to see some African representation in this medium that has far too few examples to point to, in my opinion! 

That being said, what were some of the African cultures you and the team drew inspiration from when creating this game? Thanks in advance!",0.0246361206338785,0.0960362553596496,0.5040868520736694,0.9996027648448944,0,1
post_3,post_3_11_1,0.0,1.0,"Great question! Many! Maasai, Zulu, Xhosa, Ndebele, Tswana, Kuba... We drew from quite a few - some stronger than others!",0.0398739501038926,0.0258891582489013,0.9628032445907592,0.9984400272369384,0,0
post_3,post_3_11_1_1,0.0,1.0,"Thanks for your answer, I love how these diverse influences came together to create such a beautiful tale that we all experience no matter your cultural background.",0.0227058920663125,0.0147089958190917,0.7770548462867737,0.9991251528263092,0,0
post_3,post_3_12,0.0,1.0,Will there be a physical edition of the game at some point down the line?,0.0268749978843815,0.8608378171920776,0.99570894241333,0.0318188965320587,0,1
post_3,post_3_12_1,0.0,1.0,"At the moment, there is no plan I'm afraid. The cost of a physical edition is hard for a small studio. But I definitely want to do it! We just need to keep selling and pushing the digital at the moment :D

In regards to a limited edition, there's something interesting there...but for now, yeah, totally digital for the time being!",0.0257617281385206,0.0052651166915893,0.9881006479263306,0.999986469745636,0,0
post_3,post_3_12_2,0.0,1.0,"Just wanted to second this. I’d love to experience the game, but for now I am holding out hope for a physical release! Would love to know if this is something you have explored, even in a limited print capacity.",0.0236565196125547,0.2104163169860839,0.7803820967674255,0.115005999803543,0,1
post_3,post_3_13,0.0,1.0,"Hey Abubakar - I had the privilege of very briefly meeting you at the Video Game Awards CAA afterparty, we had a very short exchange shortly after you came in, so it was likely a two ships passing in the night situation given how many others we met that evening. 

I've been where you are, being on a stage you aspired to, losing a parent that encouraged and supported you to follow your passions. It's hard, and dealing with the grief is too real, often visceral. 

I wanted you to know that as a fellow game maker, releasing a game, especially one that is so intimate and personal is no small feat. I have no questions. I'd just like to say I hope you and your team are immensely proud of this accomplishment. I know what it's like to put your everything into a work of art, and from one person who has been there to another, I'm proud of you and hope this experience has allowed you to process your grief meaningfully.

Congratulations on releasing Kenzera, it's a beautiful game, and I hope it leads to future opportunities for Surgent Studios to tell more intimate and healing stories.",0.0273034797603958,0.0166100859642028,0.999512791633606,0.9998354315757751,0,1
post_3,post_3_13_1,0.0,1.0,"This is so magical to read. Thank you for this. Do reach out, it would be wonderful to connect again.",0.0226904170580328,0.5755608677864075,0.9905320405960084,0.9994264841079712,0,0
post_3,post_3_14,0.0,1.0,"Hello there, Mr. Salim. I absolutely loved Tales of Kenzera. You and your team should be proud of the beautiful game you created.

My question is: You mentioned your love for the Kingdom Hearts series during The Game Awards 2023. As a big KH fan: What's your favorite thing about Kingdom Hearts? And, did KH had any influence on ZAU?",0.0246016874491891,0.0091960430145263,0.9957091808319092,0.987462967634201,0,1
post_3,post_3_14_1,0.0,1.0,"I'm so glad you enjoyed! The title screen just before you start the game was inspired by KH1!

My favourite thing about KH is definitely it's story. At a time I felt where I wasn't exposed to many vulnerable characters, Sora was the one. I really connected and resonated with Sora's journey. So yeah, for me, it was it's story, world, and characters.",0.0240279081108087,0.0045918822288513,0.999303102493286,0.9998996555805206,0,0
post_3,post_3_15,0.0,1.0,"Dude - loved the playthrough - my wife watched and was equally entertained. You and the guy who voiced Kalunga were an awesome duo and I hope that you work together again!

My question is - as a player - I'm concerned that the industry is going through some weird period of like ""art games fail/live service all the way""... You got games like Hi-Fi Rush from Tango being closed down and word that Hellblade isn't performing well... So how the hell do we support the artistic side of games, like the ones we don't see all the time, if they're not being given the time of day?",0.1054780390852024,0.0077543854713439,0.999763548374176,0.9996429979801178,0,1
post_3,post_3_15_1,0.0,1.0,"This is such a HUGE topic of discussion. Hmmmm.

Truthfully, the only and BEST way of supporting the artistic side of the games industry I WOULD SAY, is to buy the games and share your thoughts and feedback. Don't get me wrong, Game Pass and PS+ are WONDERFUL tools for exposure, but there is a real power in buying the game and sharing it with friends.

I would say just trying new games where and when you can also. Aware that it's difficult to commit all your time to new experiences, but one can lead to another you know?",0.0274166429859182,0.4688107371330261,0.9037727117538452,0.9991434514522552,0,0
post_3,post_3_16,0.0,1.0,"No question, just want to say I really appreciate the passion and love you and the team put into the game.

Also, the nuances in your performance as Father were really incredible, can't wait to see you in HoD.",0.0260061216412769,0.0062949061393737,0.999025821685791,0.9988875687122344,0,1
post_3,post_3_16_1,0.0,1.0,Really appreciate it. Thank you.,0.0234095685144486,0.3619043827056885,0.9861502051353456,0.9922421276569366,0,0
post_3,post_3_17,0.0,1.0,"I don't have a question but I just wanted to mention that your interviews on the friends per second and play watch listen podcasts sold me on buying your game. It was on my radar previously, but likely would have sat on my steam wishlist for 1+ years. Your passion for what you've created though just seeped through that interview and that convinced me. I look forward to playing it soon.",0.0248990629409819,0.0391487479209899,0.9979731440544128,0.9984563589096068,0,1
post_3,post_3_17_1,0.0,1.0,Thank you. I was fortunate to have great people around me who allowed me to share my passion without any filter. I truly adore games - there is SO MUCH to love about games. I want to be a part of that.,0.0245873938230837,0.0142370462417602,0.8293225169181824,0.997492015361786,0,0
post_3,post_3_18,0.0,1.0,"Great game man. I still haven't finished it, but loving every moment. Especially appreciate the team drawing their inspirations from African cultures and executing them very well! It was a pleasant surprise to understand the various myths behind evem the smallest of enemies. Really gave a lot of depth to the lore. 

My question is how did adding it as a Day 1 Playstation Plus release affect the sales? Were you satisfied with the numbers or was the relationship with Sony more important at the moment?",0.0233879745773666,0.0097737908363342,0.993952453136444,0.9997833073139192,0,1
post_3,post_3_18_1,0.0,1.0,"I'm so glad you're enjoying and having a good time with it.

Day 1 PS+ helped MASSIVELY. The support given to us by those folks got it into more hands than we could possibly imagine. It's now about building on top of that.

Players are so important, and I feel like when they enjoy an experience, following through with a purchase helps the developers on SUCH a scale :)",0.0232859195076341,0.0085100531578063,0.9675902724266052,0.9993362426757812,0,0
post_3,post_3_19,0.0,1.0,"Hello there. I only heard you in AC Origins, but you were great in it. I do have a question that I’m not sure you can answer; did your game sell well when it released? I admit I was a bit worried for it as it was a kind of busy time for games and I feared this one would be buried beneath the others.",0.0236364208178072,0.3686533570289612,0.9996635913848876,0.8494245409965515,0,1
post_3,post_3_19_1,0.0,1.0,"It was a busy time! We did good though :) It helps being on multiple platforms.

It's all about longevity and continuing forward. The more people share and talk about the game, the more it snowballs. So yeah, we hope to continue building!",0.0253938445929349,0.0053794384002685,0.7907248735427856,0.9934719204902648,0,0
post_3,post_3_19_1_1,0.0,1.0,Excellent. I’m glad it payed off.,0.026076046159907,0.2102676033973693,0.9935573935508728,0.9984017610549928,0,0
post_3,post_3_20,0.0,1.0,Are there any plans on expanding this beautiful world with an expansion or sequel? I thought the bosses in this game were really solid and I would love to see more.,0.0235355160515535,0.0151590704917907,0.8302417397499084,0.9451390504837036,0,0
post_3,post_3_20_1,0.0,1.0,"Thank you! And there is a lot to learn and build upon what we've conjured. Player feedback has been so useful, so it's about listening and building ontop!",0.0242368549212357,0.0157016515731811,0.5536354184150696,0.9983195662498474,0,0
post_3,post_3_21,0.0,1.0,"Great game and I look forward to seeing what your next project is. 

I'm glad you gave a shout out to Golden Sun on GBA, One of my favourite RPGs which I have a lot of love for. I hope the series makes a return",0.0254874652242294,0.0165596008300781,0.9961295127868652,0.9994721710681916,0,1
post_3,post_3_21_1,0.0,1.0,"Thank you so much and SO DO I!

I'm hopeful.",0.0239084884372394,0.4615327715873718,0.8950347900390625,0.9967511594295502,0,0
post_3,post_3_22,0.0,1.0,Hey Abu! Loved your work with the Glass Cannon Network  and your Golden Sun shoutout made you my hero haha. Will checkout your game when cash and time  allows!,0.0727151120847166,0.0175069570541381,0.9992467164993286,0.9946693181991576,0,1
post_3,post_3_22_1,0.0,1.0,Thank you! I love TTRPG so Glass Cannon and the team there are my peeeeeople!,0.3729355531133125,0.3504300117492676,0.999711811542511,0.997281938791275,0,0
post_3,post_3_23,0.0,1.0,"Hey man! I just rolled credits on Tales of Kenzera Zau and absolutely loved the game. Fantastic emotions, story, voice acting, gameplay elements, traversal, combat mechanics. Great for completionists also! 

My question for you : now that you have this debut title which is an incredible starting point for your studio, do you see this game as the closure you needed wirh the loss of your father and now you may look forward to other game types, IP, or stories -- or continue the journey of Zau? 

Keep doing what you do and love!",0.0424393380758813,0.009306252002716,0.9995736479759216,0.999910682439804,0,1
post_3,post_3_23_1,0.0,1.0,"I'd say this game provided me a space to express and help connect me with others who are also going through the journey of grief. I don't think the game, or anything can ever provide me closure. But I don't think we should seek closure from it.

There is such a power to be drawn upon when going on the journey of grief. It reminds us that we can be loved and have the capacity to love. It shows us we're human. If anything, this game has definitely empowered me, and I feel others too.

In regards to future journeys... guess we have to wait and see!",0.0256969866173188,0.4391048550605774,0.9995635151863098,0.9999050199985504,0,0
post_3,post_3_23_1_1,0.0,1.0,"Lovely response, thank you!",0.0242189358311876,0.2041250467300415,0.9966439008712769,0.9947343170642852,0,0
post_3,post_3_24,0.0,1.0,"Your game looks fun, I hope it does well and look forward to seeing your next game project.",0.024544208061288,0.1845952868461609,0.8685192465782166,0.9921271204948424,0,1
post_3,post_3_24_1,0.0,1.0,Thank you!,0.0255501394781739,0.5309825539588928,0.5004305243492126,0.9651955366134644,0,0
post_3,post_3_25,0.0,1.0,"Hey there! How was developing your own game compared to your expectations? Was it harder or easier than you thought, for example? 

And having now ventured into games, do you think Raised by Wolves would translate well into one? Big fan of you on that show!",0.0611389060380791,0.3640458583831787,0.8098384737968445,0.9999656081199646,0,1
post_3,post_3_25_1,0.0,1.0,"It was super hard. Emotional. I knew it wasn't going to be easy, but ooof the obstacles! You never think of all the corporate and business elements you have to wrestle with while conjuring a studio AND a first time game.

Yes. In fact I already have an idea for a Raised by Wolves game. Can't share it though :P",0.0310048371619581,0.0167615413665771,0.999680519104004,0.0031489133834838,0,0
post_3,post_3_25_1_1,0.0,1.0,"Oh man, already patiently waiting for an announcement in a few years haha All the best to you and your team!",0.0259636075387828,0.006376564502716,0.9959399700164796,0.9993792176246644,0,0
post_3,post_3_26,0.0,1.0,"I really enjoyed the combat in Zau. Is there anything that you want to change and or want to do differently in your next game?

  
I really really LOVED Zau!",0.0261212586744529,0.0199176669120788,0.995306670665741,0.9990787208080292,0,1
post_3,post_3_26_1,0.0,1.0,I think I want to dive deeper into what we've begun exploring. The creation of Zau was also the creation of our studio and figuring out how the core team can work together to bring something to the table. The hope now is to continue building and progressing!,0.0230937840529392,0.5793941020965576,0.5609802603721619,0.9999704360961914,0,0
post_3,post_3_26_1_1,0.0,1.0,I love it!!! Can’t wait to see what the team comes up with next!,0.0346960219528884,0.653663158416748,0.9986528158187866,0.99978968501091,0,0
post_3,post_3_27,0.0,1.0,"usually pretty skeptical about new IPs, but saw your speech at the Game Awards, loved you as Bayek, and the vibe of this game just resonated so i was incredibly insterested. Then y'all put out a demo! and it was a straight pre-order from me, haven't got to it yet, but just wanted to let you know from what i played, Zau was awesome, hoping your studio can give us more passion projects like this!",0.0263373373749319,0.0056301951408386,0.9995598196983336,0.9999247789382936,0,1
post_3,post_3_27_1,0.0,1.0,Thank you so much. Really appreciate the support MASSIVELY.,0.0227542224849778,0.0141583085060119,0.9952229857444764,0.9752928018569946,0,0
post_3,post_3_28,0.0,1.0,"Hey, thanks for doing this AMA! I've got two questions:

1. What's for dinner today?

2. I remember seeing the Critical Role logo in the splash of logos at the start of the game. Could you talk about their involvement with the development of the game?

Thanks!",0.0248113118359844,0.5525525808334351,0.9813113808631896,0.1413319706916809,0,1
post_3,post_3_29,0.0,1.0,"Hi Abu, are there any talks for a potential sequel?",0.029952169242524,0.7652767896652222,0.9172922372817992,0.0004999339580535,0,1
post_3,post_3_29_1,0.0,1.0,That would be sharing too much ;),0.0294662971016143,0.947890043258667,0.9835257530212402,0.9577198028564452,0,0
post_3,post_3_30,0.0,1.0,were there any cast members you met on HotD that you got along with really well behind the scenes?,0.0278756057796785,0.0146200060844421,0.8709658980369568,0.9907633364200592,0,1
post_3,post_3_30_1,0.0,1.0,"Honestly, all of em. They're all brilliant and wonderful people.",0.0281955162398639,0.3719791173934936,0.9974836707115172,0.9988409280776978,0,0
post_3,post_3_31,0.0,1.0,"Your game and the story behind it are very moving. I didn’t know that you are going to be in House of the Dragon.

What made you decide to make a metroidvania? It is a pretty unconventional and interesting choice for a game with story emphasis. (Not a criticism)",0.0251217275805584,0.008690595626831,0.8199931383132935,0.9999762177467346,0,1
post_3,post_3_31_1,0.0,1.0,"The genre was an inspiration because for me it encapsulated the journey of grief PERFECTLY.

You are thrown into a large alien world, not really knowing where to go or what to do. Yet within this world it will provide you with the tools in order to maneuver around it. It will always be hostile to you, but over time, you will get more and more comfortable with it. You will never master it though. Sometimes you will feel it working with you, most of the time against you...or neither at all.

That to me is the journey of grief.",0.0284411456694478,0.3480130434036255,0.9980562925338744,0.9984531104564668,0,0
post_3,post_3_31_1_1,0.0,1.0,That’s actually quite profound. Thanks for answering!,0.0240897766862049,0.038989782333374,0.9929505586624146,0.9997913539409636,0,0
post_3,post_3_32,0.0,1.0,"Hello, Salim! Thank you for doing this AMA. What were the main metroidvania influences you and your team used for creating the game? I felt a bit of the Ori games, specially in some sections, but wanted to know if there were other strong influences you considered. Cheers.",0.0226350738262635,0.0741308331489563,0.9231510162353516,0.8808651864528656,0,1
post_3,post_3_32_1,0.0,1.0,"Ori, Guacamelee, F.I.S.T were definite influences. Ori has a real magic to it, specifically the Blind Forest, that we used as a touch stone!",0.0310578848434414,0.1926159262657165,0.8928893804550171,0.999954104423523,0,0
post_3,post_3_33,0.0,1.0,"Hey Abubakar, I haven't yet played Tales of Kenzera: ZAU but it's on my to-play-list and the game looks amazing from all the footage I've seen, bravo to you and the team!

I recently watched your hour long talk with Ben Starr and it was so enjoyable and insightful to listen to your experiences and thought processes! I'm wondering if you have any more plans to do similar videos with other guests or even have Ben return as a guest for more talks?",0.0257270785725089,0.0110320448875427,0.9994556307792664,0.9998047649860382,0,1
post_3,post_3_33_1,0.0,1.0,"Go and play! :D

I'm glad you enjoyed it. Funny you ask, we JUST dropped a conversation between [Me and Neil Newbon](https://www.youtube.com/watch?v=KPv9rykcEew)!

There will be a few more coming, keep your eyes peeled.",0.0503078665473072,0.3774301409721374,0.9997155070304872,0.9994175136089324,0,0
post_3,post_3_34,0.0,1.0,"Hello! I've been enjoying the game a lot, and I hole we get to explore more of the world in the future!

My question is a bit niche, but I am curious about the decision to include Swahili as a language choice. Were there any hard conversations about the decision to include it? I think it is a wonderful addition as a nod to the cultures that inspired the game, but I also understand there is a real question of resource allocation.",0.0268319156706438,0.0047441124916076,0.869333028793335,0.9998502135276794,0,1
post_3,post_3_34_1,0.0,1.0,"I'm glad you're enjoying it.

No resistance of adding Swahili! It was mainly the logistics of figuring out how we can make it work. But there is always a way :)",0.0251380850828882,0.4697583317756653,0.993831992149353,0.9952959716320038,0,0
post_3,post_3_34_1_1,0.0,1.0,I'm glad you did! Thank you!,0.0248478030401486,0.4847080707550049,0.904932141304016,0.990747094154358,0,0
